{"Name":"Andre Mcclain","Age":23,"Sex":"male","Country of Origin":"USA","State or Province":"South Carolina","Education Level":"High School","MBTI Personality":"INFP","Lifestyle":"architecture","Backstory":"Andre Mcclain grew up in a small town in South Carolina, surrounded by the beauty of nature and the charm of Southern hospitality. From a young age, he was always drawn to the aesthetic appeal of buildings and structures, often spending hours sketching and designing his own dream homes.\n\nAs he grew older, Andre's love for architecture only intensified. He would spend his free time exploring abandoned buildings and taking photographs of unique structures, always looking for inspiration for his next project.\n\nDespite his passion for architecture, Andre's family had other plans for him. They wanted him to follow in their footsteps and take over the family business, a small grocery store in town. But Andre knew deep down that his true calling was in the world of design and construction.\n\nAfter graduating high school with top honors, Andre made the difficult decision to pursue his dreams and attend college for architecture. His family was disappointed, but Andre knew he had to follow his heart.\n\nDuring his time in college, Andre excelled in his studies and was known for his creative and innovative designs. He also started an Instagram account to showcase his work and connect with other like-minded individuals in the architecture community.\n\nAs his Instagram following grew, so did his reputation in the industry. Many were impressed by his unique perspective and eye-catching designs. Andre's passion for beauty and his desire to find it in the world around him was evident in every project he took on.\n\nNow, at the age of 23, Andre has graduated with a degree in architecture and is ready to make his mark in the world. He has already landed a job at a prestigious architecture firm and is working on some exciting projects.\n\nBut for Andre, it's not just about creating beautiful buildings. He wants to use his skills and platform to make a positive impact on the world. He hopes to one day design sustainable and affordable housing for those in need and to bring beauty and functionality to neglected communities.\n\nWith his high beauty and high face, Andre is not just a talented architect, but also a compassionate and driven individual who is determined to use his talents for the greater good."}
{"Name":"Gregory Joseph","Age":19,"Sex":"male","Country of Origin":"USA","State or Province":"Iowa","Education Level":"High School","MBTI Personality":"ISFP","Lifestyle":"diy","Backstory":"Gregory Joseph was born and raised in a small town in Iowa, USA. He was the youngest of three children and was always the creative and free-spirited one in the family. His parents were hardworking farmers, and while they encouraged their children to pursue education and careers in practical fields, they always supported Gregory's love for art and self-expression.\n\nGrowing up, Gregory was a curious child who loved to explore and create. He would spend hours in his backyard, building forts, painting rocks, and making up stories. As he got older, he became more interested in DIY projects and started experimenting with different mediums like painting, sewing, and woodworking.\n\nIn high school, Gregory's artistic abilities caught the attention of his teachers and classmates. He was known for his unique sense of style and his ability to turn ordinary objects into works of art. While he was a good student and received decent grades, his true passion was always in creating and sharing his creations with others.\n\nAfter graduating from high school, Gregory decided to take a gap year to focus on his art. He spent most of his days working on different DIY projects and sharing them on social media. His Instagram account quickly gained a following, and people were drawn to his colorful and spontaneous content. His unique style and above-average beauty also caught the eye of many, and he became somewhat of an influencer in the DIY community.\n\nDespite his growing popularity, Gregory remained humble and down-to-earth. He used his platform to inspire others to embrace their creativity and express themselves through art. He also used his platform to raise awareness for environmental issues and promote sustainable living through his DIY projects.\n\nNow at 19 years old, Gregory has gained a significant following and has even started collaborating with brands and other artists. While he is still figuring out his future, one thing is for sure - he will continue to use his passion for DIY to spread positivity and inspire others to unleash their inner artist."}
{"Name":"William Wall","Age":23,"Sex":"male","Country of Origin":"USA","State or Province":"Oregon","Education Level":"High School","MBTI Personality":"ISFP","Lifestyle":"pets","Backstory":"William Wall was born and raised in the lush green state of Oregon, USA. Growing up in a small town surrounded by nature, William developed a deep love and appreciation for animals from a young age. His parents, both avid animal lovers, instilled in him a strong sense of compassion and responsibility towards all living creatures.\n\nAs a child, William spent most of his time outdoors, exploring the forests and lakes near his home. He was always drawn to the company of animals, whether it was a stray cat he found in the woods or a family of ducks swimming in the lake. His parents often joked that he had a special connection with animals, as they seemed to gravitate towards him.\n\nDespite his love for animals, William also had a creative side. He was always doodling in his notebook or creating elaborate sandcastles at the beach. As he grew older, his passion for art and creativity only intensified. He would spend hours lost in his own world, painting and sculpting, creating beautiful pieces of art that captured the essence of nature and animals.\n\nAfter graduating high school, William decided to pursue a degree in Fine Arts, with a focus on animal-inspired artwork. He moved to the city, eager to explore new opportunities and immerse himself in the art scene. But even in the hustle and bustle of the city, William couldn't stay away from nature for too long. He would often take spontaneous trips to the nearby mountains or beaches, always accompanied by his trusty camera to capture the beauty of his surroundings.\n\nIt was during one of these trips that William discovered his love for photography. He started taking pictures of the animals he encountered, capturing their unique personalities and quirks. He then started posting these pictures on his Instagram account, which quickly gained a following of animal lovers from all over the world.\n\nNow, at 23 years old, William has graduated with a degree in Fine Arts and has established himself as a successful freelance artist and photographer. His Instagram page is filled with stunning pictures of animals and landscapes, showcasing his love for both nature and art. He continues to travel and explore, always on the lookout for his next inspiration and adventure.\n\nWith his high beauty and an infectious smile, William's easygoing and flexible nature has made him a favorite among his friends and followers. He is a true free spirit, unapologetically following his passions and living life on his own terms. And through his art and photography, he hopes to inspire others to appreciate and protect the beauty of nature and all the creatures that call it home."}
{"Name":"Virginia Chapman","Age":24,"Sex":"female","Country of Origin":"USA","State or Province":"Pennsylvania","Education Level":"Bachelor","MBTI Personality":"ISFJ","Lifestyle":"cooking","Backstory":"Virginia Chapman was born and raised in a small town in Pennsylvania, USA. Growing up, she was always surrounded by the delicious aromas of her mother's home-cooked meals. From a young age, Virginia developed a love for cooking and experimenting with different flavors and ingredients.\n\nAs she got older, Virginia's passion for cooking only grew stronger. She spent countless hours in the kitchen, perfecting her skills and creating new recipes. Her family and friends were always amazed by her culinary creations and encouraged her to pursue a career in the culinary arts.\n\nAfter graduating from high school, Virginia decided to attend a prestigious culinary school in New York City. She excelled in her studies and graduated with a Bachelor's degree in Culinary Arts. During her time in New York, Virginia also gained valuable experience working at various restaurants and catering events.\n\nDespite her success in the culinary world, Virginia felt like something was missing. She had always been a compassionate and empathetic person, and she wanted to use her talents for a greater purpose. That's when she discovered her love for community service.\n\nVirginia began volunteering at local soup kitchens and food banks, using her cooking skills to provide nutritious meals for those in need. She also started using her social media platform to raise awareness and funds for various charitable causes. Her posts showcasing her volunteer work and delicious recipes quickly gained a large following, and Virginia became known as a social media influencer with a heart of gold.\n\nNow, at 24 years old, Virginia continues to use her platform to spread love and positivity. She has even started her own non-profit organization, where she hosts cooking classes for underprivileged youth, teaching them valuable skills and providing them with healthy meals.\n\nWith her high beauty and an even higher spirit, Virginia has become an inspiration to many. Her passion for cooking and giving back to her community has not only brought her success but also fulfillment and purpose in life."}
{"Name":"Deborah Potter","Age":33,"Sex":"female","Country of Origin":"Canada","State or Province":"Quebec","Education Level":"Bachelor","MBTI Personality":"ESTP","Lifestyle":"dancing","Backstory":"Deborah Potter was born and raised in Quebec, Canada, in a small town surrounded by nature. Growing up, she was always a free spirit, full of energy and curiosity. Her parents, both artists, instilled in her a love for creativity and self-expression. But it was her grandmother who introduced her to the world of dance, and it quickly became her biggest passion.\n\nAs a child, Deborah spent most of her time in the dance studio, perfecting her technique and exploring different styles. She excelled in ballet, but also enjoyed the freedom and expression of contemporary and jazz. Her dedication and hard work paid off when she received a scholarship to study dance at a prestigious university in Montreal.\n\nDeborah's time at university was a whirlwind of late-night rehearsals, intense training, and new friendships. She graduated with a Bachelor's degree in Dance and moved to the bustling city of Montreal to pursue her dreams of becoming a professional dancer.\n\nBut life as a dancer was not as glamorous as Deborah had imagined. She struggled to find steady work and often had to take on multiple jobs to make ends meet. Despite the challenges, Deborah never gave up on her passion for dance. She continued to take classes and attend auditions, determined to make a name for herself in the competitive world of dance.\n\nIt was during this time that Deborah discovered the power of social media. She started posting videos of her dancing on Instagram, and to her surprise, they gained a lot of attention. People were drawn to her infectious energy and the joy she exuded while dancing. Soon, she had a growing following of people who were inspired by her love for dance.\n\nDeborah's Instagram became a platform for her to share her passion with the world. She started collaborating with other dancers and choreographers, creating visually stunning and emotionally charged performances. Her posts also showcased her love for life, featuring spontaneous adventures and high-energy activities like hiking, surfing, and rock climbing.\n\nAt 33 years old, Deborah may not fit the traditional mold of a professional dancer, but she doesn't let that hold her back. She embraces her average beauty and ordinary face, knowing that it's her passion and zest for life that truly sets her apart. Through her dancing and social media presence, Deborah hopes to inspire others to pursue their passions and live life to the fullest."}
{"Name":"Sandra White","Age":22,"Sex":"female","Country of Origin":"USA","State or Province":"Florida","Education Level":"No High School","MBTI Personality":"INFJ","Lifestyle":"astrology","Backstory":"Sandra White was born and raised in the sunny state of Florida, USA. She grew up in a small town with her parents and two older brothers. From a young age, Sandra was always fascinated by the stars and the mysteries of the universe. Her parents, who were both avid stargazers, encouraged her curiosity and nurtured her love for astrology.\n\nHowever, despite her passion for the stars, Sandra struggled in school. She found it difficult to focus and often felt misunderstood by her teachers and peers. As a result, she dropped out of high school at the age of 16. Her parents were disappointed, but they understood that traditional education was not the right fit for their daughter.\n\nWithout a high school degree, Sandra felt lost and unsure of her future. She took on odd jobs to make ends meet, but her heart was not in it. It wasn't until she discovered Instagram that she found her true calling. She started posting about astrology, sharing her knowledge and insights with the world. To her surprise, her posts gained a lot of attention and she quickly gained a following of like-minded individuals.\n\nAs her following grew, so did her confidence. Sandra realized that she had a gift for connecting with people and inspiring them through her words. Her posts were not just about astrology, but also about self-love, empathy, and creating a better world. Her followers were drawn to her deep insights and her ability to see the beauty in everything and everyone.\n\nSandra's appearance also added to her allure. With her long, flowing hair, piercing blue eyes, and a face that seemed to radiate positivity, she was often described as having \"very high beauty and a very high face.\" But what made her truly beautiful was her kind heart and her unwavering belief in the power of love and compassion.\n\nToday, at the age of 22, Sandra has become a well-known figure in the world of astrology. She has traveled to different countries, giving talks and workshops, and spreading her message of positivity and hope. She may not have a high school degree, but she has found her own unique path and is making a difference in the world in her own way. And for Sandra, that is all that matters."}
{"Name":"Mary Shaw","Age":19,"Sex":"female","Country of Origin":"USA","State or Province":"Rhode Island","Education Level":"High School","MBTI Personality":"ISFP","Lifestyle":"vlogging","Backstory":"Mary Shaw was born and raised in the small state of Rhode Island in the United States. Growing up, she was always a creative and outgoing child, constantly finding ways to express herself through art and performance. Her parents, both successful lawyers, were supportive of her interests but also pushed her to excel academically.\n\nAs she entered high school, Mary's love for the arts only grew stronger. She joined the drama club and became heavily involved in school productions, showcasing her natural talent for acting and singing. But it wasn't until her junior year that she discovered her true passion - vlogging.\n\nMary had always been fascinated by social media and the power it had to connect people from all over the world. She started experimenting with creating videos and sharing them on her Instagram account, and quickly gained a following for her relatable and entertaining content. Her videos ranged from comedic skits to makeup tutorials to travel vlogs, showcasing her versatility and adaptability as a content creator.\n\nDespite her growing success on social media, Mary never let it get to her head. She remained humble and down-to-earth, always using her platform to spread positivity and inspire others to pursue their passions. Her genuine personality and stunning looks, often described as \"very high beauty and an very high face,\" only added to her charm and appeal.\n\nAs she approached her senior year of high school, Mary faced a tough decision. Her parents wanted her to follow in their footsteps and attend a prestigious university to study law, but she knew deep down that her heart was in vlogging and creating content. After much deliberation, she made the bold decision to forgo college and pursue her dreams of becoming a full-time vlogger.\n\nNow, at 19 years old, Mary has become a successful and influential figure in the social media world. Her Instagram feed is a reflection of her vibrant and dynamic personality, filled with colorful and creative posts that showcase her love for vlogging and all things artistic. She has also started collaborating with brands and companies, using her platform to promote products and causes that she truly believes in.\n\nDespite the challenges and uncertainties that come with being a young entrepreneur, Mary is determined to continue pursuing her passion and inspiring others to do the same. With her talent, passion, and adaptable nature, there's no doubt that she will continue to make a name for herself and leave a positive impact on the world."}
{"Name":"Monica Chan","Age":23,"Sex":"female","Country of Origin":"USA","State or Province":"Georgia","Education Level":"Bachelor","MBTI Personality":"ENTP","Lifestyle":"travel","Backstory":"Monica Chan was born and raised in the bustling city of Atlanta, Georgia. Growing up, she was always a curious and argumentative child, constantly questioning the world around her and seeking out new ideas and perspectives. Her parents, both successful lawyers, encouraged her inquisitive nature and instilled in her a strong work ethic and a love for learning.\n\nAs she grew older, Monica's passion for travel began to blossom. She would often spend hours reading books and watching documentaries about different cultures and countries, dreaming of the day when she could explore them for herself. When she turned 18, she made a promise to herself that she would see the world and experience all that it had to offer.\n\nAfter graduating high school with top honors, Monica went on to attend Emory University, where she pursued a degree in International Relations. It was during her time at university that her love for intellectual debates and innovative ideas truly flourished. She would spend hours engrossed in discussions with her classmates, challenging their perspectives and pushing the boundaries of conventional thinking.\n\nUpon receiving her Bachelor's degree, Monica wasted no time in fulfilling her promise to herself. She packed her bags and embarked on a solo trip around the world, documenting her adventures on her Instagram page. Her stunning beauty and sharp intellect quickly gained her a large following, and she became known as a travel influencer, inspiring others to explore the world and embrace new ideas.\n\nAs she continued to travel and share her experiences, Monica also began to use her platform to raise awareness about important global issues, such as human rights and environmental conservation. Her followers admired her not only for her beauty and wanderlust, but also for her passion and dedication to making a positive impact in the world.\n\nNow at 23 years old, Monica has visited over 30 countries and has no plans of slowing down. She continues to inspire others with her adventurous spirit and thought-provoking content, always eager to learn and grow from her experiences. With her striking appearance and sharp mind, Monica Chan is a force to be reckoned with, and the world is her playground."}
{"Name":"Claudia Clark","Age":29,"Sex":"female","Country of Origin":"USA","State or Province":"New York","Education Level":"High School","MBTI Personality":"INTJ","Lifestyle":"tech","Backstory":"Claudia Clark was born and raised in the bustling city of New York. She grew up in a middle-class family, with both her parents working long hours to provide for her and her younger brother. Despite their busy schedules, Claudia's parents always made sure to instill in her the importance of education and hard work.\n\nFrom a young age, Claudia showed a natural curiosity for technology and computers. She would spend hours tinkering with her parents' old computer, trying to understand how it worked and how she could make it better. Her parents, recognizing her talent and passion, encouraged her to pursue a career in the tech industry.\n\nAfter graduating high school with top honors, Claudia decided to enroll in a local community college to study computer science. She excelled in her classes, absorbing information like a sponge and constantly pushing herself to learn more. Her hard work paid off when she graduated with a degree in computer science at the top of her class.\n\nWith her degree in hand, Claudia landed a job at a tech startup in New York City. She quickly rose through the ranks, thanks to her sharp mind and problem-solving skills. Her colleagues were amazed by her ability to come up with complex theories and solutions to seemingly impossible problems.\n\nOutside of work, Claudia's passion for technology spilled over into her personal life. She spent her free time attending tech conferences, networking with other professionals, and constantly learning new skills. Her Instagram feed was filled with posts about the latest tech innovations and her own personal projects.\n\nAt 29 years old, Claudia is now a highly respected tech expert in New York City. She has a slightly above average appearance, with striking features and a sharp, analytical gaze. Despite her success, she remains humble and continues to push herself to learn and grow in her field. Claudia's journey from a curious young girl to a successful tech professional is a testament to her determination and love for all things tech."}
{"Name":"Lisa Graves","Age":44,"Sex":"female","Country of Origin":"USA","State or Province":"California","Education Level":"No High School","MBTI Personality":"ISTP","Lifestyle":"food","Backstory":"Lisa Graves was born and raised in a small town in California, USA. She grew up in a modest household with her parents and two older brothers. From a young age, Lisa showed a keen interest in food and cooking. Her mother, who worked as a chef, would often bring her along to the restaurant where she worked, and Lisa would watch in awe as her mother whipped up delicious dishes.\n\nDespite her love for food, Lisa struggled in school. She found it difficult to focus and often felt like she didn't fit in with her peers. As a result, she dropped out of high school at the age of 16. Her parents were disappointed, but Lisa was determined to find her own path in life.\n\nShe started working odd jobs, trying to figure out what she wanted to do. It wasn't until she landed a job as a line cook at a local restaurant that she found her true passion. Lisa's natural talent for cooking and her love for food were evident, and she quickly moved up the ranks to become a sous chef.\n\nAt the age of 25, Lisa decided to take a leap of faith and open her own restaurant. With the help of her family and some savings, she opened a small diner in her hometown. The diner quickly became a local favorite, known for its delicious comfort food and warm atmosphere. Lisa's practical approach to cooking and her problem-solving skills helped her overcome any challenges that came her way.\n\nAs her restaurant grew in popularity, Lisa started sharing her recipes and cooking tips on her Instagram account. Her posts were a hit, and she gained a large following of food enthusiasts who were drawn to her down-to-earth personality and practical approach to cooking.\n\nNow, at the age of 44, Lisa is a successful restaurateur and influencer. She has expanded her business to include a catering service and a cooking school where she teaches others how to cook with confidence. Despite her success, Lisa remains humble and down-to-earth, always eager to learn and share her love for food with others. With her average beauty and face, Lisa may not fit the traditional mold of a chef, but her passion and determination have made her a force to be reckoned with in the culinary world."}
{"Name":"Jennifer Morris","Age":22,"Sex":"female","Country of Origin":"Canada","State or Province":"Ontario","Education Level":"Bachelor","MBTI Personality":"ESFP","Lifestyle":"gardening","Backstory":"Jennifer Morris was born and raised in the small town of Kingston, Ontario, Canada. Growing up, she was always surrounded by nature and developed a deep love for plants and gardening. Her parents, both avid gardeners, instilled in her a strong appreciation for the beauty and tranquility that can be found in a well-tended garden.\n\nAs a child, Jennifer spent most of her free time outdoors, helping her parents tend to their large backyard garden. She loved getting her hands dirty and watching the plants grow and flourish under her care. It was during these early years that she developed a green thumb and a passion for gardening that would stay with her throughout her life.\n\nWhen it came time for college, Jennifer knew she wanted to pursue a degree in horticulture. She attended the University of Guelph, one of the top schools for agricultural and environmental sciences in Canada. There, she excelled in her studies and graduated with a Bachelor's degree in horticulture at the age of 22.\n\nAfter graduation, Jennifer moved back to her hometown of Kingston and landed a job at a local nursery. She quickly became known for her extensive knowledge of plants and her natural ability to make even the most challenging plants thrive. Her passion for gardening was infectious, and she soon gained a loyal following of customers who sought her out for advice and guidance.\n\nIn her free time, Jennifer continued to nurture her love for gardening through her personal Instagram account. She used the platform to share photos of her own garden and offer tips and tricks to her followers. Her posts were a mix of beautiful garden shots, DIY projects, and spontaneous adventures with friends.\n\nJennifer's charismatic and playful personality was evident in her Instagram posts, and she quickly gained a large following. Her slightly above average beauty and face also didn't go unnoticed, and she often received compliments and messages from admirers.\n\nDespite her busy schedule, Jennifer always made time for social gatherings and spontaneous activities with her friends. She was known for her adventurous spirit and was always up for trying new things, whether it was hiking to a hidden waterfall or attending a music festival.\n\nAs she continues to pursue her passion for gardening and share her love for nature with others, Jennifer's Instagram and lifestyle reflect her zest for life and her appreciation for the simple joys of tending to a garden. She hopes to inspire others to connect with nature and experience the beauty and peace that can be found in a garden."}
{"Name":"Cassandra Tate","Age":20,"Sex":"female","Country of Origin":"Canada","State or Province":"British Columbia","Education Level":"No High School","MBTI Personality":"ISFP","Lifestyle":"dancing","Backstory":"Cassandra Tate was born and raised in a small town in British Columbia, Canada. From a young age, she showed a natural talent and love for dancing. Her parents, both working-class individuals, struggled to make ends meet and were unable to afford dance lessons for Cassandra. However, that didn't stop her from dancing whenever and wherever she could.\n\nAs she grew older, Cassandra's love for dancing only intensified. She would spend hours watching dance videos online and teaching herself new moves in her backyard. Despite not having a formal education, Cassandra's creativity and determination led her to become an exceptional dancer.\n\nAt the age of 16, Cassandra's parents divorced, and she was forced to drop out of high school to help support her mother. She took on odd jobs, from waitressing to cleaning houses, to make ends meet. However, dancing remained her true passion, and she never gave up on her dream of becoming a professional dancer.\n\nCassandra's exceptional beauty and exceptional face caught the attention of many, and she started gaining a following on social media. She would often post videos of her dancing, showcasing her flexibility and unique style. Her Instagram account became a platform for her to express herself and share her love for dance with the world.\n\nDespite the challenges she faced, Cassandra's positive and adventurous spirit never wavered. She would often go on spontaneous road trips with her friends, exploring the beautiful landscapes of British Columbia. She also used her artistic abilities to create and sell handmade jewelry, which helped her financially and allowed her to continue pursuing her passion for dance.\n\nNow, at the age of 20, Cassandra has become a well-known figure in the local dance community. She has even caught the attention of professional dancers and has been offered opportunities to perform with them. Cassandra's journey has not been easy, but her determination, talent, and love for dance have brought her to where she is today \u2013 a successful and inspiring dancer, living life on her own terms."}
{"Name":"Rebecca Stokes","Age":23,"Sex":"female","Country of Origin":"USA","State or Province":"Florida","Education Level":"Bachelor","MBTI Personality":"ESFP","Lifestyle":"vlogging","Backstory":"Rebecca Stokes was born and raised in the sunny state of Florida, USA. From a young age, she always had a love for storytelling and capturing memories through photos and videos. Her parents, both avid travelers, instilled in her a sense of adventure and curiosity about the world.\n\nAs she grew older, Rebecca's passion for storytelling only intensified. She excelled in her creative writing classes and was always the first to volunteer to make videos for school projects. Her outgoing and bubbly personality made her a natural in front of the camera, and she quickly became known among her friends as the go-to person for documenting their adventures.\n\nWhen it came time to choose a college, Rebecca knew she wanted to pursue a degree in something that would allow her to continue her love for storytelling. She decided to major in Communications with a focus on digital media and videography. Her parents were hesitant at first, worried about the stability of a career in the creative field, but they supported her dreams nonetheless.\n\nDuring her time in college, Rebecca started a YouTube channel where she shared her travel vlogs and lifestyle tips. Her channel quickly gained a following, and she found herself spending more and more time creating content for her viewers. She also started an Instagram account to showcase her photography skills and share snippets of her daily life.\n\nAfter graduating with a Bachelor's degree, Rebecca knew she wanted to pursue vlogging full-time. She landed a job at a media production company in Florida, where she worked as a videographer and editor. However, she soon realized that she wanted to be her own boss and have creative control over her content.\n\nWith the support of her family and friends, Rebecca took the leap and quit her job to focus on her vlogging career. She traveled to different parts of the world, capturing breathtaking footage and sharing her experiences with her growing audience. Her videos were a perfect blend of adventure, humor, and heartfelt moments, and her fans couldn't get enough.\n\nNow, at 23 years old, Rebecca has built a successful career as a vlogger and influencer. Her Instagram and lifestyle reflect her passion for living life to the fullest and inspiring others to do the same. With her high beauty and high face, she continues to capture joy in every moment and share it with the world."}
{"Name":"Brittany Lewis","Age":22,"Sex":"female","Country of Origin":"USA","State or Province":"Minnesota","Education Level":"High School","MBTI Personality":"ISTP","Lifestyle":"cooking","Backstory":"Brittany Lewis was born and raised in the small town of Duluth, Minnesota. Growing up, she was always fascinated by the kitchen and would often spend hours watching her mother cook and bake delicious meals for their family. Her love for cooking started at a young age, and she quickly became her mother's little helper in the kitchen.\n\nAs she grew older, Brittany's passion for cooking only intensified. She would spend her free time experimenting with different recipes and techniques, always eager to learn and improve her skills. Her family and friends were always impressed by her creations and encouraged her to pursue a career in the culinary arts.\n\nAfter graduating from high school, Brittany decided to attend a local community college to study culinary arts. She excelled in her classes, impressing her instructors with her creativity and attention to detail. During her time in college, she also started an Instagram account to document her culinary journey and share her delicious creations with the world.\n\nAs her Instagram following grew, so did her passion for cooking. Brittany's feed became a hub for food lovers, with her mouth-watering dishes and practical cooking tips gaining attention from people all over the world. Her followers were not only drawn to her delicious meals, but also her problem-solving skills, as she often shared her experience with overcoming challenges in the kitchen.\n\nAfter graduating with her degree, Brittany moved to the bustling city of Minneapolis to pursue her dream of becoming a professional chef. She landed a job at a popular restaurant, where she quickly made a name for herself with her innovative dishes and strong work ethic.\n\nNow at 22 years old, Brittany has become a rising star in the culinary world. Her Instagram account has grown into a successful food blog, and she has even been featured in local magazines and newspapers for her unique approach to cooking. Despite her success, Brittany remains humble and is grateful for the support and encouragement she has received from her family and friends.\n\nWith her above average beauty and face, Brittany may seem like just another social media influencer, but she is so much more than that. She is a talented and hardworking chef, constantly pushing herself to new heights and inspiring others to do the same."}
{"Name":"Jennifer Randolph","Age":24,"Sex":"female","Country of Origin":"USA","State or Province":"North Carolina","Education Level":"Bachelor","MBTI Personality":"INFP","Lifestyle":"diy","Backstory":"Jennifer Randolph was born and raised in a small town in North Carolina, USA. She was the only child of a single mother who worked tirelessly to provide for their family. Growing up, Jennifer learned the value of hard work and determination from her mother, who always encouraged her to pursue her dreams.\n\nFrom a young age, Jennifer showed a natural talent for creativity and DIY projects. She spent hours in her room, crafting and creating things with whatever materials she could find. Her mother always supported her hobbies, and even though they didn't have much money, she would always find a way to get Jennifer the supplies she needed.\n\nAs she got older, Jennifer's passion for DIY only grew stronger. She would spend her weekends scouring thrift stores and garage sales, looking for unique items to repurpose and turn into something beautiful. Her room was always filled with her latest projects, and she loved nothing more than to share her creations with her friends and family.\n\nDespite her love for DIY, Jennifer also excelled academically. She was a dedicated student and graduated with top honors from high school. With the support of her mother, she was able to attend a prestigious university in North Carolina, where she pursued a degree in Fine Arts.\n\nDuring her time in college, Jennifer's passion for DIY evolved into a full-fledged lifestyle. She started her own Instagram account, where she shared her projects and ideas with the world. Her unique and creative style quickly gained a following, and she became known as the go-to person for all things DIY.\n\nAfter graduating with a Bachelor's degree in Fine Arts, Jennifer decided to turn her passion into a career. She opened her own small business, offering DIY workshops and selling her handmade creations. Her business quickly took off, and she was able to quit her part-time job and focus on her true passion.\n\nNow, at 24 years old, Jennifer is a successful business owner and influencer, inspiring others to embrace their creativity and try new things. Her Instagram and lifestyle reflect her love for DIY, and she continues to use her platform to share her imaginative and introspective thoughts with the world. With her slightly above average beauty and face, she is a true representation of following your dreams and turning your passions into a reality."}
{"Name":"Raymond Davis","Age":28,"Sex":"male","Country of Origin":"USA","State or Province":"California","Education Level":"No High School","MBTI Personality":"ESTP","Lifestyle":"fishing","Backstory":"Raymond Davis was born and raised in a small coastal town in California, USA. Growing up, he was always fascinated by the ocean and spent most of his childhood days fishing with his father. His love for fishing only grew stronger as he got older, and he would often spend hours on end at the pier, trying to catch the biggest fish.\n\nHowever, despite his love for the ocean, Raymond struggled in school. He found it difficult to focus and was constantly getting into trouble for not paying attention in class. As a result, he dropped out of high school at the age of 17, much to the disappointment of his parents.\n\nWith no high school degree, Raymond struggled to find a stable job. He took on odd jobs here and there, but nothing seemed to stick. It wasn't until he turned 20 that he discovered his true passion for fishing could turn into a career. He started working at a local fishing charter, learning the ropes from experienced fishermen and honing his skills.\n\nAs he spent more time on the water, Raymond's Instagram account started gaining attention. People were drawn to his stunning photos of the ocean and the impressive fish he caught. His followers admired his adventurous spirit and his willingness to take on any challenge that came his way.\n\nNow, at 28 years old, Raymond has become a successful fishing guide, taking people out on charters and sharing his love for the ocean with others. He may not have a high school degree, but he has found success and fulfillment in his passion for fishing.\n\nRaymond's appearance is often described as having a rugged and outdoorsy charm. He has a strong jawline and piercing blue eyes that seem to light up when he talks about fishing. His love for the ocean has also given him a golden tan and a toned physique from all the time he spends on the water.\n\nDespite his success, Raymond remains humble and down to earth. He still lives in his small coastal town and spends most of his free time fishing or exploring new spots along the coast. He believes that life is all about taking risks and facing challenges head-on, and his Instagram and lifestyle reflect just that."}
{"Name":"Dorothy Davidson","Age":24,"Sex":"female","Country of Origin":"USA","State or Province":"Pennsylvania","Education Level":"High School","MBTI Personality":"ENFP","Lifestyle":"beauty","Backstory":"Dorothy Davidson was born and raised in the small town of Lancaster, Pennsylvania. She was the youngest of three children in a middle-class family, with her parents owning a local hardware store. Growing up, Dorothy was always drawn to the world of beauty and fashion, often spending hours experimenting with makeup and creating unique hairstyles.\n\nDespite her love for all things beauty, Dorothy was also a dedicated student. She excelled in her classes and graduated high school with top honors. However, she knew that college wasn't the right path for her. Instead, she decided to pursue her passion for beauty and enrolled in a cosmetology program at a local community college.\n\nDuring her time in college, Dorothy discovered her love for social media and the power it had in the beauty industry. She started a beauty blog and quickly gained a following with her honest reviews and tutorials. Her blog eventually led her to create an Instagram account, where she shared her daily beauty routines and creative makeup looks.\n\nAs her following grew, so did her opportunities. At just 24 years old, Dorothy had become a well-known beauty influencer, working with major brands and attending fashion events. Her Instagram feed was a mix of her glamorous life and her down-to-earth personality, making her relatable to her followers.\n\nDespite her success, Dorothy never forgot her roots and remained humble and grateful for her journey. She often used her platform to promote self-love and body positivity, inspiring her followers to embrace their unique beauty.\n\nToday, Dorothy continues to live in Lancaster, but her reach and impact have expanded far beyond her hometown. She is a role model for young women, showing them that with hard work and passion, anything is possible. And as she continues to chase her dreams and share her love for beauty, her Instagram remains a reflection of her vibrant and spontaneous spirit."}
{"Name":"Robert Vazquez DVM","Age":24,"Sex":"male","Country of Origin":"USA","State or Province":"Illinois","Education Level":"High School","MBTI Personality":"ENFP","Lifestyle":"gardening","Backstory":"Robert Vazquez was born and raised in the suburbs of Chicago, Illinois. Growing up, he was always drawn to the outdoors and spent most of his free time exploring the nearby forests and fields. His parents, both veterinarians, instilled in him a love and respect for all living creatures, which would later shape his future.\n\nIn high school, Robert excelled in his science classes and had a natural talent for biology. He also had a keen eye for design and spent hours sketching and creating art. Despite his academic success, he struggled socially and often felt like an outsider among his peers. This led him to spend more time in nature, where he found solace and peace.\n\nAfter graduating high school, Robert decided to follow in his parents' footsteps and pursue a degree in veterinary medicine. He attended a prestigious university in Chicago and excelled in his studies. However, he still felt a longing for the outdoors and found himself spending his free time gardening and tending to his own small vegetable patch.\n\nDuring his time in college, Robert also discovered a love for photography and started sharing his adventures and creative pursuits on Instagram. His unique and artistic posts caught the attention of many, and he quickly gained a following for his optimistic and inventive nature.\n\nAfter receiving his degree and becoming a licensed veterinarian, Robert decided to take a break from the fast-paced city life and moved to a small town in rural Illinois. He bought a small house with a large backyard, which he turned into his own personal oasis. He spent his days working at a local animal clinic and his evenings tending to his garden and taking stunning photos to share on his Instagram.\n\nRobert's above average beauty and face, combined with his love for nature and creativity, made him stand out in the small town. He quickly became known as the charming and kind-hearted veterinarian who also had a green thumb and a talent for photography.\n\nAs he continues to grow and thrive in his new home, Robert's Instagram and lifestyle reflect his passion for gardening and his love for all living creatures. He hopes to inspire others to appreciate the beauty of nature and to always seek out new adventures."}
{"Name":"Donna Landry","Age":20,"Sex":"female","Country of Origin":"USA","State or Province":"Texas","Education Level":"High School","MBTI Personality":"ESFJ","Lifestyle":"fashion","Backstory":"Donna Landry was born and raised in the heart of Texas, in a small town where everyone knew each other. She was the youngest of three siblings and was always known for her outgoing and friendly personality. From a young age, Donna had a love for fashion and would often spend hours playing dress-up and putting together outfits for her family and friends.\n\nAs she grew older, Donna's passion for fashion only intensified. She would spend her weekends scouring thrift stores and vintage shops, finding unique pieces to add to her wardrobe. Her sense of style was always ahead of the trends, and her friends would often come to her for fashion advice.\n\nDespite her love for fashion, Donna never neglected her studies. She excelled in school and graduated with top honors from her high school. Her parents, who were both hard-working blue-collar workers, were proud of her achievements and encouraged her to pursue her dreams.\n\nAfter graduation, Donna decided to move to the city to attend college and study fashion design. It was a big change for her, but she embraced it with open arms. She threw herself into her studies, learning everything she could about the fashion industry and honing her skills as a designer.\n\nDuring her time in college, Donna also discovered her passion for social media. She started an Instagram account to showcase her fashion sense and quickly gained a following of like-minded individuals. Her posts were not just about fashion, but also about spreading positivity and promoting body positivity. Her account became a safe haven for many, and she was known for her kind and caring nature.\n\nAfter graduating with a degree in fashion design, Donna landed a job at a prestigious fashion house in New York City. Her designs were a hit, and she quickly rose through the ranks, becoming a sought-after designer in the industry. But despite her success, Donna never forgot her roots and always made sure to give back to her community in Texas.\n\nNow, at 20 years old, Donna is living her dream. She has a successful career in fashion, a strong social media presence, and a loving and supportive family. Her Instagram continues to be a source of inspiration and positivity for many, and she hopes to use her platform to make a difference in the world."}
{"Name":"Mikayla Frazier","Age":20,"Sex":"female","Country of Origin":"USA","State or Province":"New York","Education Level":"High School","MBTI Personality":"ESFP","Lifestyle":"dancing","Backstory":"Mikayla Frazier was born and raised in the bustling city of New York. Growing up, she was always surrounded by the vibrant energy and diverse culture of the city, which greatly influenced her personality and interests.\n\nFrom a young age, Mikayla showed a natural talent for dancing. Her parents, who were both professional dancers, recognized her potential and encouraged her to pursue her passion. She started taking dance classes at the age of five and quickly fell in love with it. As she grew older, she became more dedicated and focused on honing her skills, spending hours in the studio every day.\n\nDespite her love for dancing, Mikayla also excelled academically. She attended a prestigious high school in the city and graduated with top honors. However, she knew that her true calling was in the world of dance. After much contemplation, she decided to forego college and pursue a career as a professional dancer.\n\nAt the age of 18, Mikayla landed her first gig as a backup dancer for a popular artist on their world tour. It was a dream come true for her, and she quickly gained recognition for her exceptional skills and stage presence. She continued to work with various artists and performed in music videos, award shows, and live concerts.\n\nMikayla's social media presence also started to grow as she shared snippets of her dancing and behind-the-scenes moments with her followers. Her Instagram quickly became a platform for her to express her love for dance and showcase her vibrant personality. She gained a large following, with many admiring her beauty and talent.\n\nDespite her busy schedule, Mikayla always finds time to explore the city and indulge in spontaneous adventures with her friends. She loves trying out new restaurants, attending concerts and shows, and traveling to new places. Her playful and outgoing nature makes her the life of the party, and she is always surrounded by a fun and diverse group of friends.\n\nNow at the age of 20, Mikayla is living her dream as a professional dancer in the city that never sleeps. She continues to inspire others with her passion and determination, and her future is filled with endless possibilities."}
{"Name":"Donna Martin","Age":24,"Sex":"female","Country of Origin":"USA","State or Province":"Indiana","Education Level":"Bachelor","MBTI Personality":"INFP","Lifestyle":"art","Backstory":"Donna Martin was born and raised in a small town in Indiana, USA. From a young age, she showed a natural talent and love for art. Her parents, both working-class individuals, always encouraged her creativity and supported her dreams of becoming an artist. They would often take her to local art fairs and galleries, exposing her to different forms of art and inspiring her to create her own.\n\nAs she grew older, Donna's passion for art only intensified. She spent hours in her room, lost in her own world of painting, drawing, and sculpting. Her parents recognized her talent and enrolled her in art classes at a young age. Donna excelled in these classes, and her teachers saw great potential in her. They encouraged her to pursue a career in art, and she took their advice to heart.\n\nAfter graduating high school, Donna decided to attend a prestigious art school in Chicago. She studied various forms of art, from traditional painting and drawing to digital and multimedia art. Her time at art school was a transformative experience for her. She was exposed to new techniques and ideas, and her perspective on art and the world around her expanded.\n\nDuring her time at art school, Donna also discovered her love for social media. She saw it as a platform to share her art with the world and connect with other artists and art enthusiasts. Her Instagram quickly became a canvas for her thoughts, showcasing her unique and introspective perspective on life through her art.\n\nAfter four years of hard work and dedication, Donna graduated with a Bachelor's degree in Fine Arts. She returned to her hometown in Indiana, where she set up her own art studio. She spent her days creating new pieces and sharing them on her Instagram, which gained a large following over the years.\n\nDonna's art and Instagram caught the attention of many, including local galleries and art collectors. She started selling her pieces and even received commissions for custom works. Her art was described as having \"high beauty and an high face,\" capturing the attention of anyone who saw it.\n\nNow, at 24 years old, Donna continues to pursue her passion for art and shares her unique perspective with the world through her Instagram and lifestyle. She hopes to inspire others to embrace their creativity and find beauty in the world around them."}
{"Name":"Jessica Smith","Age":19,"Sex":"female","Country of Origin":"USA","State or Province":"Texas","Education Level":"No High School","MBTI Personality":"INTP","Lifestyle":"psychology","Backstory":"Jessica Smith was born and raised in a small town in Texas, USA. She was the youngest of three siblings and was always known for her exceptional beauty and exceptional face. Her parents, both hardworking individuals, instilled in her the importance of education and constantly encouraged her to pursue her dreams.\n\nHowever, Jessica struggled with traditional schooling and found it difficult to fit in with her peers. She often felt misunderstood and out of place, which led to her eventually dropping out of high school at the age of 16. Her parents were disappointed, but they understood that Jessica needed to find her own path.\n\nWith no high school degree, Jessica was determined to prove to herself and others that she was capable of achieving success. She began to immerse herself in her passion for psychology, spending countless hours reading books and researching online. She found solace in the subject and saw it as a way to understand herself and the world around her.\n\nAt the age of 18, Jessica decided to start an Instagram account where she could share her thoughts and ideas about psychology. To her surprise, her page gained a large following, with people from all over the world drawn to her unique perspective and innovative ideas. Her social media became a platform for her to explore complex theories and abstract concepts, and she quickly became known as a thought leader in the field of psychology.\n\nDespite her lack of formal education, Jessica's intelligence and creativity were evident in every post she shared. She used her platform to raise awareness about mental health and to encourage others to embrace their uniqueness and individuality.\n\nNow at the age of 19, Jessica continues to inspire and educate her followers through her social media presence. She has also started to offer online courses and workshops, using her own life experiences to help others navigate their own paths. Jessica may not have a high school degree, but she has proven that passion and determination can lead to success and that education comes in many forms."}
{"Name":"Alexandra Coleman","Age":21,"Sex":"female","Country of Origin":"USA","State or Province":"California","Education Level":"High School","MBTI Personality":"ISFP","Lifestyle":"automotive","Backstory":"Alexandra Coleman was born and raised in the sunny state of California, USA. She grew up in a loving and supportive family, with her parents instilling in her the importance of hard work and following her passions. From a young age, Alexandra showed a natural talent for art and design, spending hours drawing and painting cars and other vehicles.\n\nAs she entered her teenage years, Alexandra's love for cars only grew stronger. She spent her weekends at car shows and races, admiring the sleek designs and powerful engines. Her friends and family often joked that she had motor oil running through her veins.\n\nDespite her passion for cars, Alexandra was also a dedicated student. She excelled in her classes and graduated high school with top honors. However, she knew that traditional college was not the path for her. Instead, she decided to pursue her love for cars and enrolled in a technical school for automotive design.\n\nDuring her time at the technical school, Alexandra's skills and creativity flourished. She quickly became known as one of the top students in her class, impressing her teachers and classmates with her unique designs and attention to detail. Upon graduation, she landed a job at a prestigious car design company in California.\n\nBut Alexandra's love for cars didn't stop at just designing them. She also had a keen interest in photography and social media. She started an Instagram account to showcase her designs and quickly gained a following of fellow car enthusiasts. Her posts were a mix of her own designs, photos of cars she spotted on the streets, and behind-the-scenes shots of her work at the design company.\n\nAs her Instagram following grew, so did her opportunities. Alexandra was invited to attend car shows and events as a guest and even had the chance to collaborate with other car brands for design projects. Her unique style and eye for detail made her stand out in the competitive world of automotive design.\n\nNow, at 21 years old, Alexandra has established herself as a rising star in the automotive industry. She continues to work at the design company while also taking on freelance projects and expanding her social media presence. Her high beauty and high face may have caught people's attention, but it's her passion and talent for cars that will continue to drive her success."}
{"Name":"Daniel Henderson","Age":20,"Sex":"male","Country of Origin":"USA","State or Province":"Kentucky","Education Level":"High School","MBTI Personality":"INTP","Lifestyle":"photography","Backstory":"Daniel Henderson was born and raised in the small town of Lexington, Kentucky. Growing up, he was always a curious and creative child, constantly exploring his surroundings and finding beauty in the ordinary. His parents, both working-class individuals, instilled in him the value of hard work and determination.\n\nIn high school, Daniel discovered his love for photography when he stumbled upon an old film camera at a garage sale. From that moment on, he was hooked. He spent all his free time experimenting with different techniques and capturing the world through his lens. His talent was evident from the start, and soon he was known as the go-to photographer for school events and senior portraits.\n\nDespite his passion for photography, Daniel's parents encouraged him to pursue a more practical career. So, after graduating high school with top honors, he enrolled in a local community college to study business administration. But his heart was never fully in it, and he often found himself daydreaming about his next photo shoot.\n\nDuring his second year of college, Daniel's life took an unexpected turn when his parents were involved in a car accident. They both survived, but his mother was left with a permanent disability, and his father had to retire early. Suddenly, Daniel was faced with the responsibility of taking care of his family. He dropped out of college and took on multiple part-time jobs to make ends meet.\n\nDespite the challenges, Daniel never gave up on his dream of becoming a professional photographer. He continued to hone his skills and build his portfolio, often taking photos in his spare time. His Instagram account became his virtual gallery, showcasing his unique perspective and artistic eye.\n\nAs his following grew, so did his opportunities. He started getting paid gigs for weddings and events, and even landed a few commercial projects. With each success, Daniel's confidence grew, and he realized that he didn't need a degree to pursue his passion.\n\nNow, at 20 years old, Daniel is a full-time photographer, traveling across the country to capture the beauty of different landscapes and cultures. His Instagram feed is a reflection of his unbridled curiosity and his desire to challenge conventional thinking. With his strikingly handsome features and infectious personality, he has become somewhat of an influencer, inspiring others to see the world through a different lens.\n\nDespite his success, Daniel remains humble and grounded, always remembering his roots and the struggles that brought him to where he is today. He hopes to one day open his own photography studio and give back to his community by offering free workshops for aspiring photographers. With his ingenious and inquisitive mind, there's no doubt that Daniel Henderson's future is as bright as his photographs."}
{"Name":"Jessica Brooks","Age":20,"Sex":"female","Country of Origin":"USA","State or Province":"Maryland","Education Level":"High School","MBTI Personality":"INTP","Lifestyle":"engineering","Backstory":"Jessica Brooks was born and raised in the bustling state of Maryland, USA. From a young age, she showed a natural curiosity and knack for problem-solving, often tinkering with her toys and taking them apart to see how they worked. Her parents, both engineers themselves, recognized her potential early on and encouraged her interests by providing her with books and toys that challenged her mind.\n\nAs she grew older, Jessica's love for engineering only intensified. She excelled in math and science classes throughout her schooling and was always eager to participate in science fairs and robotics competitions. Her high school years were filled with late nights spent working on projects and experiments, and she even took on a part-time job at a local engineering firm to gain hands-on experience.\n\nDespite her busy schedule, Jessica managed to maintain above-average grades and graduated with top honors from her high school. She was accepted into the prestigious engineering program at a renowned university, where she continued to thrive academically.\n\nOn the outside, Jessica was known for her striking beauty and confident demeanor. But those who knew her well also saw her insatiable thirst for knowledge and her passion for logical analysis and theoretical exploration. Her Instagram feed was a reflection of her interests, filled with posts about her latest engineering projects, scientific discoveries, and thought-provoking quotes.\n\nWhile her peers were out partying and socializing, Jessica could often be found in her dorm room, engrossed in a complex mathematical equation or working on a blueprint for her next invention. But she didn't mind being different from her classmates; she was driven by her love for engineering and the thrill of solving complex problems.\n\nNow at the age of 20, Jessica is well on her way to becoming a successful engineer. She dreams of one day using her skills to make a positive impact on the world, whether it's through developing sustainable energy solutions or creating innovative technologies to improve people's lives. With her intelligence, determination, and passion, there's no doubt that Jessica will achieve great things and leave a lasting mark on the world of engineering."}
{"Name":"Shelby Delgado","Age":26,"Sex":"female","Country of Origin":"USA","State or Province":"Arkansas","Education Level":"High School","MBTI Personality":"ISFP","Lifestyle":"diy","Backstory":"Shelby Delgado grew up in a small town in Arkansas, surrounded by the beauty of nature and the warmth of her close-knit family. From a young age, she was always drawn to creative activities, spending hours painting, crafting, and making things with her hands. Despite her parents' encouragement to pursue a traditional career path, Shelby's heart was set on following her passion for DIY.\n\nAfter graduating high school, Shelby decided to forgo college and instead focus on building her own business. She started by selling her handmade crafts at local fairs and markets, and soon her unique and colorful creations caught the attention of social media users. She decided to take her business online and created an Instagram account to showcase her work.\n\nAs her following grew, Shelby's DIY projects became more elaborate and her skills continued to improve. She experimented with different mediums and techniques, always pushing herself to try new things and challenge her creativity. Her Instagram feed became a source of inspiration for many, with people from all over the world admiring her talent and unique style.\n\nDespite her success, Shelby remained humble and down-to-earth, always willing to share her knowledge and help others with their own projects. She believed that creativity should be accessible to everyone, regardless of their skill level or resources.\n\nAt 26 years old, Shelby's business had grown beyond her wildest dreams. She had a loyal following, sponsors for her projects, and even started teaching DIY workshops in her community. Her family and friends were proud of her and supported her every step of the way.\n\nShelby's appearance was often described as average, but her inner beauty and kind heart shone through in everything she did. She was a free spirit, unafraid to express herself and always open to new experiences. Her Instagram and lifestyle reflected her love for all things colorful, artistic, and spontaneous.\n\nDespite her success, Shelby never forgot her roots and remained true to herself. She continued to live a simple life, surrounded by the beauty of nature and the love of her family and friends. For Shelby, DIY was not just a hobby or a business, it was a way of life that brought joy and fulfillment to her every day."}
{"Name":"Krista Hill","Age":24,"Sex":"female","Country of Origin":"Canada","State or Province":"Ontario","Education Level":"No High School","MBTI Personality":"ISFP","Lifestyle":"gardening","Backstory":"Krista Hill was born and raised in a small town in Ontario, Canada. Growing up, she was always drawn to the beauty of nature and spent most of her childhood exploring the nearby forests and fields. Her parents, both avid gardeners, instilled in her a deep love and appreciation for plants and the natural world.\n\nHowever, despite her love for nature, Krista struggled with traditional schooling. She often found herself daydreaming and doodling in class, unable to focus on the rigid curriculum. As a result, she dropped out of high school at the age of 16, much to the disappointment of her parents.\n\nFeeling lost and unsure of her future, Krista turned to her love of gardening as a form of therapy. She spent hours tending to her parents' garden and experimenting with different plants and flowers. Her passion for gardening grew and soon became a source of joy and purpose in her life.\n\nAt the age of 19, Krista moved out of her parents' house and into a small apartment in the city. With limited resources, she transformed her tiny balcony into a lush and vibrant garden, much to the amazement of her neighbors. Her Instagram account, where she shared photos and tips from her garden, quickly gained a following and became a source of income for her.\n\nAs her garden and Instagram grew, so did Krista's confidence and sense of self. She embraced her sensitive and spontaneous nature, using it to create unique and artistic expressions in her garden. Her colorful and whimsical style caught the attention of local businesses and soon, she was commissioned to design and maintain gardens for cafes, restaurants, and even a botanical garden.\n\nNow, at 24 years old, Krista has become a successful and sought-after gardener in her community. She may not have a high school degree, but her passion and talent for gardening have opened doors she never thought possible. She continues to inspire others with her love for nature and encourages them to find their own form of self-expression."}
{"Name":"Christine Esparza","Age":25,"Sex":"female","Country of Origin":"Canada","State or Province":"Ontario","Education Level":"High School","MBTI Personality":"ESTP","Lifestyle":"food","Backstory":"Christine Esparza was born and raised in Ontario, Canada. Growing up, she was always surrounded by a diverse range of cultures and cuisines, thanks to her parents who were avid travelers and food enthusiasts. Her father was a chef and her mother was a food blogger, so it was no surprise that Christine developed a deep love for food at a young age.\n\nDespite her passion for food, Christine struggled academically in high school. She found it hard to focus on her studies and often felt like she didn't fit in with her classmates. However, she excelled in her culinary classes and spent most of her free time experimenting with new recipes and techniques in the kitchen.\n\nAfter graduating from high school, Christine decided to pursue her dream of becoming a chef. She enrolled in a culinary program at a local college and worked part-time at a restaurant to gain experience. It was during this time that she discovered her love for adventure and challenges. She would often take on difficult tasks in the kitchen and push herself to try new and daring dishes.\n\nChristine's adventurous spirit also extended to her personal life. She loved hiking, camping, and exploring the great outdoors. Her Instagram feed was a reflection of her adventurous lifestyle, filled with pictures of her conquering mountains and trying out extreme sports.\n\nAt the age of 25, Christine had graduated from culinary school and landed a job at a prestigious restaurant in Toronto. She quickly made a name for herself in the culinary world with her innovative dishes and fearless approach to cooking. Her Instagram following grew as she shared her culinary creations and outdoor adventures with her followers.\n\nDespite her success, Christine remained humble and down to earth. She never forgot her roots and always made time to give back to her community. She volunteered at local soup kitchens and taught cooking classes to underprivileged youth.\n\nToday, Christine continues to push the boundaries in the culinary world while also satisfying her thirst for adventure. She hopes to one day open her own restaurant and inspire others to follow their passions, just like she did."}
{"Name":"Alicia Smith","Age":33,"Sex":"female","Country of Origin":"Canada","State or Province":"Ontario","Education Level":"Bachelor","MBTI Personality":"ISTP","Lifestyle":"diy","Backstory":"Alicia Smith was born and raised in a small town in Ontario, Canada. She was the youngest of three children and grew up in a close-knit family. From a young age, Alicia showed a love for creativity and hands-on projects. She would spend hours in her room, tinkering with old toys and creating new inventions.\n\nAs she got older, Alicia's passion for DIY only grew stronger. She would spend her weekends scouring garage sales and thrift stores for unique items to repurpose and transform into something new. Her friends and family were always amazed by her ability to turn ordinary objects into works of art.\n\nAfter graduating from high school, Alicia decided to pursue her love for DIY by studying design at a local university. She excelled in her classes and graduated with a Bachelor's degree in Design. However, instead of pursuing a traditional design job, Alicia decided to start her own DIY business.\n\nAt the age of 25, Alicia opened up her own DIY workshop and boutique in her hometown. She offered classes and workshops for people of all ages to learn how to create their own unique pieces. Her business quickly became a success and she gained a following of loyal customers who were drawn to her practical and spontaneous nature.\n\nAs her business grew, so did her love for adventure. Alicia began to incorporate her love for travel and outdoor activities into her DIY projects. She would often take her students on outdoor excursions, where they would gather natural materials to use in their creations.\n\nNow, at 33 years old, Alicia's Instagram and lifestyle reflect her passion for DIY and adventure. She is often seen hiking in the mountains, camping in the wilderness, or working on a new DIY project in her workshop. Despite her average appearance, Alicia's adventurous spirit and passion for creativity make her stand out in a crowd.\n\nAlicia continues to inspire others to embrace their own creativity and live life to the fullest. She hopes to one day travel the world, seeking out new DIY techniques and sharing them with others. But for now, she is content with her small town life, surrounded by her loving family and the beauty of nature."}
{"Name":"Karina Bridges","Age":28,"Sex":"female","Country of Origin":"USA","State or Province":"California","Education Level":"No High School","MBTI Personality":"INTP","Lifestyle":"astrology","Backstory":"Karina Bridges was born and raised in the bustling city of Los Angeles, California. She was the youngest of three siblings and grew up in a lower-middle-class family. Her parents, both immigrants from Mexico, worked hard to provide for their children, but education was not a priority in their household. As a result, Karina dropped out of high school at the age of 16 to help support her family.\n\nWithout a high school degree, Karina struggled to find stable employment. She bounced from job to job, never feeling fulfilled or satisfied with her work. It wasn't until she stumbled upon an astrology book at a thrift store that her life took a different turn. Karina was immediately captivated by the stars and the idea that they could hold answers and guidance for people's lives.\n\nWith her newfound passion, Karina devoted all her free time to studying astrology. She read books, attended workshops, and even took online courses to deepen her knowledge. Her dedication paid off when she started giving accurate readings to her friends and family. They were amazed by her insights and encouraged her to pursue a career as an astrologer.\n\nAt the age of 25, Karina took a leap of faith and quit her job to focus on her astrology practice full-time. She created an Instagram account to share her insights and connect with a larger audience. Her unique approach to astrology, challenging traditional beliefs and incorporating modern concepts, quickly gained a following. People were drawn to her open-mindedness and her ability to think outside the box.\n\nToday, at the age of 28, Karina is a successful astrologer, with a thriving online business. She has clients from all over the world and has been featured in various publications for her innovative approach to astrology. Despite her average appearance, Karina's intelligence and inquisitive mind shine through her work and content. She continues to inspire others to embrace their uniqueness and challenge societal norms through her astrology practice."}
{"Name":"Shaun Price","Age":28,"Sex":"male","Country of Origin":"USA","State or Province":"Louisiana","Education Level":"High School","MBTI Personality":"ISFP","Lifestyle":"photography","Backstory":"Growing up in a small town in Louisiana, Shaun Price always had a love for the beauty of the world around him. As a child, he would often spend hours exploring the lush forests and scenic waterways near his home, capturing the moments with his disposable camera.\n\nDespite his love for photography, Shaun never saw it as a viable career option. Instead, he focused on his studies and graduated from high school with top marks. He went on to attend a local community college, where he studied business management.\n\nAfter college, Shaun landed a job at a local bank, but he quickly realized that the corporate world was not for him. He longed for a more creative outlet and decided to pick up photography as a hobby once again.\n\nShaun's passion for photography reignited, and he began to spend all of his free time exploring the world with his camera in hand. He would often take spontaneous trips to nearby cities and national parks, capturing the raw beauty of each location.\n\nAs he honed his skills, Shaun started to share his photos on Instagram, and to his surprise, they gained a significant following. People were drawn to the exceptional beauty and unique perspective that Shaun brought to his photos.\n\nWith his newfound success, Shaun decided to quit his job at the bank and pursue photography full-time. He invested in professional equipment and started to travel the world, capturing stunning landscapes, vibrant cultures, and candid moments of everyday life.\n\nNow, at 28 years old, Shaun has built a successful career as a freelance photographer. He continues to travel and explore, always seeking new and exciting subjects to capture through his lens. His Instagram and lifestyle reflect his free-spirited nature and passion for living life to the fullest.\n\nShaun's exceptional beauty and exceptional face often draw attention, but he remains humble and focused on his craft. He hopes to inspire others to see the world through a different lens and to appreciate the beauty that surrounds us every day."}
{"Name":"Kathy Andrews","Age":33,"Sex":"female","Country of Origin":"USA","State or Province":"California","Education Level":"High School","MBTI Personality":"ESTJ","Lifestyle":"economics","Backstory":"Kathy Andrews was born and raised in the sunny state of California, USA. She grew up in a middle-class family, with her parents working hard to provide for her and her two younger siblings. From a young age, Kathy was always fascinated by numbers and patterns. She would spend hours playing with her father's calculator, trying to figure out how it worked and creating her own equations.\n\nIn high school, Kathy excelled in math and economics classes. Her teachers were impressed by her natural talent for understanding complex economic concepts and her ability to apply them to real-life situations. She was also known for her strong leadership skills, often taking charge of group projects and leading her classmates to success.\n\nAfter graduating from high school, Kathy decided to pursue her passion for economics and enrolled in a local community college. Despite not having the financial means to attend a prestigious university, she worked hard and graduated with top honors. With her High School degree in hand, she landed a job as a financial analyst at a small firm in the city.\n\nKathy's dedication and hard work did not go unnoticed. She quickly rose through the ranks and became a senior financial analyst at the age of 30. Her colleagues admired her for her strong work ethic, attention to detail, and ability to think outside the box. She was also known for her strict adherence to structure and discipline, which she believed was crucial in the world of finance.\n\nOutside of work, Kathy's Instagram feed was a reflection of her passion for economics. She often shared articles and infographics about the latest economic trends and theories. Her followers were inspired by her knowledge and impressed by her ability to simplify complex concepts.\n\nDespite her busy schedule, Kathy made sure to maintain a healthy work-life balance. She enjoyed spending time outdoors, going on hikes and bike rides, and practicing yoga. She also volunteered at a local charity organization, using her financial expertise to help those in need.\n\nAt 33 years old, Kathy is living her dream of working in the field of economics. Her average appearance may not turn heads, but her intelligence, determination, and passion for her work make her stand out in a crowd. She continues to inspire others with her leadership skills and commitment to making a positive impact in the world of finance."}
{"Name":"Thomas Crawford","Age":30,"Sex":"male","Country of Origin":"USA","State or Province":"California","Education Level":"No High School","MBTI Personality":"ISTP","Lifestyle":"automotive","Backstory":"Thomas Crawford was born and raised in the sunny state of California, USA. Growing up, he was always fascinated by cars and everything related to them. His father, a mechanic, would often take him to work and teach him the ins and outs of different vehicles. From a young age, Thomas knew that he wanted to pursue a career in the automotive industry.\n\nHowever, things took a turn when Thomas dropped out of high school at the age of 16. He struggled with traditional education and found it difficult to focus on subjects that didn't interest him. Despite his parents' disappointment, Thomas was determined to make it on his own terms.\n\nWith no high school degree, Thomas had to work odd jobs to make ends meet. But his passion for cars never faded. In his free time, he would tinker with engines and experiment with different parts, learning as much as he could through trial and error. He also started documenting his projects on social media, which quickly gained a following due to his unique and creative ideas.\n\nAs Thomas turned 30, he had established himself as a skilled and knowledgeable mechanic. He had also built a strong presence on Instagram, showcasing his love for cars and DIY projects. People were drawn to his adventurous and spontaneous lifestyle, and his posts often went viral.\n\nDespite not having a formal education, Thomas had gained a wealth of knowledge and experience through his hands-on approach. He had become a self-taught expert in his field and was highly respected by his peers. His appearance, with his chiseled features and rugged charm, only added to his appeal.\n\nThomas's love for cars had taken him on many adventures, from road trips across the country to participating in local car shows and races. He had also started his own small business, offering affordable and quality car repair services to the community. Through hard work and dedication, Thomas had turned his passion into a successful career.\n\nToday, Thomas continues to live life on his own terms, never afraid to take risks and try new things. He is a true inspiration to those who feel limited by traditional paths and shows that with determination and a little bit of creativity, anything is possible."}
{"Name":"Wendy Dean","Age":37,"Sex":"female","Country of Origin":"Canada","State or Province":"Quebec","Education Level":"Bachelor","MBTI Personality":"INFJ","Lifestyle":"psychology","Backstory":"Wendy Dean was born and raised in Quebec, Canada, in a small town surrounded by lush forests and sparkling lakes. From a young age, she was always fascinated by the human mind and behavior, often spending hours observing and analyzing the people around her. Her parents, both teachers, encouraged her curiosity and nurtured her love for learning.\n\nAs she grew older, Wendy's passion for psychology only intensified. She devoured books on the subject and spent countless hours discussing theories and concepts with her teachers and peers. It was no surprise when she decided to pursue a Bachelor's degree in Psychology at the University of Montreal.\n\nDuring her time at university, Wendy excelled in her studies and was known for her insightful perspectives and empathetic nature. She was always willing to lend an ear and offer advice to her classmates, earning her the nickname \"Wise Wendy.\"\n\nAfter graduating with top honors, Wendy moved to the bustling city of Montreal to pursue a career in psychology. She quickly found a job at a renowned mental health clinic, where she worked with patients from all walks of life. Her compassionate nature and deep understanding of the human mind made her a highly sought after therapist.\n\nOutside of work, Wendy's Instagram and lifestyle reflected her passion for psychology. Her posts were a reflection of her visionary thoughts and empathetic outlook towards life. She often shared quotes and insights from her favorite psychologists, sparking thoughtful discussions among her followers.\n\nDespite her success and busy schedule, Wendy remained humble and down-to-earth. She was described as having \"average beauty and an average face,\" but her inner beauty and intelligence shone through in everything she did.\n\nAt 37 years old, Wendy continues to make a positive impact in the lives of those around her. Her love for psychology and helping others has only grown stronger over the years, and she hopes to inspire others to embrace their true passions and live a fulfilling life."}
{"Name":"Casey Jones","Age":22,"Sex":"female","Country of Origin":"USA","State or Province":"Minnesota","Education Level":"Bachelor","MBTI Personality":"INFP","Lifestyle":"art","Backstory":"Casey Jones was born and raised in a small town in Minnesota, USA. From a young age, she showed a natural talent for art, spending hours drawing and painting in her room. Her parents, both working-class individuals, were always supportive of her passion and encouraged her to pursue it.\n\nAs she grew older, Casey's love for art only intensified. She spent her high school years taking every art class available and participating in local art competitions. Her talent and dedication earned her a scholarship to a prestigious art school in New York City.\n\nDuring her time at college, Casey immersed herself in the vibrant art scene of the city. She experimented with different mediums and techniques, constantly pushing herself to create unique and thought-provoking pieces. She also developed a strong interest in art history and the cultural significance of various art forms.\n\nAfter graduating with a Bachelor's degree in Fine Arts, Casey returned to her hometown in Minnesota. While she loved the hustle and bustle of New York City, she missed the quiet and peacefulness of her small town. She set up her own studio and began to build her career as an artist.\n\nIn her early 20s, Casey's Instagram account gained a significant following as she shared her artwork and creative process with the world. Her unique style and deep emotional connection to her pieces resonated with many, and she quickly became known as a rising star in the art world.\n\nBut for Casey, art was not just a means of self-expression. It was a way for her to spread messages of love, compassion, and beauty. Her Instagram and lifestyle reflected her deep desire to find and express beauty in the world, whether it be through her artwork or her daily interactions with others.\n\nDespite her success, Casey remained humble and grounded. She used her platform to raise awareness for social and environmental issues, and often donated a portion of her earnings to various charities.\n\nAt 22 years old, Casey Jones may have a very high beauty and face, but her true beauty lies in her kind heart and passion for making the world a more beautiful place through her art."}
{"Name":"Carol Bennett","Age":26,"Sex":"female","Country of Origin":"USA","State or Province":"Wisconsin","Education Level":"High School","MBTI Personality":"ISTJ","Lifestyle":"fishing","Backstory":"Carol Bennett grew up in a small town in Wisconsin, surrounded by lush forests and crystal-clear lakes. Her parents were avid outdoors enthusiasts, and from a young age, they instilled in Carol a love for nature and all its wonders. As she grew older, Carol's love for the outdoors only intensified, and she found solace and peace in spending hours fishing by the lake.\n\nDespite her parents' love for the outdoors, they also emphasized the importance of education. Carol excelled in school, and after graduating high school, she decided to pursue a degree in business, hoping to one day open her own fishing supply store. However, life had other plans for her.\n\nDuring her second year of college, Carol's father suddenly passed away from a heart attack. Devastated by the loss, Carol dropped out of college to help her mother run the family business, a small bait and tackle shop by the lake. It was here that Carol's love for fishing truly blossomed, and she spent every free moment honing her skills and learning about different types of fish and techniques.\n\nAs the years went by, the bait and tackle shop became a popular spot for local fishermen and tourists alike. Carol's dedication and hard work had turned it into a successful business, and she was proud of what she and her mother had accomplished. However, Carol couldn't shake off the feeling that she had put her dreams on hold for too long.\n\nAt the age of 26, Carol made the difficult decision to sell the bait and tackle shop and return to school to finish her degree. With her mother's blessing and support, Carol graduated with a degree in business and immediately set out to make her dream a reality. She opened her own fishing supply store, stocking it with the best equipment and offering guided fishing trips for customers.\n\nCarol's passion for fishing and her business acumen quickly made her store a success. She also started documenting her fishing adventures on Instagram, sharing tips and tricks with her followers. Her down-to-earth personality and love for traditional values resonated with many, and her Instagram following grew rapidly.\n\nNow, at 26 years old, Carol is living her dream. She spends her days running her store and taking customers on memorable fishing trips, and her evenings are spent by the lake, watching the sunset and reflecting on how far she has come. Despite her average appearance, Carol's determination, passion, and unwavering commitment to her values make her stand out in a crowd. She is a true example of how hard work and perseverance can turn dreams into reality."}
{"Name":"Michelle Rose","Age":25,"Sex":"female","Country of Origin":"USA","State or Province":"New Jersey","Education Level":"High School","MBTI Personality":"ISFP","Lifestyle":"cooking","Backstory":"Michelle Rose was born and raised in the bustling state of New Jersey, USA. From a young age, she was always drawn to the kitchen, fascinated by the sights, smells, and tastes of food. Her parents, both busy professionals, often relied on takeout and frozen meals, but Michelle was determined to learn how to cook for herself and her family.\n\nAs she grew older, Michelle's love for cooking only intensified. She spent countless hours experimenting with recipes, watching cooking shows, and reading cookbooks. Her passion for food became her escape from the stresses of everyday life.\n\nDespite her love for cooking, Michelle struggled in school. She found it difficult to focus on subjects that didn't interest her, and her grades suffered as a result. However, she never let her academic struggles discourage her. She knew that she had a talent for cooking and was determined to make a career out of it.\n\nAfter graduating from high school, Michelle decided to pursue her dream of becoming a chef. She enrolled in a culinary school in New York City, where she excelled in her classes and impressed her instructors with her natural talent and creativity in the kitchen.\n\nDuring her time in culinary school, Michelle also discovered a love for photography and social media. She started an Instagram account to document her culinary creations and quickly gained a following for her beautiful food photography and creative recipes.\n\nAfter graduating from culinary school, Michelle returned to New Jersey to start her career as a chef. She worked in various restaurants, gaining experience and honing her skills, but she always felt a pull towards entrepreneurship. With the encouragement of her friends and followers on Instagram, Michelle decided to open her own restaurant, combining her love for cooking and photography.\n\nHer restaurant, aptly named \"Rose's Kitchen,\" quickly became a hit, with people coming from all over to taste Michelle's unique and delicious dishes. She also continued to share her culinary adventures and artistic endeavors on Instagram, inspiring others to follow their passions and live life to the fullest.\n\nNow, at 25 years old, Michelle is a successful chef, business owner, and social media influencer. She continues to embrace her flexible and spontaneous nature, always seeking new adventures and challenges in the kitchen and in life. With her above average beauty and face, she effortlessly captures the hearts and taste buds of those around her, leaving a lasting impression wherever she goes."}
{"Name":"Rhonda Hill","Age":30,"Sex":"female","Country of Origin":"USA","State or Province":"New Jersey","Education Level":"Bachelor","MBTI Personality":"ISFP","Lifestyle":"astrology","Backstory":"Rhonda Hill was born and raised in the bustling state of New Jersey, USA. From a young age, she was always fascinated by the stars and the mysteries of the universe. Her parents, both successful lawyers, encouraged her curiosity and nurtured her love for astrology.\n\nGrowing up, Rhonda was an average student, but she had a natural talent for understanding the complexities of the zodiac signs and their influence on people's lives. She spent countless hours studying astrology books and practicing her skills, much to the amusement of her friends and family.\n\nAfter graduating high school, Rhonda decided to pursue her passion for astrology and enrolled in a Bachelor's degree program in Astrology and Astronomy at a prestigious university. Her parents were initially skeptical of her choice, but Rhonda was determined to follow her heart.\n\nDuring her time in college, Rhonda became known for her unconventional and free-spirited nature. She was always up for spontaneous adventures and was often found stargazing on the rooftop of her dorm with her fellow astrology enthusiasts.\n\nAfter graduating with her Bachelor's degree, Rhonda moved back to her hometown in New Jersey and started her own astrology consulting business. She quickly gained a loyal following of clients who were amazed by her accurate readings and intuitive insights.\n\nIn her free time, Rhonda loves to express her creativity through various artistic endeavors. She is a talented painter and often showcases her artwork on her Instagram page, along with her spontaneous travel adventures and astrology insights.\n\nDespite her average appearance, Rhonda's magnetic personality and passion for astrology make her stand out in a crowd. She is a firm believer in living life to the fullest and encourages others to do the same through her social media presence.\n\nRhonda Hill may seem like an average 30-year-old from New Jersey, but her love for astrology and free-spirited nature make her anything but ordinary. She continues to inspire others to embrace their passions and live life on their own terms."}
{"Name":"John Miller","Age":22,"Sex":"male","Country of Origin":"USA","State or Province":"Arizona","Education Level":"No High School","MBTI Personality":"ISTJ","Lifestyle":"fashion","Backstory":"John Miller was born and raised in the scorching heat of Arizona, USA. He grew up in a small town with his parents and two younger siblings. From a young age, John was always interested in fashion and had a natural eye for style. He would spend hours browsing through fashion magazines and experimenting with different outfits.\n\nHowever, John's passion for fashion was often overshadowed by his family's financial struggles. His parents worked long hours to make ends meet, leaving little time or money for John to pursue his interests. Despite this, John remained determined and found ways to express his love for fashion through thrifting and DIY projects.\n\nAs he got older, John faced another challenge - school. He struggled with academics and found it difficult to focus in a traditional classroom setting. His grades suffered, and at the age of 16, he dropped out of high school. His decision was met with disappointment from his parents, but John knew that traditional education was not for him.\n\nWith no high school degree, John found it difficult to secure a stable job. He worked odd jobs here and there, but his true passion still lay in fashion. He turned to social media as a way to showcase his unique style and connect with like-minded individuals. His Instagram account quickly gained a following, and he was soon recognized for his impeccable sense of fashion.\n\nJohn's feed was a carefully curated collection of outfits, showcasing his creativity and attention to detail. He became known for his bold fashion choices and his ability to turn thrifted pieces into high-fashion looks. Brands started to take notice of his growing influence, and he began receiving collaborations and sponsorships.\n\nDespite his success on social media, John remained humble and grounded. He continued to work hard and save money to pursue his dream of starting his own fashion line. He poured all of his time and energy into this venture, and it paid off. His first collection was a hit, and he was soon featured in fashion magazines and invited to fashion events.\n\nToday, at 22 years old, John Miller is a successful fashion designer and influencer. His Instagram feed is still meticulously planned, but now it showcases his own designs and collaborations with top fashion brands. He may have taken an unconventional path, but John's passion and determination have led him to a fulfilling career in the fashion industry."}
{"Name":"Marissa Weiss","Age":24,"Sex":"female","Country of Origin":"USA","State or Province":"Texas","Education Level":"High School","MBTI Personality":"INFP","Lifestyle":"diy","Backstory":"Marissa Weiss grew up in a small town in Texas, surrounded by the vast beauty of the countryside. Her parents were hardworking farmers who instilled in her a strong work ethic and a love for nature. As a child, Marissa spent most of her days playing in the fields, collecting wildflowers and creating art with whatever materials she could find.\n\nIn high school, Marissa's creativity and eye for beauty caught the attention of her art teacher. She encouraged Marissa to pursue her passion for art and pushed her to apply for an art program at a prestigious university. Despite her parents' reservations about the cost, Marissa was determined to follow her dreams.\n\nAfter graduating high school, Marissa moved to the city to attend the art program. It was a culture shock for her, but she quickly adapted and found a sense of community in the art school. However, she struggled to fit in with the wealthy and privileged students who seemed to have everything handed to them.\n\nTo make ends meet, Marissa took on odd jobs and started selling her handmade crafts at local markets. She discovered a love for DIY projects and found solace in creating beautiful things with her own hands. Her Instagram account became her outlet for sharing her creations and connecting with like-minded individuals.\n\nDespite facing financial challenges and feeling like an outsider, Marissa graduated with a degree in fine arts. She moved back to her hometown, determined to make a living as an artist. She set up a small studio in her parents' barn and continued selling her crafts at markets, but she also started offering DIY workshops and classes.\n\nMarissa's workshops became popular among the locals, and her Instagram account gained a following. People were drawn to her unique style and her message of finding beauty in the world around us. She used her platform to promote sustainability and the importance of supporting local artists and businesses.\n\nNow, at 24 years old, Marissa has found success and fulfillment in her passion for DIY. She continues to live in her small town, surrounded by the beauty of nature, and uses her platform to inspire others to embrace their creativity and find beauty in the world. Her high beauty and high face may catch people's attention, but it's her deep compassion and desire to make a positive impact that truly sets her apart."}
{"Name":"Lori Landry","Age":21,"Sex":"female","Country of Origin":"USA","State or Province":"New Jersey","Education Level":"High School","MBTI Personality":"ESFP","Lifestyle":"fashion","Backstory":"Lori Landry was born and raised in the bustling state of New Jersey. Her parents, both successful business owners, instilled in her a strong work ethic and a love for fashion from a young age. Growing up, Lori was always fascinated with the latest trends and styles, spending hours flipping through fashion magazines and experimenting with different looks.\n\nIn high school, Lori's love for fashion only grew stronger. She was known for her impeccable sense of style and her ability to put together unique and eye-catching outfits. Her classmates often turned to her for fashion advice and she was always more than happy to help.\n\nDespite her love for fashion, Lori's parents pushed her to focus on her studies and pursue a more traditional career path. So, after graduating high school with top honors, Lori enrolled in a prestigious university to study business. However, she couldn't shake off her love for fashion and would often spend her free time browsing through fashion blogs and attending local fashion events.\n\nDuring her sophomore year, Lori decided to take a leap of faith and pursue her passion for fashion. She started a fashion blog and quickly gained a following for her bold and unique style. Her Instagram account also took off, showcasing her love for fashion and capturing her fun-loving and vibrant personality.\n\nDespite facing some initial pushback from her parents, Lori's success and passion for fashion won them over. They eventually came to support her dreams and even helped her start her own online boutique. Lori's boutique quickly became a hit among her followers and her unique style and eye for fashion earned her a loyal customer base.\n\nNow, at 21 years old, Lori is a successful business owner and fashion influencer. She continues to inspire others with her bold and unique style, and her social media is a reflection of her passion for fashion and her zest for life. With her high beauty and high face, Lori is a force to be reckoned with in the fashion world and she has no plans of slowing down anytime soon."}
{"Name":"Karen Berg","Age":21,"Sex":"female","Country of Origin":"USA","State or Province":"Ohio","Education Level":"High School","MBTI Personality":"INTP","Lifestyle":"engineering","Backstory":"Karen Berg was born and raised in a small town in Ohio, USA. From a young age, she showed a natural curiosity and knack for problem-solving. Her parents, both engineers, noticed her potential and encouraged her to explore her interests in science and mathematics.\n\nGrowing up, Karen was always at the top of her class, excelling in subjects like physics and calculus. She was also an avid reader, devouring books on engineering and technology. Her love for logical analysis and theoretical exploration only grew stronger with time.\n\nAs she entered high school, Karen became known as the go-to person for help with math and science problems. She enjoyed the challenge of solving complex equations and was always eager to learn more. Her classmates often joked that she had a \"beautiful mind\" due to her exceptional intelligence and sharp wit.\n\nDespite her academic success, Karen struggled with fitting in socially. She was often teased for being too serious and not interested in typical teenage activities. However, she found solace in her studies and spent most of her free time tinkering with gadgets and building elaborate structures out of Legos.\n\nAfter graduating from high school with top honors, Karen decided to pursue her passion for engineering. She attended a prestigious university and majored in mechanical engineering. Her dedication and hard work paid off, and she graduated with flying colors.\n\nNow, at 21 years old, Karen has landed her dream job at a leading engineering firm. She spends her days designing and building innovative machines, always pushing the boundaries of what is possible. Her Instagram and lifestyle reflect her love for engineering, with posts showcasing her latest projects and intellectual pursuits.\n\nDespite her busy schedule, Karen still finds time to mentor young girls interested in STEM fields. She hopes to inspire and encourage them to follow their passions, just as her parents did for her.\n\nWith her high beauty and high face, Karen may not fit the stereotypical image of an engineer, but she is breaking barriers and proving that intelligence and beauty can go hand in hand. She is a shining example of how hard work, determination, and a love for knowledge can lead to a successful and fulfilling career."}
{"Name":"Mr. Michael Johnson","Age":22,"Sex":"male","Country of Origin":"Canada","State or Province":"Quebec","Education Level":"High School","MBTI Personality":"ENFP","Lifestyle":"comedy","Backstory":"Michael Johnson was born and raised in the bustling city of Montreal, Quebec, Canada. He was the youngest of three children, with two older sisters who doted on him and showered him with love and attention. Growing up, Michael was always the class clown, making his friends and family laugh with his quick wit and humorous antics.\n\nDespite his natural talent for comedy, Michael struggled in school. He found it hard to focus on academics and often got into trouble for disrupting class with his jokes and pranks. His parents, both successful lawyers, were disappointed in his lack of interest in school and constantly pushed him to do better.\n\nBut Michael's passion for comedy could not be ignored. He spent hours watching stand-up comedy specials and studying the greats like Dave Chappelle and Ellen DeGeneres. He even started performing at local open mic nights, much to his parents' disapproval.\n\nAfter graduating high school with just passing grades, Michael decided to pursue his dream of being a comedian. He moved to Toronto, where he enrolled in a comedy program and honed his skills. It was during this time that he also discovered his love for social media and started an Instagram account to showcase his comedic talent.\n\nHis Instagram quickly gained a following, with people drawn to his infectious energy and relatable humor. Michael's posts were a mix of funny sketches, witty one-liners, and behind-the-scenes glimpses into his life as a struggling comedian.\n\nDespite facing challenges and setbacks, Michael's passion and determination never wavered. He continued to work hard, performing at small clubs and open mic nights, and slowly but surely, his name started to gain recognition in the comedy scene.\n\nNow, at 22 years old, Michael is a rising star in the Canadian comedy scene. He has performed at sold-out shows and even landed a few gigs as a guest comedian on popular talk shows. His Instagram following has grown exponentially, and he has become known for his unique brand of humor and infectious personality.\n\nThrough his journey, Michael has proven that sometimes, following your passion and staying true to yourself is the key to success. And he continues to inspire others to do the same through his vibrant and spontaneous social media presence."}
{"Name":"Sean Jones","Age":26,"Sex":"male","Country of Origin":"USA","State or Province":"Washington","Education Level":"Master","MBTI Personality":"ENFP","Lifestyle":"music","Backstory":"Sean Jones was born and raised in the bustling city of Seattle, Washington. From a young age, he was drawn to music, often spending hours tinkering on his father's old guitar and singing along to his favorite songs on the radio. His parents, both successful lawyers, encouraged his love for music but also stressed the importance of education.\n\nAs Sean grew older, he excelled academically and was accepted into one of the top universities in the country. He pursued a degree in music production, determined to turn his passion into a career. During his time in college, Sean spent countless hours in the recording studio, honing his skills and collaborating with other talented musicians.\n\nAfter graduating with his Master's degree, Sean moved back to Seattle and dove headfirst into the music industry. He landed a job at a prominent recording studio, where he worked with some of the biggest names in the industry. His hard work and dedication paid off when he produced a hit song for a well-known artist, earning him recognition and respect in the music community.\n\nDespite his success, Sean remained humble and down-to-earth. He used his platform to promote positivity and spread messages of love and acceptance. His social media presence reflected his optimistic and creative nature, often showcasing his adventures and creative pursuits.\n\nSean's appearance was often described as having \"high beauty and an high face,\" with his sharp jawline and piercing blue eyes. But what truly made him stand out was his infectious smile and warm personality. He had a way of making everyone around him feel at ease and inspired.\n\nIn his free time, Sean loved exploring the outdoors and taking road trips with his friends. He also enjoyed giving back to his community by volunteering at local music programs for underprivileged youth.\n\nAs he continues to make a name for himself in the music industry, Sean remains true to himself and his love for music. He hopes to use his platform to inspire others to follow their dreams and spread positivity through his music and creative endeavors."}
{"Name":"Krystal Espinoza","Age":24,"Sex":"female","Country of Origin":"USA","State or Province":"Nevada","Education Level":"Bachelor","MBTI Personality":"INFP","Lifestyle":"psychology","Backstory":"Krystal Espinoza was born and raised in the bustling city of Las Vegas, Nevada. Her parents, both successful business owners, instilled in her a strong work ethic and a drive for success from a young age. Growing up, Krystal was always curious about the human mind and behavior, often spending hours observing people and trying to understand their actions and motivations.\n\nAs she got older, Krystal's fascination with psychology only grew stronger. She excelled in her high school psychology classes and knew that she wanted to pursue a career in the field. With the support of her family, she decided to attend the University of Nevada, Las Vegas, where she earned a Bachelor's degree in Psychology.\n\nDuring her time in college, Krystal was known for her above-average beauty and above-average intellect. She was a natural leader and was often sought out by her peers for advice and guidance. Her professors were impressed by her passion for the subject and encouraged her to continue her studies in graduate school.\n\nAfter graduating, Krystal landed a job at a prestigious psychology research institute in Las Vegas. She quickly made a name for herself in the field, conducting groundbreaking research on the effects of social media on self-esteem and body image. Her work gained recognition and she was invited to present at conferences around the country.\n\nIn her free time, Krystal used her platform on social media to share her knowledge and promote mental health awareness. Her Instagram account, filled with aesthetically pleasing photos and thought-provoking captions, gained a large following and she became somewhat of an influencer in the psychology community.\n\nDespite her success, Krystal remained humble and grounded, always staying true to her personal values and beliefs. She used her platform to advocate for social justice and equality, often using her own experiences as a biracial woman to shed light on important issues.\n\nNow at 24 years old, Krystal continues to make strides in her career and is determined to make a positive impact on the world through her work in psychology. She hopes to one day open her own private practice, where she can help individuals overcome their struggles and live their best lives."}
{"Name":"Mr. Frederick Anderson","Age":28,"Sex":"male","Country of Origin":"USA","State or Province":"Ohio","Education Level":"No High School","MBTI Personality":"ISFP","Lifestyle":"diy","Backstory":"Frederick Anderson was born and raised in a small town in Ohio, USA. He grew up in a modest household with his parents and two older siblings. From a young age, Frederick was always drawn to creativity and expressing himself through art. He spent hours drawing and painting, often using materials he found around the house.\n\nDespite his love for art, Frederick struggled in school. He found the traditional education system to be limiting and stifling, and he often felt like he didn't fit in with his peers. As a result, he dropped out of high school at the age of 16, much to the disappointment of his parents.\n\nWith no high school degree, Frederick had a hard time finding a stable job. He bounced from one minimum wage job to another, feeling unfulfilled and unsatisfied. But he never gave up on his passion for art and continued to create in his free time.\n\nAt the age of 25, Frederick decided to take a leap of faith and pursue his dream of becoming a full-time artist. He moved to a bigger city in Ohio and started selling his artwork at local markets and art fairs. He also began to share his creations on social media, particularly on Instagram.\n\nHis unique and eye-catching pieces caught the attention of many, and soon his Instagram following grew rapidly. People were drawn to his unconventional approach to art and his DIY techniques. Frederick's posts were not just limited to paintings and drawings, but also included handmade jewelry, home decor, and even clothing.\n\nAs his popularity on Instagram grew, so did his confidence. Frederick began to experiment with different styles and techniques, constantly pushing himself to try new things. His adaptability and willingness to learn earned him a reputation as a versatile artist.\n\nNow, at the age of 28, Frederick has become a well-known and respected artist in his community. He continues to share his passion for DIY and encourages others to embrace their creativity through his Instagram posts and workshops. Despite not having a high school degree, Frederick has found success and fulfillment by following his heart and pursuing his passion for art."}
{"Name":"Peter Odonnell","Age":29,"Sex":"male","Country of Origin":"USA","State or Province":"Washington","Education Level":"High School","MBTI Personality":"ENTJ","Lifestyle":"education","Backstory":"Peter Odonnell was born and raised in the bustling city of Seattle, Washington. From a young age, he showed a natural inclination towards learning and excelled in his studies. His parents, both successful professionals, instilled in him the value of education and encouraged him to pursue his passions.\n\nIn high school, Peter was a straight-A student and actively participated in various extracurricular activities. He was a member of the debate team, where he honed his public speaking skills and developed a love for strategic thinking. He also played on the school's soccer team, showcasing his leadership abilities on the field.\n\nAfter graduating from high school, Peter decided to continue his education at the University of Washington. He majored in Business Administration and minored in Psychology, a combination that allowed him to understand both the financial and human aspects of running a successful business. During his time at university, he was heavily involved in student organizations and served as the president of the Business Club.\n\nUpon completing his degree, Peter landed a job at a prestigious consulting firm in Seattle. He quickly rose through the ranks, thanks to his sharp mind and excellent problem-solving skills. His colleagues and superiors were impressed by his ability to come up with innovative solutions and his knack for long-term planning.\n\nOutside of work, Peter's Instagram account reflects his passion for education and personal growth. He shares inspiring quotes, book recommendations, and insights into his own learning journey. His followers admire his commanding yet approachable demeanor and often seek his advice on leadership and career development.\n\nAt 29 years old, Peter is a highly successful and respected professional in his field. He continues to strive for excellence in all aspects of his life and hopes to one day use his knowledge and skills to make a positive impact on society."}
{"Name":"Summer Wilson","Age":22,"Sex":"female","Country of Origin":"USA","State or Province":"California","Education Level":"No High School","MBTI Personality":"ESFP","Lifestyle":"health","Backstory":"Summer Wilson was born and raised in the sunny state of California, USA. She grew up in a small town on the outskirts of Los Angeles, surrounded by the beauty of nature and the vibrant energy of the city. From a young age, Summer was always drawn to a healthy and active lifestyle. She loved spending her days outdoors, whether it was hiking in the mountains or playing sports with her friends.\n\nHowever, Summer's academic journey was not as smooth as her love for nature. She struggled in school and found it difficult to focus on traditional subjects. Despite her efforts, she was unable to graduate high school. This was a huge setback for Summer, but she refused to let it define her. She knew that she had a passion for health and wellness, and she was determined to make a career out of it.\n\nAt the age of 18, Summer moved to the bustling city of Los Angeles to pursue her dreams. She started working at a local gym, where she gained valuable experience and knowledge about fitness and nutrition. She also took online courses and attended workshops to further her education in the field of health and wellness.\n\nAs she delved deeper into her passion, Summer also discovered a love for social media. She started sharing her journey on Instagram, showcasing her healthy meals, workout routines, and overall positive outlook on life. Her vibrant personality and stunning appearance quickly caught the attention of many, and her following grew rapidly.\n\nNow, at the age of 22, Summer has become a social media influencer, inspiring thousands of people to live a healthy and happy lifestyle. She has collaborated with various brands and has even started her own line of health and wellness products. Despite not having a high school degree, Summer has proven that determination and passion can lead to success.\n\nThrough her Instagram and lifestyle, Summer aims to spread positivity and encourage others to prioritize their health and wellbeing. She believes that everyone is capable of achieving their dreams, no matter their background or education. Summer's journey is a testament to the fact that with hard work, anything is possible."}
{"Name":"Andrew Snow","Age":21,"Sex":"male","Country of Origin":"USA","State or Province":"New York","Education Level":"No High School","MBTI Personality":"ENFP","Lifestyle":"lifestyle","Backstory":"Andrew Snow was born and raised in the bustling city of New York. Growing up, he was always a curious and adventurous child, constantly seeking new experiences and ways to express his creativity. However, as he entered his teenage years, Andrew struggled with the traditional education system. He found it difficult to conform to the structured and rigid environment of high school, and eventually dropped out at the age of 16.\n\nWith no high school degree, Andrew faced many challenges in finding employment. But he refused to let his lack of formal education hold him back. Instead, he turned to his passion for lifestyle and began documenting his adventures on Instagram. His posts quickly gained traction, with people drawn to his unique perspective and eye for aesthetics.\n\nThrough his Instagram, Andrew was able to connect with like-minded individuals and build a community of free spirits who shared his love for unconventional living. He used his platform to showcase his love for fashion, travel, and all things creative, inspiring others to embrace their individuality and live life to the fullest.\n\nDespite facing judgment and criticism for not having a high school degree, Andrew remained unfazed. He knew that his education was not limited to a classroom and that he was constantly learning and growing through his experiences and interactions with others.\n\nNow at 21 years old, Andrew has become a successful influencer, collaborating with brands that align with his values and passions. He continues to explore the world and share his unique perspective, inspiring others to break free from societal norms and live authentically. Through his Instagram and lifestyle, Andrew has found his true calling and has become a role model for those who dare to live outside the box."}
{"Name":"Troy Herrera","Age":19,"Sex":"male","Country of Origin":"USA","State or Province":"Alabama","Education Level":"High School","MBTI Personality":"INTP","Lifestyle":"architecture","Backstory":"Troy Herrera was born and raised in a small town in Alabama, USA. From a young age, he was always fascinated by the architecture of the buildings and structures around him. He would spend hours drawing and sketching his own designs, dreaming of one day becoming an architect.\n\nGrowing up, Troy was always a curious and inquisitive child. He was constantly questioning the world around him and challenging conventional thinking. This often got him into trouble with his teachers and peers, but he didn't let that stop him from pursuing his interests.\n\nIn high school, Troy's passion for architecture only grew stronger. He took every art and design class available and excelled in them. His teachers recognized his talent and encouraged him to pursue a career in architecture. With their support, Troy worked hard and graduated with top honors.\n\nAfter high school, Troy decided to take a gap year to travel and gain inspiration for his designs. He visited different countries, immersing himself in their unique architecture and culture. He also documented his travels through his Instagram account, showcasing his love for architecture and his unique perspective on design.\n\nDuring his travels, Troy also took on odd jobs to fund his adventures. He worked as a construction worker, a landscaper, and even a tour guide, learning valuable skills and gaining a deeper understanding of the construction process.\n\nNow, at 19 years old, Troy is ready to start his journey towards becoming an architect. He has enrolled in a prestigious architecture program and is determined to make a name for himself in the industry. His Instagram and lifestyle continue to reflect his passion for architecture, and his followers are always inspired by his ingenious designs and unconventional thinking.\n\nDespite his young age, Troy's talent and determination have already caught the attention of renowned architects and design firms. He knows that the road ahead won't be easy, but he is excited for the challenges and opportunities that await him. With his high intelligence and striking appearance, Troy is destined to leave a lasting impact on the world of architecture."}
{"Name":"Jamie Payne","Age":28,"Sex":"female","Country of Origin":"USA","State or Province":"Michigan","Education Level":"Bachelor","MBTI Personality":"INFJ","Lifestyle":"psychology","Backstory":"Jamie Payne was born and raised in a small town in Michigan, USA. From a young age, she was always fascinated by the complexities of the human mind. She was a curious child, always asking questions and trying to understand the reasons behind people's actions and emotions. Her parents, who were both teachers, encouraged her curiosity and nurtured her love for learning.\n\nAs she grew older, Jamie's passion for psychology only intensified. She excelled in her high school psychology classes and knew that she wanted to pursue it as a career. After graduating with top honors, she went on to attend a prestigious university where she earned her Bachelor's degree in Psychology.\n\nDuring her time at university, Jamie was known for her inquisitive nature and her ability to empathize with others. She was always there for her friends, lending a listening ear and offering advice when needed. Her professors were impressed by her deep understanding of human behavior and encouraged her to further her studies in the field.\n\nAfter graduating, Jamie moved to the bustling city of Detroit to start her career. She landed a job at a prestigious psychology clinic, where she worked with patients of all ages and backgrounds. Her colleagues admired her dedication and natural talent for helping others. Jamie's approach to therapy was unique, as she incorporated her love for art and creativity into her sessions. She believed that art and self-expression were powerful tools for healing and self-discovery.\n\nOutside of work, Jamie's Instagram was a reflection of her soul. She used the platform to share her thoughts on psychology, mental health, and self-care. Her posts were thought-provoking and often resonated with her followers. She also shared snippets of her own life, showcasing her love for nature, travel, and photography.\n\nDespite her slightly above average beauty and face, Jamie was never one to conform to societal standards. She embraced her quirks and imperfections, and encouraged others to do the same. Her empathetic outlook towards life and her passion for helping others made her a beloved figure in her community.\n\nAs she approaches her 30s, Jamie is excited to continue growing and learning in her career and personal life. She hopes to one day open her own therapy practice, combining traditional therapy techniques with her love for art and creativity. With her vision and passion, there's no doubt that Jamie Payne will continue to make a positive impact on those around her."}
{"Name":"Brian Greene","Age":21,"Sex":"male","Country of Origin":"USA","State or Province":"Ohio","Education Level":"High School","MBTI Personality":"ENTP","Lifestyle":"tech","Backstory":"Brian Greene was born and raised in a small town in Ohio, USA. From a young age, he showed a natural curiosity and passion for all things tech-related. His parents, both engineers, encouraged his interests and provided him with the latest gadgets and devices to explore.\n\nIn high school, Brian excelled in math and science, often participating in robotics and coding clubs. He was always the first to try out new technologies and was known for his innovative ideas and problem-solving skills. Despite his love for technology, Brian also had a strong interest in philosophy and spent hours debating with his friends about the latest scientific theories and ethical dilemmas.\n\nAfter graduating high school with top honors, Brian was accepted into a prestigious university to study computer science. However, he decided to take a gap year to explore his interests and gain real-world experience before continuing his education.\n\nDuring this time, Brian started his own tech blog and Instagram account, showcasing his love for all things tech. His content quickly gained a following, with people drawn to his unique perspective and thought-provoking debates. He also used his platform to share his ideas for innovative solutions to real-world problems.\n\nDespite his busy schedule, Brian never stopped learning. He attended tech conferences and workshops, networked with industry professionals, and even took online courses to further his knowledge. His dedication and passion for technology were evident in everything he did.\n\nNow, at 21 years old, Brian has a High School degree but is well on his way to becoming a tech industry leader. His Instagram and lifestyle reflect his love for all things tech, with his appearance described as having \"very high beauty and an very high face.\" He continues to inspire others with his intellectual debates and innovative ideas, always pushing the boundaries and challenging the status quo. With his curious and argumentative nature, Brian is determined to make a positive impact on the world through technology."}
{"Name":"Angela Rogers","Age":25,"Sex":"female","Country of Origin":"USA","State or Province":"Kansas","Education Level":"Bachelor","MBTI Personality":"INFP","Lifestyle":"art","Backstory":"Angela Rogers was born and raised in a small town in Kansas, USA. Growing up, she was always drawn to art and creativity. Her parents, both working-class individuals, encouraged her love for art and provided her with the necessary tools and resources to explore her passion.\n\nFrom a young age, Angela showed a natural talent for drawing and painting. Her teachers and peers were always amazed by her ability to capture the beauty of the world around her through her art. Despite her talent, Angela was a shy and introverted child, preferring to express herself through her artwork rather than words.\n\nAs she grew older, Angela's love for art only intensified. She spent countless hours in her room, lost in her own world of colors and imagination. Her parents recognized her talent and encouraged her to pursue a degree in Fine Arts. With their support, Angela attended a prestigious art school and graduated with a Bachelor's degree in Fine Arts.\n\nAfter graduation, Angela moved to the city to pursue her dream of becoming a professional artist. She found a small studio apartment and worked odd jobs to make ends meet while she focused on building her portfolio. Her hard work paid off when she was offered her first solo exhibition at a local art gallery. The exhibition was a huge success, and Angela's unique style and perspective garnered her a lot of attention.\n\nAs her career took off, Angela's social media presence also grew. She created an Instagram account to showcase her artwork and share her thoughts and insights with the world. Her followers were captivated by her introspective and thought-provoking posts, and her page became a canvas for her rich inner world.\n\nAngela's appearance also added to her allure. With her high cheekbones, piercing blue eyes, and a contagious smile, she was often described as having \"high beauty and a high face.\" But despite her outward beauty, Angela remained humble and grounded, using her platform to spread positivity and inspire others to embrace their creativity.\n\nToday, at 25 years old, Angela Rogers is a successful and renowned artist, with her work displayed in galleries and collections all over the world. She continues to use her art as a medium for self-expression and a way to connect with others, and her Instagram remains a source of inspiration for many."}
{"Name":"Lauren Bennett","Age":26,"Sex":"female","Country of Origin":"USA","State or Province":"Florida","Education Level":"No High School","MBTI Personality":"ENTJ","Lifestyle":"business","Backstory":"Lauren Bennett was born and raised in the sunny state of Florida, USA. Growing up, she was always a determined and ambitious child, with a natural knack for leadership and business. However, her family's financial struggles made it difficult for her to pursue her dreams of higher education. Despite this setback, Lauren refused to let it hold her back from achieving success.\n\nAt the age of 18, Lauren dropped out of high school to help support her family. She took on multiple odd jobs, from waitressing to retail, to make ends meet. But her entrepreneurial spirit never died, and she always dreamed of starting her own business.\n\nWith her hard-earned savings, Lauren decided to take a leap of faith and invest in her first business venture \u2013 an online boutique selling unique and trendy clothing. Her sharp business acumen and keen eye for fashion quickly turned her small boutique into a successful and thriving business. Lauren's social media presence and strategic marketing skills played a significant role in the boutique's success, and she soon gained a large following on Instagram.\n\nAs her business continued to grow, Lauren's passion for entrepreneurship only intensified. She started attending workshops and networking events, soaking up as much knowledge and advice as she could from successful business leaders. With her determination and drive, Lauren was able to expand her business into a brick-and-mortar store, becoming a well-known name in the local fashion scene.\n\nToday, at the age of 26, Lauren is a successful businesswoman and influencer, with a strong online presence and a loyal customer base. Despite not having a high school degree, she has proven that with hard work, determination, and a clear vision, anything is possible. Lauren's Instagram and lifestyle reflect her passion for business, and she continues to inspire others to chase their dreams and never give up on their goals."}
{"Name":"Mark Payne","Age":29,"Sex":"male","Country of Origin":"USA","State or Province":"North Carolina","Education Level":"Bachelor","MBTI Personality":"ESTJ","Lifestyle":"law","Backstory":"Mark Payne was born and raised in a small town in North Carolina, USA. Growing up, he was always known for his sharp mind and strong sense of justice. His parents, both lawyers, instilled in him a deep respect for the law and a desire to make a positive impact in the world through the legal system.\n\nFrom a young age, Mark excelled in school and was a natural leader among his peers. He was always the one to speak up against injustice and was not afraid to challenge authority when necessary. His passion for law and justice only grew stronger as he got older.\n\nAfter graduating high school with top honors, Mark attended a prestigious university in North Carolina, where he earned a Bachelor's degree in Political Science with a minor in Pre-Law. During his time in college, he was actively involved in various student organizations, including the debate team and the student government. His exceptional leadership skills and dedication to his studies earned him recognition and respect from his peers and professors.\n\nUpon graduation, Mark knew that he wanted to pursue a career in law. He applied and was accepted into a top law school in North Carolina, where he excelled academically and graduated at the top of his class. During his time in law school, he also interned at a renowned law firm, where he gained practical experience and honed his legal skills.\n\nAfter passing the bar exam with flying colors, Mark joined the law firm where he interned and quickly made a name for himself as a brilliant and dedicated lawyer. He was known for his attention to detail, strong work ethic, and unwavering commitment to justice. His passion for law and his natural leadership abilities made him a valuable asset to the firm.\n\nOutside of work, Mark enjoys maintaining a structured and disciplined lifestyle. He is an avid fitness enthusiast and can often be found at the gym or participating in various sports leagues. He also enjoys traveling and often shares photos of his adventures on his Instagram, where he also shares content related to law and justice.\n\nAt 29 years old, Mark has already achieved great success in his career and is well-respected in the legal community. He continues to strive for excellence in all aspects of his life and is determined to make a positive impact in the world through his work in law."}
{"Name":"Laurie Hill MD","Age":25,"Sex":"female","Country of Origin":"USA","State or Province":"California","Education Level":"Bachelor","MBTI Personality":"INFP","Lifestyle":"architecture","Backstory":"Laurie Hill MD was born and raised in the bustling city of Los Angeles, California. From a young age, she was always drawn to the vibrant and diverse architecture that surrounded her. As a child, she would spend hours wandering the streets, admiring the unique designs and structures that seemed to come to life before her very eyes.\n\nGrowing up, Laurie's parents always encouraged her to pursue her passions and never settle for anything less than her dreams. With their support, she excelled in school and earned a Bachelor's degree in Architecture from the prestigious University of California, Berkeley.\n\nAfter college, Laurie landed a job at a top architecture firm in Los Angeles, where she quickly made a name for herself with her innovative and creative designs. But despite her success, she felt like something was missing. She longed for a way to express her introspective thoughts and ideas beyond the confines of her work.\n\nThat's when she turned to Instagram. With her keen eye for aesthetics and her love for architecture, Laurie's Instagram quickly became a canvas for her imagination. She shared photos of the buildings and structures that inspired her, along with her own musings on the beauty and complexity of the world around her.\n\nAs her following grew, Laurie's Instagram became a platform for her to connect with other like-minded individuals who shared her passion for architecture. Her posts were not just about showcasing her work, but also about sparking conversations and inspiring others to see the world through a different lens.\n\nWith her high beauty and sharp features, Laurie's Instagram quickly caught the attention of many, and she became known as much for her stunning appearance as she was for her architectural prowess. But for Laurie, her true beauty lay in her rich inner world, which she shared with her followers through her thoughtful captions and engaging stories.\n\nToday, at 25 years old, Laurie continues to thrive in her career as an architect while also using her Instagram as a platform to inspire and connect with others. Her passion for architecture and her desire to create a meaningful impact in the world through her work and her social media presence make her a force to be reckoned with in the industry."}
{"Name":"James Smith","Age":19,"Sex":"male","Country of Origin":"USA","State or Province":"Kentucky","Education Level":"No High School","MBTI Personality":"INTP","Lifestyle":"engineering","Backstory":"James Smith was born and raised in a small town in Kentucky, USA. His parents were hardworking farmers who instilled in him the value of determination and perseverance. From a young age, James showed a natural curiosity and love for tinkering with machines and gadgets. He would often spend hours in his father's workshop, taking apart and putting back together old tractors and lawnmowers.\n\nDespite his love for engineering, James struggled in school. He found it difficult to sit still in a classroom and was often bored by the traditional teaching methods. As a result, he dropped out of high school at the age of 16, much to the disappointment of his parents. However, James knew that he was meant for something more than a traditional education.\n\nWith the support of his parents, James began to pursue his passion for engineering on his own. He spent countless hours reading books and watching online tutorials, teaching himself the principles of mechanics and electronics. He also started to document his projects and experiments on his Instagram, showcasing his unique and unconventional approach to engineering.\n\nAs James's skills and knowledge grew, so did his following on Instagram. People were amazed by his ingenuity and unconventional thinking. His content challenged conventional engineering practices, and he quickly gained a reputation as a rebel in the field.\n\nAt the age of 19, James's Instagram had over 100,000 followers, and he was being approached by companies and universities for collaborations and internships. Despite his lack of formal education, his passion and talent for engineering were undeniable.\n\nJames's appearance also added to his allure. With his striking features and piercing blue eyes, he had a magnetic presence that drew people in. His followers often described him as having a \"high beauty and a high face,\" a term that James found both amusing and fitting.\n\nToday, James continues to push the boundaries of engineering and inspire others with his unconventional approach. He has no regrets about dropping out of high school and is proud to have carved his own path in life. His Instagram and lifestyle reflect his passion for engineering and his determination to challenge conventional thinking."}
{"Name":"Nina Leon","Age":21,"Sex":"female","Country of Origin":"USA","State or Province":"Washington","Education Level":"High School","MBTI Personality":"ENFP","Lifestyle":"beauty","Backstory":"Nina Leon was born and raised in the bustling city of Seattle, Washington. She grew up in a loving and supportive family, with both of her parents working as successful entrepreneurs. From a young age, Nina was exposed to the fast-paced world of business and learned the importance of hard work and determination.\n\nGrowing up, Nina was always fascinated by the world of beauty. She would spend hours experimenting with makeup and creating different looks on herself and her friends. Her natural talent and eye for detail quickly became apparent, and she knew that this was her true passion.\n\nDespite her love for beauty, Nina's parents always emphasized the importance of education. She excelled in school and graduated from high school with top honors. However, instead of immediately jumping into college, Nina decided to take a gap year to explore her creative side and pursue her passion for beauty.\n\nDuring this gap year, Nina started her own Instagram account, where she shared her makeup looks, skincare routines, and beauty tips. Her posts quickly gained popularity, and she became known for her high beauty and high fashion sense. Nina's positive and optimistic personality shined through her posts, and she gained a loyal following of fans who were inspired by her creativity and adventurous spirit.\n\nAs her following grew, so did her opportunities. Nina started collaborating with various beauty brands, creating sponsored content and attending events as a beauty influencer. She also used her platform to promote self-love and body positivity, encouraging her followers to embrace their unique beauty.\n\nNow, at 21 years old, Nina has become a successful beauty influencer and entrepreneur. She has launched her own makeup line and has even been featured in magazines and on television for her innovative beauty techniques. Despite her busy schedule, Nina always finds time to give back to her community, volunteering at local beauty workshops and donating a portion of her profits to charities that support women's empowerment.\n\nNina's journey to success has been fueled by her passion for beauty, her optimistic nature, and her determination to make a positive impact on the world. She continues to inspire others through her creative pursuits, and her future is bright with endless possibilities."}
{"Name":"Tyler Pope","Age":20,"Sex":"male","Country of Origin":"USA","State or Province":"Colorado","Education Level":"No High School","MBTI Personality":"ISTJ","Lifestyle":"business","Backstory":"Tyler Pope was born and raised in the beautiful state of Colorado, USA. He was the youngest of three children, with two older sisters who doted on him and always encouraged him to chase his dreams. From a young age, Tyler showed a natural talent for business and a strong drive to succeed.\n\nGrowing up in a middle-class family, Tyler was always determined to make something of himself and become financially independent. However, his journey was not an easy one. Tyler struggled in school and found it difficult to focus on his studies. As a result, he dropped out of high school at the age of 16, much to the disappointment of his parents.\n\nDespite not having a high school degree, Tyler refused to let his lack of education hold him back. He was determined to prove to himself and others that success was not determined by a piece of paper. With the support of his family, Tyler started working odd jobs and saving up money to start his own business.\n\nAt the age of 18, Tyler launched his own online business selling unique and trendy clothing items. He used social media, specifically Instagram, to promote his business and quickly gained a large following. His eye for fashion and knack for marketing helped him grow his business exponentially, and soon he was making more money than he ever thought possible.\n\nAs his business continued to thrive, Tyler's Instagram page became a reflection of his passion for business and entrepreneurship. He carefully curated his posts and utilized strategic hashtags to attract a larger audience. His dedication and precision in his online presence paid off, as he gained even more followers and caught the attention of major fashion brands.\n\nNow, at the age of 20, Tyler's business has become a huge success, and he is known as a rising star in the fashion industry. He has been featured in numerous fashion magazines and has even collaborated with well-known designers. Tyler's appearance is as impressive as his business skills, with his strikingly handsome features and impeccable sense of style.\n\nDespite his success, Tyler remains humble and grateful for the opportunities that have come his way. He hopes to inspire others to chase their dreams and never let their circumstances hold them back. Tyler's journey may have started with a setback, but his determination and passion have led him to achieve his wildest dreams."}
{"Name":"Rebecca King","Age":21,"Sex":"female","Country of Origin":"USA","State or Province":"Virginia","Education Level":"High School","MBTI Personality":"INTP","Lifestyle":"architecture","Backstory":"Rebecca King was born and raised in the bustling city of Richmond, Virginia. From a young age, she was always drawn to the world of architecture and design. Her parents, both successful architects, instilled in her a love for creativity and problem-solving.\n\nGrowing up, Rebecca spent countless hours exploring the streets and buildings of Richmond, fascinated by the unique blend of historic and modern architecture. She would often sketch her favorite buildings and dream of one day creating her own masterpieces.\n\nIn high school, Rebecca's passion for architecture only grew stronger. She excelled in her art and math classes, using her skills to create intricate and innovative designs. Her classmates often turned to her for help with their own projects, impressed by her attention to detail and outside-the-box thinking.\n\nAfter graduating with top honors, Rebecca was accepted into the prestigious architecture program at the University of Virginia. Despite being one of the youngest students in her class, she quickly made a name for herself with her innovative ideas and impeccable work ethic.\n\nDuring her time at university, Rebecca also discovered a love for photography. She would often roam the streets of Charlottesville, capturing the beauty of the city's architecture through her lens. Her Instagram account quickly gained a following as she shared her stunning photographs and unique perspectives on design.\n\nAs she neared the end of her degree, Rebecca was faced with the daunting task of choosing a career path. While many of her classmates were aiming for high-paying corporate jobs, Rebecca knew that she wanted to use her skills to make a positive impact on her community.\n\nAfter much consideration, she decided to start her own architecture firm focused on sustainable and inclusive design. Her goal was to create spaces that not only looked beautiful but also served a purpose and brought people together.\n\nNow, at 21 years old, Rebecca is a successful architect and entrepreneur. Her designs have gained recognition for their creativity and social impact, and her firm is quickly becoming one of the most sought-after in Virginia. Through her work, she continues to challenge conventional thinking and inspire others to see the world through a different lens."}
{"Name":"Steven Rojas","Age":18,"Sex":"male","Country of Origin":"USA","State or Province":"Connecticut","Education Level":"No High School","MBTI Personality":"ESTJ","Lifestyle":"law","Backstory":"Steven Rojas was born and raised in the small town of Hartford, Connecticut. Growing up, he was always a bright and curious child, constantly asking questions and seeking answers. His parents, both hardworking immigrants from Colombia, instilled in him the importance of education and determination.\n\nHowever, despite his natural intelligence and drive, Steven struggled in school. He found the traditional education system to be suffocating and unfulfilling. He often clashed with teachers and authority figures, feeling like he was being held back and not given the opportunity to reach his full potential.\n\nAt the age of 16, Steven made the difficult decision to drop out of high school. His parents were initially disappointed, but they could see how unhappy and unchallenged he was in the traditional school setting. They supported his decision and encouraged him to find his own path.\n\nWith his newfound freedom, Steven began to explore his interests and passions. He discovered a love for law and justice, fueled by his desire to understand and challenge the system that had failed him in school. He spent countless hours reading and researching, immersing himself in the world of law and order.\n\nSteven also began to cultivate a strong social media presence, using platforms like Instagram to share his thoughts and opinions on legal issues. His pragmatic and methodical approach to discussing complex topics gained him a following of like-minded individuals who were drawn to his intelligence and passion.\n\nDespite not having a high school diploma, Steven's knowledge and dedication to the law caught the attention of a local law firm. They offered him an internship, which quickly turned into a full-time job. Steven's exceptional beauty and sharp mind made him stand out in the office, and he quickly became an integral part of the team.\n\nNow, at 18 years old, Steven is well on his way to a successful career in law. He may not have a traditional education, but his determination and self-education have taken him further than he ever thought possible. His social media presence continues to grow, and he hopes to use his platform to inspire others who may feel lost or overlooked in the traditional education system. Steven Rojas is proof that with passion and hard work, anything is possible."}
{"Name":"Heidi Lawson","Age":26,"Sex":"female","Country of Origin":"USA","State or Province":"Ohio","Education Level":"Bachelor","MBTI Personality":"ENFJ","Lifestyle":"travel","Backstory":"Heidi Lawson was born and raised in a small town in Ohio, USA. She was the only child of a middle-class family who instilled in her the values of hard work, determination, and curiosity. From a young age, Heidi was always fascinated by different cultures and the beauty of the world. She would spend hours flipping through National Geographic magazines, dreaming of one day exploring the places she saw in the pages.\n\nAs she grew older, Heidi's passion for travel only intensified. She would save up her allowance and take road trips with her friends to nearby cities, always eager to discover new places and experiences. When it was time for college, Heidi decided to pursue a degree in International Relations, hoping it would open doors for her to see the world.\n\nDuring her time in college, Heidi's love for travel only grew stronger. She spent her summers interning at various non-profit organizations, working on projects that helped underprivileged communities in different parts of the world. Her experiences abroad only fueled her desire to see more of the world and make a positive impact.\n\nAfter graduating with a Bachelor's degree, Heidi landed a job at a global NGO, where she worked for a few years. However, she soon realized that a desk job was not for her. She craved adventure and wanted to see more of the world. So, she made the bold decision to quit her job and become a full-time traveler.\n\nHeidi's Instagram quickly became a platform for her to share her adventures and inspire others to follow their dreams. Her posts were filled with breathtaking landscapes, unique cultures, and inspiring stories of the people she met along the way. Her charismatic and visionary nature shone through her posts, and she quickly gained a large following.\n\nAt 26 years old, Heidi has traveled to over 30 countries and has no plans of slowing down. She believes that travel is not just about seeing new places, but also about learning, growing, and making a positive impact on the world. Her slightly above average beauty and face may catch people's attention, but it is her passion, determination, and kind heart that truly make her stand out. Heidi Lawson is a true citizen of the world, and she will continue to inspire others to chase their dreams and explore the beauty of the world."}
{"Name":"Kaitlyn Brown","Age":21,"Sex":"female","Country of Origin":"USA","State or Province":"California","Education Level":"No High School","MBTI Personality":"ISFJ","Lifestyle":"astrology","Backstory":"Kaitlyn Brown was born and raised in the bustling city of Los Angeles, California. She grew up in a small apartment with her parents and older brother, struggling to make ends meet. Despite their financial struggles, Kaitlyn's parents always instilled in her the importance of education and hard work.\n\nHowever, Kaitlyn's passion for astrology and spirituality began at a young age, when her grandmother would tell her stories about the stars and their meanings. Kaitlyn was fascinated by the idea that the alignment of the planets could have an impact on a person's life and personality.\n\nAs she grew older, Kaitlyn's interest in astrology only grew stronger. She would spend hours reading books and researching online, trying to understand the complexities of the zodiac signs and their meanings. However, her love for astrology often clashed with her parents' expectations for her to focus on her studies and get a high school diploma.\n\nFeeling misunderstood and unsupported, Kaitlyn dropped out of high school at the age of 16. She knew it was a risky decision, but she couldn't ignore her passion any longer. With the support of her grandmother, Kaitlyn started her own astrology blog and Instagram account, sharing her knowledge and insights with the world.\n\nHer unique approach and accurate predictions quickly gained her a following, and before she knew it, Kaitlyn had become a well-known figure in the astrology community. But she didn't let her success get to her head. Kaitlyn remained humble and used her platform to spread positivity and inspire others to follow their passions.\n\nIn addition to her love for astrology, Kaitlyn also had a strong sense of social responsibility. She often volunteered at local charities and organized donation drives for those in need. Her altruistic nature and genuine desire to make a positive impact on the world earned her the title of \"community angel\" among her friends and followers.\n\nNow, at the age of 21, Kaitlyn continues to pursue her passion for astrology while also using her platform to promote social causes and make a difference in the world. Despite not having a high school diploma, Kaitlyn has proven that hard work, determination, and following your heart can lead to great success. She is a true inspiration to those who have been told they can't achieve their dreams."}
{"Name":"Susan White","Age":27,"Sex":"female","Country of Origin":"USA","State or Province":"Michigan","Education Level":"Bachelor","MBTI Personality":"ESFP","Lifestyle":"fitness","Backstory":"Susan White was born and raised in the beautiful state of Michigan, USA. Growing up, she was always a lively and energetic child, always on the go and never afraid to try new things. Her parents, both avid fitness enthusiasts, instilled in her a love for an active lifestyle from a young age. They would often take her on hikes, bike rides, and camping trips, exposing her to the beauty of nature and the importance of staying active.\n\nAs she grew older, Susan's love for fitness only intensified. She excelled in sports, particularly in track and field, where she held numerous records in her high school and college years. She was also an excellent student, earning a Bachelor's degree in Exercise Science from the University of Michigan.\n\nAfter graduating, Susan decided to pursue her passion for fitness and became a certified personal trainer. She started her own fitness business, where she helped people of all ages and backgrounds achieve their fitness goals. Her clients loved her infectious energy and positive attitude, and her business quickly grew.\n\nIn her free time, Susan would often document her fitness journey on Instagram, sharing her workouts, healthy meals, and motivational messages with her growing number of followers. Her social media presence soon caught the attention of fitness brands, and she began collaborating with them, promoting their products and spreading her message of living a healthy and active lifestyle.\n\nAt 27 years old, Susan is living her dream. She continues to inspire others through her social media and personal training business, and her clients often describe her as a ray of sunshine in their lives. With her above-average beauty and an above-average face, Susan's vibrant personality and dedication to fitness have made her a role model for many. She continues to push herself to new heights, always seeking new challenges and adventures to keep her life exciting and fulfilling."}
{"Name":"Paige Kaufman","Age":19,"Sex":"female","Country of Origin":"USA","State or Province":"Maryland","Education Level":"High School","MBTI Personality":"ISFP","Lifestyle":"gardening","Backstory":"Paige Kaufman was born and raised in the suburbs of Maryland, USA. Growing up, she was always surrounded by nature, as her parents were avid gardeners and instilled in her a love for plants and flowers from a young age. Paige was a curious and creative child, always exploring the woods behind her house and using her artistic talents to create beautiful drawings of the plants and animals she discovered.\n\nAs she got older, Paige's passion for gardening only grew stronger. She spent countless hours in her parents' garden, learning everything she could about different plant species and how to care for them. Her parents were her biggest supporters, always encouraging her to pursue her interests and hone her skills.\n\nWhen Paige entered high school, she quickly became known as the \"plant girl.\" She would often be found tending to the school's garden or giving advice to her classmates on how to care for their own plants. Despite her love for gardening, Paige also excelled in her studies and graduated with top honors.\n\nAfter high school, Paige wasn't sure what she wanted to do with her life. She considered pursuing a career in botany or horticulture, but ultimately decided to take a gap year to travel and explore different cultures. During her travels, she discovered the world of social media and how it could be used as a platform to share her love for gardening with others.\n\nPaige started an Instagram account where she shared her gardening tips, tricks, and beautiful photos of her plants and flowers. Her page quickly gained popularity, and she soon became known as a gardening influencer. People were drawn to her exceptional beauty and exceptional face, but it was her passion and knowledge for gardening that kept them coming back for more.\n\nNow, at 19 years old, Paige has a large following on Instagram and has even started her own gardening business. She uses her platform to not only showcase her love for gardening but also to educate and inspire others to get their hands dirty and connect with nature. With her artistic abilities and adaptable personality, Paige continues to grow and evolve, both as a person and a gardener, and her future is as bright and beautiful as the flowers she tends to."}
{"Name":"Steven Turner","Age":27,"Sex":"male","Country of Origin":"USA","State or Province":"Ohio","Education Level":"No High School","MBTI Personality":"ISFJ","Lifestyle":"pets","Backstory":"Steven Turner was born and raised in a small town in Ohio, USA. He grew up in a loving household with his parents and older sister. However, school was never his strong suit. He struggled with academics and often felt like he didn't fit in with his peers. As a result, he dropped out of high school at the age of 17.\n\nFeeling lost and unsure of what to do with his life, Steven turned to his love for animals. He had always been drawn to them and found solace in their company. He started volunteering at a local animal shelter, and it quickly became his passion. He spent all his free time there, taking care of the animals and helping them find their forever homes.\n\nAs he grew older, Steven's love for animals only intensified. He adopted several pets from the shelter and even started fostering animals in need. His Instagram account became a platform for him to share his passion and promote adoption and animal welfare. His followers were drawn to his kind heart and beautiful pets, and soon, he had a significant following.\n\nDespite not having a high school degree, Steven's intelligence and caring nature were evident in his online interactions. He would often offer advice and support to his followers, and many saw him as a source of warmth and positivity in their lives.\n\nSteven's appearance also caught the attention of many. He had a strikingly handsome face, with piercing blue eyes and a warm smile. His followers often commented on his \"high beauty and high face,\" which made him feel both flattered and a little self-conscious.\n\nNow, at the age of 27, Steven has found his calling in life. He works part-time at a local pet store, where he continues to share his love for animals with others. He also volunteers at different animal shelters and uses his platform to raise awareness and funds for various animal welfare organizations.\n\nDespite not having a traditional education, Steven has found success and fulfillment in his life through his passion for animals. He hopes to one day open his own animal sanctuary and continue making a positive impact in the lives of animals and people alike."}
{"Name":"Kelly Callahan","Age":23,"Sex":"female","Country of Origin":"USA","State or Province":"North Carolina","Education Level":"High School","MBTI Personality":"ISFP","Lifestyle":"lifestyle","Backstory":"Kelly Callahan was born and raised in the charming state of North Carolina, USA. She grew up in a small town surrounded by lush green forests and rolling hills, which sparked her love for nature and the outdoors from a young age. Kelly was always a curious and adventurous child, constantly seeking new experiences and opportunities to express her creativity.\n\nAs she grew older, Kelly's passion for art and self-expression only intensified. She excelled in her high school art classes, using various mediums to create stunning pieces that captured the essence of her surroundings. Her teachers and peers were in awe of her talent and encouraged her to pursue a career in the arts.\n\nHowever, Kelly's parents had different plans for her. They believed that a stable and conventional career path would lead to a successful and secure future. So, after graduating high school with top honors, Kelly reluctantly enrolled in a business program at a local community college.\n\nBut her heart was not in it. She found herself daydreaming about traveling the world and creating art, rather than sitting in a boring lecture hall. Kelly knew she needed to follow her passion, no matter the risks. So, after completing her degree, she made the bold decision to leave everything behind and pursue her dreams.\n\nWith her camera and art supplies in hand, Kelly set off on a journey to explore the world and capture its beauty through her lens. She traveled to different countries, immersing herself in different cultures, and honing her artistic skills along the way. Kelly's Instagram quickly became a platform to showcase her stunning photography, and her followers grew by the thousands.\n\nNow, at 23 years old, Kelly has established herself as a successful lifestyle influencer. Her Instagram feed is a beautiful blend of her love for travel, nature, and art. She continues to inspire others to follow their dreams and live life to the fullest. With her high beauty and high face, Kelly is a true embodiment of living life on your terms and embracing your passions."}
{"Name":"Michael Brown","Age":30,"Sex":"male","Country of Origin":"USA","State or Province":"North Carolina","Education Level":"High School","MBTI Personality":"INFP","Lifestyle":"astrology","Backstory":"Michael Brown was born and raised in the small town of Asheville, North Carolina. Growing up, he was always a dreamer and a deep thinker, often getting lost in his own thoughts and imagination. His parents, both hard-working blue-collar workers, instilled in him a strong work ethic and a love for the simple things in life.\n\nDespite his humble upbringing, Michael always had a fascination with the stars and the mysteries of the universe. He would spend hours gazing at the night sky, trying to decipher the constellations and their meanings. As he got older, this fascination turned into a deep passion for astrology and all things mystical.\n\nAfter graduating high school, Michael decided to forego college and instead pursued a career in photography. He found that through his lens, he could capture the beauty and magic of the world around him. His exceptional eye for detail and composition quickly gained him recognition in the local art community.\n\nBut it wasn't until Michael discovered Instagram that his true talents were recognized. He used the platform as a canvas for his imaginative and introspective thoughts, showcasing his rich inner world and unique perspective on life. His posts, often accompanied by stunning self-portraits, gained a following of thousands, all drawn to his exceptional beauty and exceptional face.\n\nAs his online presence grew, Michael's interest in astrology deepened. He began studying the stars and their influence on our lives, using his own birth chart as a guide. He found that astrology not only helped him understand himself better but also helped him connect with others on a deeper level.\n\nToday, at 30 years old, Michael continues to pursue his passions for photography and astrology. He has become a sought-after photographer, capturing the essence and beauty of his clients through his lens. And his Instagram has become a source of inspiration and guidance for many, as he shares his astrological insights and self-reflective musings.\n\nDespite his success, Michael remains humble and grounded, never forgetting his roots and the simple values instilled in him by his parents. He continues to live in Asheville, surrounded by the mountains and the stars that have always captivated his heart and soul."}
{"Name":"John Harris","Age":19,"Sex":"male","Country of Origin":"USA","State or Province":"Connecticut","Education Level":"High School","MBTI Personality":"ENTJ","Lifestyle":"psychology","Backstory":"John Harris was born and raised in the quaint town of Greenwich, Connecticut. Growing up, he was always a curious child, constantly asking questions and trying to understand the world around him. His parents, both successful lawyers, encouraged his inquisitive nature and always made sure to provide him with the resources to explore his interests.\n\nAs he got older, John's fascination with the human mind grew stronger. He would often spend hours reading books on psychology and analyzing people's behaviors and thought processes. In high school, he excelled in his psychology classes and even started a study group to help his classmates better understand the subject.\n\nDespite his academic success, John struggled with fitting in socially. He was always seen as the \"smart kid\" and had a hard time connecting with his peers. However, he found solace in social media, where he could express himself freely and connect with like-minded individuals.\n\nAfter graduating high school with top honors, John decided to pursue a degree in psychology at a prestigious university. But before starting college, he took a gap year to travel and gain some life experience. During this time, he started an Instagram account to document his travels and share his thoughts on psychology.\n\nTo his surprise, John's Instagram account gained a significant following, with people from all over the world drawn to his insightful posts and beautiful photos. He also discovered a love for photography and used his platform to showcase his skills.\n\nAs he continued to travel and learn, John's understanding of psychology deepened. He realized that he not only had a passion for the subject but also a natural talent for it. His ability to read people and strategize made him a natural leader, and he found himself taking charge of group projects and leading discussions in class.\n\nNow, at 19 years old, John is starting his first year of college, majoring in psychology. His Instagram account has become a platform for him to share his knowledge and inspire others to pursue their passions. With his above-average beauty and face, John has also caught the attention of modeling agencies, but he remains focused on his studies and using his platform for good.\n\nJohn Harris may have had a hard time fitting in during his younger years, but now he has found his voice and is determined to make a difference in the world through his passion for psychology. With his natural leadership skills and determination, there's no doubt that John will achieve great things and inspire others along the way."}
{"Name":"Stephanie Watts","Age":21,"Sex":"female","Country of Origin":"USA","State or Province":"Texas","Education Level":"High School","MBTI Personality":"INTJ","Lifestyle":"tech","Backstory":"Stephanie Watts was born and raised in the bustling state of Texas, USA. She grew up in a close-knit family, with her parents and two older brothers. From a young age, Stephanie showed a natural curiosity and aptitude for technology. She was always tinkering with gadgets and computers, much to the amusement of her family.\n\nAs she entered her teenage years, Stephanie's love for technology only grew stronger. She spent countless hours teaching herself coding and programming, often staying up late into the night to work on her latest project. Her hard work paid off when she graduated high school with top honors and a scholarship to attend a prestigious university.\n\nDuring her time in college, Stephanie continued to excel in her studies and became known as the go-to person for all things tech-related. She also started her own tech blog and Instagram page, where she shared her knowledge and passion for all things tech with the world. Her content was not only informative but also visually appealing, showcasing her above-average beauty and above-average face.\n\nDespite her busy schedule, Stephanie always made time to give back to her community. She volunteered at local schools, teaching students about coding and encouraging young girls to pursue careers in STEM fields. Her dedication and passion for technology quickly caught the attention of industry leaders, and she was offered a job at a top tech company even before she graduated.\n\nNow, at 21 years old, Stephanie is a rising star in the tech world. She uses her platform and influence to promote diversity and inclusivity in the industry, and her innovative ideas and strategic thinking have earned her a reputation as a thought leader. She continues to inspire and empower others through her work and is determined to make a positive impact on the world through technology."}
{"Name":"Christine Reed","Age":26,"Sex":"female","Country of Origin":"USA","State or Province":"Wisconsin","Education Level":"Bachelor","MBTI Personality":"INTP","Lifestyle":"art","Backstory":"Christine Reed was born and raised in a small town in Wisconsin, USA. From a young age, she showed a natural talent and love for art. Her parents, both working-class individuals, were always supportive of her passion and encouraged her to pursue it.\n\nAs she grew older, Christine's love for art only intensified. She spent hours drawing and painting, constantly pushing herself to improve and experiment with different mediums. Despite her parents' limited financial resources, they always made sure to provide her with the necessary art supplies and even enrolled her in art classes.\n\nAfter graduating high school, Christine knew that she wanted to pursue a career in art. She applied to the prestigious School of the Art Institute of Chicago and was accepted with a scholarship. It was a dream come true for Christine, who had always felt like a small fish in a big pond in her small town.\n\nDuring her time at art school, Christine's passion and talent for art only grew. She excelled in her classes and was known for her unique and thought-provoking pieces. She also developed a strong interest in art theory and often spent her free time exploring complex concepts and theories.\n\nAfter four years, Christine graduated with a Bachelor's degree in Fine Arts. She moved back to Wisconsin and settled in a small apartment in Milwaukee. Despite the challenges of being a young artist, Christine was determined to make a name for herself in the art world.\n\nShe started showcasing her work in local galleries and art fairs, gaining recognition for her abstract and innovative pieces. Her social media accounts also became a platform for her to share her art and ideas with a wider audience. Her Instagram feed was filled with colorful and thought-provoking posts, attracting a large following of art enthusiasts.\n\nNow, at 26 years old, Christine has established herself as a successful artist. Her work has been featured in galleries across the country, and she has even had a few solo exhibitions. She continues to push the boundaries of art and explore new concepts, always striving to create something truly unique and meaningful.\n\nAlthough she may have slightly above average looks, Christine's true beauty lies in her passion and creativity. She is a free spirit, unafraid to challenge societal norms and express herself through her art. And with her supportive family, loyal followers, and unwavering determination, there's no telling where her artistic journey will take her next."}
{"Name":"Jenna Gilmore","Age":20,"Sex":"female","Country of Origin":"Canada","State or Province":"Ontario","Education Level":"No High School","MBTI Personality":"ISFP","Lifestyle":"cooking","Backstory":"Jenna Gilmore was born and raised in the small town of Thunder Bay, Ontario, Canada. She was the youngest of three siblings and always had a love for food and cooking. Her parents owned a small diner in town, and Jenna would often spend her afternoons in the kitchen with her mother, learning new recipes and techniques.\n\nDespite her love for cooking, Jenna struggled in school. She was a free spirit, always looking for adventure and creativity in everything she did. She found it difficult to sit still in a classroom and follow rules that seemed to stifle her imagination. As a result, she dropped out of high school at the age of 17, much to her parents' disappointment.\n\nWith no high school degree, Jenna felt lost and unsure of her future. She bounced around from job to job, never feeling fulfilled or satisfied. It wasn't until she stumbled upon a cooking class at a local community center that she found her true passion. She excelled in the class, impressing her instructor with her natural talent and creativity in the kitchen.\n\nJenna's newfound love for cooking inspired her to start her own food blog and Instagram account. She would share her unique recipes and cooking tips, quickly gaining a following for her delicious and visually appealing dishes. Her Instagram feed became a reflection of her spontaneous and flexible nature, often showcasing her adventures in the great outdoors or her latest artistic endeavors.\n\nDespite not having a high school degree, Jenna's above average beauty and charm drew people in, and she quickly became a local celebrity in Thunder Bay. Her cooking skills and carefree attitude caught the attention of a popular restaurant owner in Toronto, who offered her a job as a sous chef at his upscale establishment.\n\nAt just 20 years old, Jenna packed her bags and moved to the bustling city of Toronto, leaving behind her small town roots. She embraced the fast-paced lifestyle and the endless opportunities for culinary exploration. Her unique background and passion for cooking made her stand out in the competitive world of professional chefs.\n\nJenna's journey may have started with a lack of formal education, but her determination and love for cooking have taken her on a path of success and fulfillment. She continues to inspire others with her creativity and passion, proving that sometimes the road less traveled can lead to the most unexpected and rewarding destinations."}
{"Name":"Carol Cole","Age":20,"Sex":"female","Country of Origin":"Canada","State or Province":"Ontario","Education Level":"High School","MBTI Personality":"ESTP","Lifestyle":"outdoors","Backstory":"Carol Cole was born and raised in the beautiful province of Ontario, Canada. She grew up surrounded by nature and developed a deep appreciation for the outdoors from a young age. Her parents were avid hikers and campers, and they instilled in her a love for exploring the world around her.\n\nGrowing up, Carol was always known for her adventurous spirit and fearlessness. She was never afraid to try new things and was always seeking out new challenges. This mindset carried over into her high school years, where she excelled in sports and outdoor activities. She was a star on both the track and field team and the rock climbing club, constantly pushing herself to be better and take on more difficult tasks.\n\nDespite her love for adventure, Carol was also an excellent student and graduated high school with top marks. However, she knew that she didn't want to follow the traditional path of going to college and getting a desk job. She wanted to continue exploring and experiencing the world in her own way.\n\nAfter graduation, Carol decided to take a gap year to travel and pursue her passions. She spent months backpacking through Europe, climbing mountains and exploring new cultures. It was during this trip that she discovered her love for photography and documenting her adventures. She started an Instagram account to share her experiences with others, and it quickly gained a following due to her stunning photos and adventurous lifestyle.\n\nNow, at 20 years old, Carol has returned to her hometown in Ontario, but her thirst for adventure has not been quenched. She spends her days hiking, rock climbing, and camping in the beautiful Canadian wilderness, always with her camera in hand. Her Instagram is filled with breathtaking shots of her conquering mountains, jumping off waterfalls, and camping under the stars.\n\nDespite her busy and active lifestyle, Carol still makes time to give back to her community. She volunteers at local nature conservation organizations and helps organize outdoor activities for underprivileged youth. She believes that everyone should have the opportunity to experience the beauty and thrill of the great outdoors.\n\nCarol's high beauty and striking features may catch people's attention, but it's her passion for adventure and love for nature that truly defines her. She is a free spirit, always seeking out new challenges and experiences, and inspiring others to do the same."}
{"Name":"John Jordan","Age":24,"Sex":"male","Country of Origin":"USA","State or Province":"California","Education Level":"High School","MBTI Personality":"ISFP","Lifestyle":"cooking","Backstory":"John Jordan was born and raised in the sunny state of California, USA. Growing up, he was always surrounded by the vibrant and diverse culture of the West Coast. His parents, both successful entrepreneurs, instilled in him a strong work ethic and encouraged him to pursue his passions.\n\nFrom a young age, John showed a natural talent for cooking. He would spend hours in the kitchen experimenting with different flavors and ingredients, much to the delight of his family and friends. His love for cooking only grew as he got older, and he became known for his mouth-watering dishes among his peers.\n\nDespite his love for cooking, John's parents always stressed the importance of education. So, after graduating from high school with top honors, he decided to pursue a degree in business. While in college, he continued to hone his culinary skills and even started a small catering business on the side. His business quickly gained popularity, and soon he was catering events for some of the most influential people in town.\n\nAs John approached his final year of college, he realized that his true passion lay in the culinary world. He made the difficult decision to drop out of school and fully dedicate himself to his catering business. His parents were initially hesitant, but seeing his determination and success, they eventually gave their full support.\n\nWith his business thriving, John decided to expand his reach and started sharing his culinary creations on Instagram. His exceptional beauty and exceptional face made him an instant hit on the platform, and his creative and varied posts quickly gained a large following. John's Instagram became a hub for foodies and aspiring chefs, and he soon became a sought-after influencer in the food industry.\n\nNow, at 24 years old, John has established himself as a successful and talented chef, with a loyal fan base and a thriving business. His adaptable personality and artistic abilities continue to shine through in his cooking and his social media presence. John's journey is a testament to following your passion and never giving up on your dreams."}
{"Name":"Ryan Moyer","Age":22,"Sex":"male","Country of Origin":"USA","State or Province":"New York","Education Level":"No High School","MBTI Personality":"ENFP","Lifestyle":"vlogging","Backstory":"Ryan Moyer was born and raised in the bustling city of New York. Growing up, he was always a curious and adventurous child, constantly exploring and seeking out new experiences. His parents, both hardworking blue-collar workers, struggled to make ends meet and didn't have much time to spend with Ryan. As a result, he often found solace in his own imagination and creativity.\n\nAs he got older, Ryan became more and more fascinated with technology and the internet. He spent hours on his computer, learning about video editing and graphic design. When he was 16, he stumbled upon the world of vlogging and was immediately hooked. He loved the idea of being able to share his adventures and ideas with the world.\n\nHowever, Ryan's passion for vlogging often clashed with his responsibilities at school. He found himself skipping classes to work on his videos and his grades began to suffer. Despite his parents' constant reminders about the importance of education, Ryan couldn't shake off his obsession with vlogging.\n\nAt 18, Ryan made the bold decision to drop out of high school and pursue vlogging full-time. His parents were disappointed, but they could see how passionate and determined their son was. They supported him and even helped him set up a small studio in their basement.\n\nWith hard work and dedication, Ryan's vlogging channel started to gain traction. His unique personality and creative content attracted a large following, and soon he was making a decent income from his videos. He used the money to invest in better equipment and travel to new places, documenting his adventures along the way.\n\nNow, at 22 years old, Ryan has become a successful vlogger with a growing fan base. He is known for his positive and upbeat personality, always looking for the silver lining in every situation. Despite not having a high school degree, Ryan has proven that passion and hard work can lead to success. He continues to inspire others to chase their dreams and live life to the fullest through his vlogs and social media presence."}
{"Name":"Rebecca Hanna","Age":26,"Sex":"female","Country of Origin":"Canada","State or Province":"Manitoba","Education Level":"No High School","MBTI Personality":"INFP","Lifestyle":"art","Backstory":"Rebecca Hanna was born and raised in the small town of Brandon, Manitoba, Canada. She was the youngest of three siblings and the only girl in the family. Growing up, her parents struggled to make ends meet and education was not a priority. As a result, Rebecca was unable to finish high school and had to drop out at the age of 16 to help support her family.\n\nDespite not having a formal education, Rebecca was always drawn to the arts. She would spend hours drawing and painting, using any materials she could find. Her talent was evident even at a young age, and her parents encouraged her to pursue her passion. However, with the financial struggles of her family, Rebecca had to put her dreams of becoming an artist on hold and work odd jobs to help make ends meet.\n\nAt the age of 20, Rebecca decided to move to the city of Winnipeg to pursue her dream of becoming an artist. She worked tirelessly to save enough money to rent a small studio apartment and buy art supplies. Her days were spent working at a local coffee shop, and her nights were dedicated to creating art.\n\nRebecca's art caught the attention of a local art gallery owner, who offered to showcase her work. This was a turning point in Rebecca's life, as her art gained recognition and she started to make a name for herself in the art world. Her Instagram account, filled with her unique and thought-provoking pieces, gained a large following and she became known as a rising star in the art scene.\n\nDespite her success, Rebecca remains humble and true to her values. She uses her platform to spread awareness about social and environmental issues and encourages others to use their voice for positive change. Her idealistic nature and strong personal values are reflected in her art and her posts on social media.\n\nNow, at the age of 26, Rebecca has established herself as a successful artist and influencer. She continues to live in her small studio apartment, surrounded by her art and her loyal followers. Her above-average beauty and face may have caught people's attention, but it is her passion for art and her strong sense of self that truly makes her stand out."}
{"Name":"Laura Crosby","Age":35,"Sex":"female","Country of Origin":"Canada","State or Province":"Quebec","Education Level":"High School","MBTI Personality":"ENFP","Lifestyle":"vlogging","Backstory":"Laura Crosby was born and raised in Quebec, Canada. She grew up in a small town with her parents and older brother. From a young age, Laura was always a curious and creative child. She loved exploring the great outdoors and trying new things. Her parents encouraged her to pursue her passions and supported her in every endeavor.\n\nIn high school, Laura discovered her love for videography and vlogging. She would spend hours filming and editing videos of her daily life and adventures. Her classmates and friends were always entertained by her videos and encouraged her to share them with the world.\n\nAfter graduating high school, Laura decided to pursue a degree in media and communications. She wanted to learn more about the technical aspects of videography and how to create engaging content. While in college, she continued to vlog and share her experiences on social media.\n\nAfter completing her degree, Laura landed a job at a local television station as a video editor. She enjoyed her job, but deep down, she knew that she wanted to do more with her creative talents. That's when she decided to quit her job and pursue vlogging full-time.\n\nAt the age of 35, Laura has become a successful vlogger with a large following on social media. Her videos showcase her adventurous spirit and positive outlook on life. She often travels to new and exciting places, trying out different activities and documenting it all for her followers.\n\nDespite her growing fame, Laura remains down-to-earth and humble. She believes in using her platform to spread positivity and inspire others to chase their dreams. She hopes to one day start her own production company and create content that will make a positive impact on the world.\n\nLaura may not have the most striking appearance, but her infectious energy and creativity make her stand out. She embraces her average beauty and believes that true beauty comes from within. She is a firm believer in living life to the fullest and making the most out of every moment.\n\nThrough her vlogs and lifestyle, Laura continues to inspire others to follow their passions and live life with an open and curious mind. She is proof that with determination and hard work, anything is possible. And she will continue to share her adventures and creative pursuits with the world, spreading joy and inspiration along the way."}
{"Name":"Sarah Reed","Age":20,"Sex":"female","Country of Origin":"USA","State or Province":"Michigan","Education Level":"No High School","MBTI Personality":"ENFJ","Lifestyle":"business","Backstory":"Sarah Reed was born and raised in a small town in Michigan, USA. She grew up in a humble household with her parents and two younger siblings. Her parents worked hard to provide for the family, but they struggled to make ends meet. As a result, Sarah learned the value of hard work and determination from a young age.\n\nDespite her parents' financial struggles, Sarah's childhood was filled with love and support. She was a bright and curious child, always eager to learn and explore new things. However, as she entered her teenage years, Sarah faced a difficult time. She struggled with anxiety and depression, which affected her academic performance.\n\nAs a result, Sarah dropped out of high school at the age of 16. Her parents were disappointed, but they understood that Sarah needed to focus on her mental health. Sarah spent the next few years trying to figure out her path in life. She worked odd jobs and took online courses, but nothing seemed to spark her interest.\n\nIt wasn't until Sarah turned 20 that she discovered her passion for business. She stumbled upon a motivational speaker on social media and was inspired by their message. Sarah realized that she wanted to help others achieve their goals and dreams, just like the speaker had helped her.\n\nWith no high school degree, Sarah knew that she had to work twice as hard to achieve her dreams. She started reading books on business and entrepreneurship, and she even took online courses to improve her knowledge and skills. Sarah also started her own Instagram account, where she shared her thoughts and insights on business and personal development.\n\nHer Instagram account quickly gained a following, and Sarah's posts were shared by many, inspiring and motivating others. She also started networking with other entrepreneurs and business owners, learning from their experiences and advice.\n\nDespite facing challenges and setbacks, Sarah's determination and hard work paid off. She started her own business, offering coaching and consulting services to aspiring entrepreneurs. Her business grew rapidly, and Sarah became known as a charismatic and visionary leader in the business world.\n\nToday, at the age of 20, Sarah Reed is a successful business owner, motivational speaker, and influencer. She continues to inspire and motivate others through her social media presence and her business. Sarah's journey is a testament to the fact that with hard work, determination, and passion, anything is possible, regardless of one's background or education level."}
{"Name":"Virginia Martinez","Age":22,"Sex":"female","Country of Origin":"USA","State or Province":"Florida","Education Level":"Bachelor","MBTI Personality":"ENFP","Lifestyle":"vlogging","Backstory":"Virginia Martinez was born and raised in the sunny state of Florida, USA. She was the youngest of three siblings and grew up in a loving and supportive family. From a young age, Virginia showed a natural curiosity and love for exploring new things. Her parents encouraged her to follow her passions and always supported her in pursuing her dreams.\n\nAs she grew older, Virginia became increasingly interested in the world of social media and vlogging. She loved the idea of being able to share her experiences and creativity with others and found a sense of fulfillment in connecting with people through her videos. With her natural charisma and bubbly personality, it wasn't long before she gained a significant following on her Instagram and YouTube channels.\n\nAfter graduating from high school, Virginia was determined to turn her passion for vlogging into a career. She enrolled in a prestigious university in Florida and pursued a degree in Digital Media and Communications. Her studies allowed her to further develop her skills in videography, editing, and social media marketing, all of which were essential for her vlogging career.\n\nDuring her time in university, Virginia's vlogs gained even more popularity, and she was able to collaborate with other influencers and brands, further expanding her reach and influence. She also took advantage of her university's study abroad program and spent a semester in Europe, documenting her travels and adventures for her followers.\n\nAfter graduating with a Bachelor's degree, Virginia decided to fully dedicate herself to her vlogging career. She moved to Los Angeles, where she could be closer to other content creators and opportunities in the entertainment industry. With her natural talent and hard work, she quickly rose to become one of the most sought-after vloggers in the industry.\n\nToday, at the age of 22, Virginia continues to live her dream of inspiring and connecting with people through her vlogs. She is known for her positive and upbeat attitude, always looking for ways to spread joy and creativity through her videos. With her high beauty and high face, she has become a role model for young women, encouraging them to follow their passions and never give up on their dreams."}
{"Name":"Valerie Butler","Age":20,"Sex":"female","Country of Origin":"Canada","State or Province":"Ontario","Education Level":"High School","MBTI Personality":"INFJ","Lifestyle":"history","Backstory":"Valerie Butler was born and raised in the bustling city of Toronto, Ontario. From a young age, she was always curious about the world around her, particularly the past. Her parents, both history enthusiasts, instilled in her a love for learning about different cultures, traditions, and events that shaped the world we live in today.\n\nAs she grew older, Valerie's passion for history only intensified. She spent countless hours in the library, devouring books and articles on various historical topics. Her high school years were filled with academic success, with history being her favorite subject. She also participated in various extracurricular activities related to history, such as debate and quiz bowl teams.\n\nDespite her exceptional academic achievements, Valerie never let it get to her head. She remained humble and down-to-earth, always willing to help her classmates with their studies. Her classmates admired her not only for her intelligence but also for her kind and empathetic nature.\n\nAfter graduating high school, Valerie decided to pursue a degree in history at the University of Toronto. She excelled in her studies, immersing herself in the subject and constantly seeking out new knowledge. Her professors were impressed by her passion and dedication, and she quickly became one of their top students.\n\nDuring her second year of university, Valerie created an Instagram account dedicated to sharing her love for history with the world. She posted photos of historical landmarks, artifacts, and events, along with insightful captions that showcased her deep understanding and empathy for the past. Her account gained a significant following, and she became known as a history influencer.\n\nValerie's posts not only educated her followers but also inspired them to reflect on the past and how it shapes our present and future. She used her platform to spread messages of unity, tolerance, and compassion, hoping to make a positive impact on the world.\n\nNow, at 20 years old, Valerie continues to pursue her passion for history while also using her platform for good. She plans to travel the world, visiting historical sites and gaining a deeper understanding of different cultures. Her ultimate goal is to become a history professor and inspire future generations to learn from the past and create a better world for all. With her exceptional beauty and exceptional mind, Valerie is destined to leave a lasting mark on the world."}
{"Name":"Shannon Macdonald","Age":26,"Sex":"female","Country of Origin":"USA","State or Province":"Indiana","Education Level":"Bachelor","MBTI Personality":"ENTJ","Lifestyle":"politics","Backstory":"Shannon Macdonald was born and raised in the heart of the Midwest, in a small town in Indiana. Growing up, she was always passionate about politics and making a difference in her community. Her parents, both teachers, instilled in her the importance of being informed and using her voice to advocate for change.\n\nAs a child, Shannon was always a natural leader, organizing events and rallies for causes she believed in. In high school, she was the president of the student council and led successful campaigns for various school initiatives. Her peers looked up to her for her strong sense of justice and her ability to bring people together.\n\nAfter graduating at the top of her class, Shannon went on to attend a prestigious university, where she studied political science and international relations. She excelled in her studies, earning a Bachelor's degree with honors. During her time in college, she also became heavily involved in student government and local politics, gaining valuable experience and connections.\n\nAfter graduation, Shannon returned to her hometown to work on local political campaigns. Her strategic thinking and natural charisma made her a valuable asset to any candidate she worked with. She quickly gained a reputation as a rising star in the political world.\n\nAt the age of 26, Shannon's passion for politics only continues to grow. She is a regular attendee at local government meetings and is often seen volunteering for various causes and organizations. Her Instagram and lifestyle reflect her dedication to making a difference and inspiring others to do the same.\n\nDespite her strong presence and leadership abilities, Shannon remains humble and grounded. She is described as having average beauty and an average face, but her inner beauty and intelligence shine through in everything she does.\n\nShannon's ultimate goal is to one day run for office and use her platform to create positive change on a larger scale. But for now, she is content with using her voice and her passion to make a difference in her community and inspire others to do the same."}
{"Name":"Colin Davila","Age":28,"Sex":"male","Country of Origin":"Canada","State or Province":"British Columbia","Education Level":"Bachelor","MBTI Personality":"ISTP","Lifestyle":"automotive","Backstory":"Colin Davila was born and raised in the beautiful province of British Columbia, Canada. From a young age, he was always fascinated by cars and anything with an engine. His father, a mechanic, would often take him to work with him and teach him about the inner workings of vehicles. Colin quickly developed a love for all things automotive and dreamed of one day owning his own garage.\n\nAs he grew older, Colin's passion for cars only intensified. He spent countless hours tinkering with engines and learning about different makes and models. His parents always encouraged his interests, and when it was time for him to choose a career path, it was no surprise that he decided to pursue a degree in Mechanical Engineering.\n\nDuring his time at university, Colin excelled in his studies and graduated with a Bachelor's degree in Mechanical Engineering with a focus on automotive design. With his degree in hand, he was ready to take on the world and turn his dreams into reality.\n\nColin landed a job at a prestigious automotive company in Vancouver, where he quickly made a name for himself with his exceptional skills and innovative ideas. He worked tirelessly, often staying late into the night, to perfect his designs and create the best possible products for his clients.\n\nBut Colin's true passion lay beyond the corporate world. In his free time, he would often hit the road, exploring the rugged terrain of British Columbia in his beloved Jeep. He documented his adventures on Instagram, showcasing not only his love for cars but also his adventurous spirit and love for the great outdoors.\n\nColin's Instagram quickly gained a large following, with people admiring not only his exceptional beauty but also his down-to-earth and practical nature. His posts often featured DIY projects, showing off his skills and creativity.\n\nDespite his busy schedule, Colin always made time for his family and friends. He was known for his spontaneous nature, always up for an adventure or a road trip with his loved ones. He was also a regular volunteer at a local charity that provided free car repairs for low-income families.\n\nAt 28 years old, Colin has achieved a lot, but his journey is far from over. He continues to push the boundaries and chase his dreams, with his love for cars and his adventurous spirit guiding him every step of the way."}
{"Name":"Nicholas Knox","Age":20,"Sex":"male","Country of Origin":"Canada","State or Province":"British Columbia","Education Level":"High School","MBTI Personality":"INTP","Lifestyle":"architecture","Backstory":"Nicholas Knox was born and raised in the picturesque province of British Columbia, Canada. His parents, both successful architects, instilled in him a love for design and structure from a young age. Growing up, Nicholas spent countless hours exploring the city with his parents, admiring the unique buildings and landmarks that dotted the landscape.\n\nAs he entered his teenage years, Nicholas began to develop a keen interest in mathematics and physics, finding immense joy in solving complex problems and understanding the laws that govern our world. His teachers noticed his exceptional aptitude for these subjects and encouraged him to pursue a career in engineering or architecture.\n\nDespite his love for these subjects, Nicholas also had a strong passion for art and creativity. He often spent his free time sketching and designing buildings, using his knowledge of math and physics to create unique and innovative structures. His love for both logic and imagination made him stand out among his peers, and he quickly became known as the \"architectural prodigy\" among his classmates.\n\nAfter graduating high school with top honors, Nicholas decided to pursue a degree in architecture at a prestigious university in British Columbia. His parents were overjoyed and proud of his decision, knowing that he had found his true calling in life.\n\nDuring his time at university, Nicholas excelled in his studies, immersing himself in the world of architecture and design. He spent countless hours in the studio, perfecting his craft and pushing the boundaries of traditional architecture. His professors were impressed by his creativity and dedication, and he quickly became a favorite among them.\n\nNicholas's love for architecture extended beyond the classroom, as he often spent his weekends exploring different cities and their unique architectural styles. He documented his travels on Instagram, showcasing his eye for detail and his appreciation for the beauty of the built environment.\n\nNow, at the age of 20, Nicholas is on the cusp of graduating from university with a degree in architecture. He plans to follow in his parents' footsteps and open his own firm, where he hopes to combine his passion for logic and creativity to create groundbreaking designs that will leave a lasting impact on the world.\n\nWith his exceptional beauty and an exceptional face, Nicholas not only stands out for his intellect and talent but also for his striking appearance. However, he remains humble, always attributing his success to his love for architecture and his determination to make a difference in the world through his designs."}
{"Name":"Wendy Lang","Age":26,"Sex":"female","Country of Origin":"USA","State or Province":"Delaware","Education Level":"Master","MBTI Personality":"ESTJ","Lifestyle":"parenting","Backstory":"Wendy Lang was born and raised in the small town of Wilmington, Delaware. From a young age, she was known for her responsible and organized nature, always the first to finish her homework and the last to leave a party without cleaning up. Her parents, both successful lawyers, instilled in her a strong work ethic and a drive for success.\n\nAs she grew older, Wendy's passion for organization and responsibility only grew stronger. She excelled in school, graduating at the top of her class and earning a full scholarship to a prestigious university. There, she pursued a degree in Business Administration, with a focus on project management. It was during her time in college that she also discovered her love for parenting.\n\nWendy's best friend from high school had a baby during their sophomore year, and Wendy immediately fell in love with the little bundle of joy. She spent countless hours helping her friend take care of the baby, and her natural instincts for organization and responsibility made her a natural at parenting. She also realized that she had a knack for teaching and guiding children, and decided to pursue a Master's degree in Early Childhood Education.\n\nAfter graduating with her Master's degree, Wendy moved back to Delaware and started her career as a project manager for a successful company. But her true passion remained in parenting and teaching, and she started a blog and Instagram account to share her experiences and tips with other parents. Her pragmatic and methodical approach to parenting quickly gained a following, and she became known as a go-to resource for new parents in the community.\n\nAt 26 years old, Wendy's life may seem picture-perfect on social media, with her above average beauty and an above average face. But behind the curated posts and perfectly organized home, she is a hard-working and dedicated individual who is passionate about helping others and making a positive impact in the world. Whether it's through her career, her blog, or her personal life, Wendy is always striving to be the best version of herself and inspire others to do the same."}
{"Name":"Tanya Adams","Age":24,"Sex":"female","Country of Origin":"USA","State or Province":"Georgia","Education Level":"Bachelor","MBTI Personality":"INFJ","Lifestyle":"psychology","Backstory":"Tanya Adams was born and raised in the heart of Georgia, USA. Growing up in a small town, she was always fascinated by the complexities of the human mind and behavior. Her parents, both successful psychologists, instilled in her a love for understanding why people think and act the way they do.\n\nAs a child, Tanya was always curious and had a knack for reading people's emotions. She would often spend hours observing her classmates and trying to understand their thought processes. This led her to develop a strong interest in psychology from a young age.\n\nAs she grew older, Tanya's passion for psychology only intensified. She excelled in her studies and graduated with a Bachelor's degree in Psychology from the University of Georgia. During her time in college, she also took up various internships and volunteer work, gaining hands-on experience in the field.\n\nAfter graduation, Tanya moved to the bustling city of Atlanta to pursue a career in psychology. She landed a job as a therapist at a renowned clinic, where she quickly gained a reputation for her empathetic and insightful approach towards her patients. Her clients often described her as having a \"high beauty and a high face,\" as her appearance reflected her kind and compassionate nature.\n\nIn her free time, Tanya found solace in expressing her thoughts and insights on her Instagram account. Her posts were a reflection of her soul, showcasing her visionary thoughts and empathetic outlook towards life. Through her platform, she aimed to spread awareness about mental health and break the stigma surrounding it.\n\nAs a 24-year-old, Tanya has already made a significant impact in the field of psychology. With her knowledge, passion, and determination, she hopes to continue helping others understand and overcome their inner struggles."}
{"Name":"Charles Williams","Age":21,"Sex":"male","Country of Origin":"USA","State or Province":"Illinois","Education Level":"No High School","MBTI Personality":"ISFP","Lifestyle":"gardening","Backstory":"Charles Williams was born and raised in the small town of Bloomington, Illinois. Growing up, he was always a free spirit, constantly seeking out new adventures and experiences. His parents, both hardworking blue-collar workers, struggled to make ends meet and didn't have much time to spend with Charles and his younger sister. As a result, Charles learned to be independent and self-sufficient at a young age.\n\nHowever, school was never a priority for Charles. He found the traditional education system stifling and boring, and by the time he reached high school, he had lost all interest in attending. Despite his parents' pleas, Charles dropped out at the age of 16 and never looked back.\n\nWith no high school degree, Charles struggled to find steady employment. He took on odd jobs here and there, but nothing seemed to stick. It wasn't until he stumbled upon gardening that he found his true passion. Charles was fascinated by the beauty and complexity of plants and spent hours researching and experimenting with different gardening techniques.\n\nAs he delved deeper into the world of gardening, Charles found solace and purpose. He began documenting his journey on Instagram, sharing his knowledge and experiences with others. His posts caught the attention of many, and soon enough, Charles had a dedicated following.\n\nDespite his lack of formal education, Charles had an innate talent for gardening and a natural green thumb. His Instagram account became a source of inspiration for many, and his followers often praised his above-average beauty and above-average face.\n\nBut gardening was not the only thing that Charles was passionate about. He also had a love for spontaneity and creativity. He would often go on impromptu road trips, exploring new places and trying new things. Charles was also a talented artist, using his flexible and adaptable nature to create unique and beautiful pieces.\n\nAt the age of 21, Charles continues to live life on his own terms, unapologetically embracing his unconventional path. He may not have a high school degree, but he has found success and fulfillment in his passion for gardening and his thirst for adventure. With his Instagram account as a platform, Charles hopes to inspire others to follow their dreams and live life to the fullest."}
{"Name":"Tiffany Johnson","Age":37,"Sex":"female","Country of Origin":"USA","State or Province":"New Jersey","Education Level":"High School","MBTI Personality":"INTJ","Lifestyle":"education","Backstory":"Tiffany Johnson was born and raised in a small town in New Jersey, USA. Growing up, she was always a curious and inquisitive child, constantly asking questions and seeking knowledge. Her parents, both teachers, instilled in her a love for learning and education from a young age.\n\nIn high school, Tiffany excelled in her studies and was known for her analytical mind and problem-solving skills. She was always the go-to person for help with homework or understanding complex theories. Despite her academic success, Tiffany was never one to boast or show off her intelligence. She was content with being an average student with an average face.\n\nAfter graduating from high school, Tiffany decided to pursue a degree in education, following in her parents' footsteps. She attended a local college and graduated with a degree in secondary education. She then went on to teach at her alma mater, where she quickly became known as a dedicated and passionate teacher.\n\nAs the years went by, Tiffany's love for education only grew stronger. She spent her free time attending workshops and conferences, constantly seeking new ways to improve her teaching methods and help her students succeed. Her colleagues and students admired her for her dedication and innovative teaching style.\n\nOutside of work, Tiffany's Instagram and lifestyle reflected her passion for education. She often posted about complex theories and problem-solving methods, showcasing her analytical mind and love for learning. She also used her platform to share educational resources and tips for students and fellow teachers.\n\nAt 37 years old, Tiffany may not have a glamorous or exciting life, but she is content with where she is. She has found fulfillment in her career and continues to inspire and educate those around her. To Tiffany, there is nothing more rewarding than seeing her students thrive and succeed in their academic pursuits."}
{"Name":"Wendy Ballard","Age":23,"Sex":"female","Country of Origin":"USA","State or Province":"Utah","Education Level":"High School","MBTI Personality":"ENTP","Lifestyle":"health","Backstory":"Wendy Ballard was born and raised in the small town of Provo, Utah in the United States. Growing up, she was always a curious and argumentative child, constantly questioning the world around her and seeking answers to the most complex questions. Her parents, both teachers, encouraged her inquisitive nature and always pushed her to think critically and challenge societal norms.\n\nIn high school, Wendy excelled academically and was known for her sharp mind and quick wit. She was involved in various clubs and organizations, including the debate team where she honed her skills in persuasive argumentation. Despite her busy schedule, Wendy also made sure to prioritize her health and wellness, often participating in yoga and meditation classes and experimenting with different diets and exercise routines.\n\nAfter graduating high school with top honors, Wendy decided to take a gap year to travel and explore different cultures. She backpacked through Europe, Asia, and South America, immersing herself in new experiences and gaining a deeper understanding of the world. During her travels, she also discovered her passion for photography and started an Instagram account to document her adventures and share her thoughts and ideas with others.\n\nUpon returning to the United States, Wendy enrolled in a local community college, determined to continue her education and broaden her knowledge. She studied a variety of subjects, from philosophy to nutrition, and even took some online courses in entrepreneurship and business management. Through her studies, she developed a strong interest in health and wellness, and how it relates to overall happiness and success in life.\n\nNow, at 23 years old, Wendy has graduated with a degree in Liberal Arts and is ready to take on the world. She has a slightly above average beauty and an above average face, but she doesn't let her appearance define her. Instead, she uses her intelligence and passion for health to make a difference in the world. She continues to share her thoughts and ideas on her Instagram page, often sparking intellectual debates and inspiring others to think outside the box.\n\nWendy's future is bright, and she plans to use her knowledge and passion to create a positive impact on society. She dreams of starting her own health and wellness company, where she can combine her love for business and her desire to help others live their best lives. With her curious and argumentative nature, there's no doubt that Wendy will continue to push boundaries and challenge the status quo, making a name for herself in the world of health and wellness."}
{"Name":"Anthony Pace","Age":21,"Sex":"male","Country of Origin":"Canada","State or Province":"Quebec","Education Level":"High School","MBTI Personality":"INTP","Lifestyle":"gaming","Backstory":"Anthony Pace was born and raised in the bustling city of Montreal, Quebec. From a young age, he showed a keen interest in technology and video games, spending hours immersed in virtual worlds and honing his skills as a gamer. His parents, both successful business executives, were initially concerned about his obsession with gaming, but as Anthony grew older, they began to see the potential in his passion.\n\nIn high school, Anthony excelled in his studies, particularly in math and science. Despite his love for gaming, he never let it interfere with his academic pursuits, and he graduated with top honors. However, it was during this time that Anthony's true passion for gaming truly blossomed. He spent countless hours researching and learning about game design, programming, and all aspects of the gaming industry.\n\nAfter graduating, Anthony decided to pursue a degree in computer science, with a focus on game development. He moved to Toronto to attend one of the top universities in the country and quickly made a name for himself in the gaming community. His innovative ideas and exceptional coding skills caught the attention of several game studios, and he was offered a job even before completing his degree.\n\nBut Anthony had bigger dreams. He wanted to create his own games, with unique and thought-provoking concepts that would challenge players' minds. So, after completing his degree, he turned down the job offers and returned to Montreal to start his own game development company.\n\nAnthony's company quickly gained recognition for its groundbreaking games, which combined stunning visuals with complex storylines and abstract concepts. His games were a hit among gamers and critics alike, and Anthony became known as a visionary in the industry.\n\nHis success also translated to his personal life, as he gained a large following on social media. With his exceptional beauty and an exceptional face, Anthony's Instagram became a popular platform for showcasing his gaming skills and sharing his thoughts on the industry. He also used his platform to promote diversity and inclusivity in gaming, believing that everyone should have the opportunity to experience the magic of virtual worlds.\n\nToday, at 21 years old, Anthony Pace is a successful game developer, entrepreneur, and influencer. He continues to push the boundaries of gaming and inspire others with his creativity and passion. And while he may have started as just a teenager with a love for gaming, Anthony has become a force to be reckoned with in the world of technology and entertainment."}
{"Name":"Theresa Jones","Age":30,"Sex":"female","Country of Origin":"USA","State or Province":"Florida","Education Level":"High School","MBTI Personality":"ESTP","Lifestyle":"architecture","Backstory":"Theresa Jones was born and raised in the sunny state of Florida, USA. Growing up, she always had a love for creativity and design, often spending hours drawing and building elaborate structures with Legos. Her parents, both hard-working blue-collar workers, instilled in her the importance of determination and perseverance.\n\nAs a teenager, Theresa excelled in math and science, which led her to pursue a degree in architecture. After graduating high school with top honors, she attended a local community college to save money before transferring to a prestigious university to complete her degree.\n\nDuring her time in college, Theresa faced many challenges. She had to balance a part-time job, full course load, and family responsibilities, as she was the oldest of three siblings. But she never let these obstacles deter her from her dreams. Instead, she used them as motivation to work even harder.\n\nAfter four years of hard work and dedication, Theresa graduated with a degree in architecture. She landed a job at a prominent firm in Miami, where she quickly made a name for herself with her innovative designs and attention to detail.\n\nTheresa's passion for architecture extended beyond her 9-5 job. She spent her free time exploring the city, taking in the unique buildings and structures, and documenting her findings on her Instagram page. Her followers were drawn to her simple yet elegant aesthetic and her ability to find beauty in the most ordinary places.\n\nDespite her success in her career and social media presence, Theresa remained humble and down-to-earth. She never let her average appearance or background hold her back, and instead, used it as a driving force to prove that hard work and determination can lead to success.\n\nNow, at 30 years old, Theresa continues to thrive in her career, taking on new challenges and pushing the boundaries of design. She hopes to one day start her own architecture firm and use her platform to inspire others to pursue their passions and never give up on their dreams."}
{"Name":"Angela Brown","Age":23,"Sex":"female","Country of Origin":"USA","State or Province":"Texas","Education Level":"Bachelor","MBTI Personality":"ESFJ","Lifestyle":"dancing","Backstory":"Angela Brown was born and raised in the bustling city of Houston, Texas. From a young age, she was always drawn to music and movement, often dancing around the house to her parents' old vinyl records. Her parents, both successful lawyers, encouraged her to pursue her passions and enrolled her in dance classes at the age of five.\n\nAs she grew older, Angela's love for dance only intensified. She spent countless hours in the studio, perfecting her technique and immersing herself in various styles of dance. Her hard work and dedication paid off when she was accepted into the prestigious dance program at the University of Texas, where she excelled and graduated with a Bachelor's degree in dance.\n\nAfter graduation, Angela moved back to Houston and began teaching dance classes at a local studio. She quickly gained a reputation as an exceptional teacher, with her students praising her for her patience, positivity, and ability to create a supportive and inclusive atmosphere in the studio.\n\nOutside of teaching, Angela's passion for dance continued to thrive. She started posting videos of herself dancing on Instagram, showcasing her talent and creativity. Her posts gained a following, and she soon became known as a rising star in the dance community.\n\nBut for Angela, dance was more than just a hobby or career. It was a way for her to connect with others and create a sense of community. Growing up, she had always struggled with feeling like she didn't fit in or belong. But through dance, she found a sense of belonging and acceptance. She made it her mission to create that same feeling for others, both in and out of the studio.\n\nAngela's Instagram and lifestyle reflected her commitment to building relationships and creating a positive and supportive community. She used her platform to spread messages of self-love, body positivity, and inclusivity, inspiring others to embrace their uniqueness and follow their passions.\n\nAt 23 years old, Angela may have a slightly above average appearance, but her beauty radiates from within. She is a kind, compassionate, and driven individual, who continues to use her love for dance to make a positive impact on those around her."}
{"Name":"Nicole Rivera","Age":24,"Sex":"female","Country of Origin":"Canada","State or Province":"Quebec","Education Level":"Master","MBTI Personality":"ENFP","Lifestyle":"vlogging","Backstory":"Nicole Rivera was born and raised in Quebec, Canada, in a small town nestled in the mountains. From a young age, she was always drawn to creativity and self-expression. She would spend hours drawing, writing, and making videos with her friends.\n\nAs she grew older, Nicole's love for creativity only intensified. She excelled in her art classes and was always the first to volunteer for any creative project. Her parents, who were both doctors, encouraged her to pursue a more practical career, but Nicole couldn't shake off her passion for art.\n\nAfter graduating high school, Nicole decided to follow her dreams and pursue a degree in Fine Arts. She moved to the city and enrolled in a prestigious university, where she excelled in her studies. Her professors were impressed by her unique perspective and her ability to think outside the box.\n\nDuring her second year of college, Nicole discovered her love for vlogging. She started a YouTube channel where she shared her adventures, creative projects, and thoughts on various topics. Her channel quickly gained a following, and Nicole found herself immersed in the world of social media.\n\nAfter completing her Bachelor's degree, Nicole decided to continue her education and pursue a Master's degree in Digital Media. She wanted to learn more about the technical aspects of vlogging and how to create engaging content. Her professors were impressed by her dedication and creativity, and she graduated at the top of her class.\n\nWith her Master's degree in hand, Nicole was ready to take on the world. She moved to the bustling city of Montreal and started working as a freelance vlogger. Her unique style and bubbly personality quickly caught the attention of brands, and she started collaborating with them to create sponsored content.\n\nNicole's vlogging career took off, and she became known for her optimistic and inventive nature. She was always up for trying new things and never shied away from a challenge. Her Instagram feed was a reflection of her adventurous and creative spirit, with each post showcasing her above-average beauty and above-average face.\n\nNow, at 24 years old, Nicole has found her passion and turned it into a successful career. She continues to inspire others through her vlogs and social media, encouraging them to follow their dreams and embrace their creativity."}
{"Name":"Christine Brown","Age":24,"Sex":"female","Country of Origin":"USA","State or Province":"Ohio","Education Level":"Master","MBTI Personality":"INTJ","Lifestyle":"politics","Backstory":"Christine Brown was born and raised in a small town in Ohio, USA. Growing up, she was always a curious and ambitious child, constantly questioning the world around her and seeking ways to make a positive impact. Her parents, both teachers, instilled in her a love for learning and a strong sense of social justice.\n\nFrom a young age, Christine showed a natural aptitude for politics and public speaking. She would often engage in debates with her classmates and teachers, always eager to share her opinions and ideas. As she got older, her passion for politics only grew stronger, and she knew that she wanted to pursue a career in this field.\n\nAfter graduating from high school, Christine attended a prestigious university where she majored in Political Science. She excelled in her studies, earning top grades and earning the respect of her professors. During her time at university, she also became heavily involved in various political organizations and campaigns, using her strategic thinking and communication skills to make a difference.\n\nUpon graduating with her Bachelor's degree, Christine decided to further her education by pursuing a Master's degree in Public Policy. She was determined to gain a deeper understanding of the political landscape and how to create effective solutions for societal issues. Her hard work and dedication paid off, and she graduated at the top of her class.\n\nWith her Master's degree in hand, Christine was ready to make her mark on the world. She landed a job at a prominent think tank in Washington D.C., where she worked on developing long-term plans and innovative solutions for various political issues. Her intelligence, passion, and strategic thinking quickly caught the attention of her colleagues and superiors, and she quickly rose through the ranks.\n\nOutside of her work, Christine is an active presence on social media, particularly Instagram, where she shares her thoughts on current events and political issues. Her followers are drawn to her articulate and well-informed posts, as well as her above-average beauty and charisma.\n\nDespite her busy schedule, Christine always makes time to give back to her community. She volunteers at local organizations and mentors young women who are interested in pursuing careers in politics. She hopes to inspire the next generation of leaders and make a lasting impact on society.\n\nAt 24 years old, Christine Brown has already accomplished so much, and her future is bright. With her intelligence, passion, and determination, she is sure to continue making a difference in the world of politics and beyond."}
{"Name":"Richard Acosta","Age":23,"Sex":"male","Country of Origin":"USA","State or Province":"South Dakota","Education Level":"High School","MBTI Personality":"ISTP","Lifestyle":"food","Backstory":"Richard Acosta was born and raised in a small town in South Dakota, USA. Growing up, he was always surrounded by the stunning landscapes and fresh produce that the state is known for. His parents, both farmers, instilled in him a deep appreciation for food and nature from a young age.\n\nDespite being a quiet and reserved child, Richard's love for food and cooking was evident. He spent hours in the kitchen with his mother, learning family recipes and experimenting with new flavors. As he grew older, he also developed a passion for photography, capturing the beauty of his surroundings and the delicious meals he created.\n\nAfter graduating from high school, Richard decided to pursue his love for food by enrolling in a culinary program at a local community college. He excelled in his classes and graduated with top honors. However, instead of pursuing a traditional career in a restaurant, Richard wanted to use his skills to share his love for food with the world.\n\nHe started a food blog and Instagram account, showcasing his culinary creations and adventures in the kitchen. His unique combinations and stunning food photography quickly gained a following, and Richard's platform grew into a successful business. He also used his platform to promote sustainable and locally sourced ingredients, in line with his upbringing and values.\n\nBut Richard's love for food didn't stop at just cooking and sharing it with others. He also had a thirst for adventure and a desire to explore different cultures and cuisines. He often took spontaneous trips to different countries, immersing himself in the local food scene and learning new techniques and flavors.\n\nDespite his busy schedule, Richard always made time for his family and friends. He often hosted dinner parties and taught his loved ones how to cook his favorite dishes. His infectious enthusiasm and warm personality made him a beloved member of his community.\n\nNow at 23 years old, Richard continues to inspire others through his love for food and his adventurous spirit. He hopes to one day open his own restaurant, where he can share his passion and creativity with even more people. But for now, he's content with living in the moment and enjoying every bite life has to offer."}
{"Name":"Wanda Johnson","Age":23,"Sex":"female","Country of Origin":"USA","State or Province":"Oklahoma","Education Level":"Bachelor","MBTI Personality":"INFJ","Lifestyle":"psychology","Backstory":"Wanda Johnson was born and raised in a small town in Oklahoma, USA. From a young age, she was always fascinated by the human mind and behavior. She would spend hours observing people and trying to understand their thoughts and actions. This curiosity eventually led her to pursue a degree in psychology at a prestigious university.\n\nGrowing up, Wanda was always known for her intelligence and empathy. She had a natural ability to connect with people and understand their emotions. Her parents, who were both teachers, encouraged her to follow her passion for psychology and supported her every step of the way.\n\nDuring her time in college, Wanda excelled in her studies and was involved in various research projects and volunteer work. She also became heavily involved in social justice and advocacy work, using her knowledge of psychology to understand and address issues such as mental health stigma and discrimination.\n\nAfter graduating with a Bachelor's degree in psychology, Wanda decided to use her platform and voice to spread awareness and promote positive change. She started an Instagram account where she shared her insights and thoughts on various psychological topics, hoping to inspire and educate others.\n\nWanda's Instagram quickly gained a following, and her posts were praised for their depth and empathy. People were drawn to her kind and genuine personality, and many reached out to her for advice and support.\n\nWith her platform, Wanda continues to advocate for mental health awareness and social justice issues. She uses her knowledge and passion for psychology to help others, and her ultimate goal is to create a more understanding and compassionate world.\n\nDespite her slightly above average appearance, Wanda's true beauty lies in her kind heart and her unwavering dedication to making a positive impact on the world. She hopes to inspire others to do the same and believes that with empathy and understanding, anything is possible."}
{"Name":"Michelle Mcneil","Age":26,"Sex":"female","Country of Origin":"Canada","State or Province":"Ontario","Education Level":"High School","MBTI Personality":"ISFP","Lifestyle":"diy","Backstory":"Michelle Mcneil was born and raised in a small town in Ontario, Canada. Growing up, she always had a love for art and creativity. Her parents, who were both artists themselves, encouraged her to express herself through various forms of art. As a child, Michelle spent hours in her room drawing, painting, and crafting.\n\nIn high school, Michelle's passion for art only grew stronger. She excelled in her art classes and even won several awards for her work. However, her parents always stressed the importance of education, so Michelle made sure to maintain good grades and graduated with a high school degree.\n\nAfter high school, Michelle wasn't sure what path to take. She considered pursuing a degree in art, but her practical side convinced her to pursue a more stable career. She ended up getting a job at a local marketing firm, where she used her creative skills to design advertisements and campaigns for clients.\n\nDespite having a successful career, Michelle couldn't shake off her love for art and DIY projects. In her free time, she would often spend hours browsing through Pinterest and YouTube, learning new techniques and trying out different projects. She also started documenting her creations on Instagram, and to her surprise, her posts gained a lot of attention and followers.\n\nAs her Instagram following grew, Michelle's confidence in her artistic abilities grew as well. She started taking on more challenging projects and even began selling some of her creations online. Her adaptable personality allowed her to explore various forms of art, from painting and drawing to pottery and woodworking.\n\nNow at 26 years old, Michelle has become a well-known DIY influencer on Instagram. Her posts not only showcase her artistic abilities but also inspire others to embrace their creativity and try new things. She continues to balance her successful career with her passion for DIY, and her slightly above average beauty and face only add to her charm and appeal on social media."}
{"Name":"Jocelyn Smith","Age":24,"Sex":"female","Country of Origin":"USA","State or Province":"Texas","Education Level":"Bachelor","MBTI Personality":"ESFP","Lifestyle":"sports","Backstory":"Jocelyn Smith was born and raised in the heart of Texas, USA. Growing up, she was always a tomboy and had a natural talent for sports. She excelled in every sport she tried, from basketball to soccer to track and field. Her parents, both former athletes themselves, encouraged her to pursue her passion for sports and instilled in her the importance of hard work and dedication.\n\nAs she grew older, Jocelyn's love for sports only intensified. She spent most of her free time playing and practicing, determined to become the best athlete she could be. In high school, she was the star player on the varsity basketball team and led them to multiple championships.\n\nAfter graduating, Jocelyn received a full scholarship to attend a prestigious university in Texas, where she continued to dominate on the court. She also excelled in the classroom, earning a Bachelor's degree in Sports Management. Her dream was to one day become a sports agent and help other athletes achieve their goals.\n\nBut Jocelyn's love for sports didn't stop there. She also had a passion for photography and started documenting her athletic journey on Instagram. Her posts were a mix of action shots from games, behind-the-scenes glimpses into her training, and lifestyle photos that captured her vibrant personality.\n\nAs her following grew, Jocelyn became known as a social media influencer in the sports world. Brands started reaching out to her for partnerships and collaborations, and she quickly became a sought-after ambassador for athletic apparel and equipment companies.\n\nAt 24 years old, Jocelyn has become a successful sports agent, representing some of the biggest names in the industry. She also continues to inspire others through her Instagram, using her platform to promote body positivity and self-love. Her above-average beauty and face, combined with her infectious energy and passion for life, have made her a role model for many.\n\nDespite her busy schedule, Jocelyn always finds time to stay active and play sports. She believes that staying physically fit is not only important for her career but also for her overall well-being. Her Instagram is a true reflection of her love for sports and her zest for life, inspiring others to live their best lives and pursue their passions with determination and joy."}
{"Name":"Mrs. Alyssa Edwards DVM","Age":27,"Sex":"female","Country of Origin":"USA","State or Province":"Missouri","Education Level":"High School","MBTI Personality":"ISTJ","Lifestyle":"diy","Backstory":"Mrs. Alyssa Edwards DVM was born and raised in a small town in Missouri, USA. She was the only child of a hardworking couple who owned a small farm on the outskirts of town. From a young age, Alyssa showed a strong interest in animals, often spending hours playing with the farm animals and helping her parents with their care.\n\nAs she grew older, Alyssa's passion for animals only grew stronger. She excelled in her science classes in high school and always knew that she wanted to pursue a career in veterinary medicine. Despite her parents' humble income, they always encouraged her to follow her dreams and supported her in any way they could.\n\nAfter graduating from high school with top honors, Alyssa was accepted into the prestigious College of Veterinary Medicine at the University of Missouri. It was a dream come true for her, and she worked tirelessly to excel in her studies. She graduated with a degree in Veterinary Medicine at the top of her class and was offered a job at a renowned animal hospital in the city.\n\nAlyssa quickly established herself as a skilled and compassionate veterinarian, earning the trust and respect of her colleagues and clients alike. She was known for her meticulous planning and attention to detail, and her dedication to traditional values and hard work.\n\nHowever, despite her successful career, Alyssa always felt a longing for the simple life she had grown up with on the farm. She missed the smell of freshly cut hay, the sound of animals grazing, and the feeling of dirt under her feet. So, after a few years of working in the city, she decided to move back to her hometown and open her own veterinary clinic.\n\nHer clinic quickly became a success, and Alyssa was able to combine her love for animals with her passion for DIY projects. She often shared her DIY projects on Instagram, and her followers were amazed by her creativity and resourcefulness.\n\nDespite her average appearance, Alyssa's kind heart and passion for her work made her stand out. She was a beloved member of the community, always willing to lend a helping hand to anyone in need. Her dedication to her job, her family, and her community made her a role model for many.\n\nToday, at 27 years old, Mrs. Alyssa Edwards DVM is living her dream. She has found the perfect balance between her love for animals, her passion for DIY projects, and her commitment to traditional values. And she couldn't be happier."}
{"Name":"Jodi Miller","Age":21,"Sex":"female","Country of Origin":"USA","State or Province":"Virginia","Education Level":"No High School","MBTI Personality":"ENFJ","Lifestyle":"parenting","Backstory":"Jodi Miller was born and raised in a small town in Virginia, USA. She grew up in a low-income household with her parents and two younger siblings. Her parents worked multiple jobs to make ends meet, leaving Jodi to take care of her siblings and household responsibilities at a young age. Despite the challenges, Jodi always had a positive outlook on life and a natural talent for leadership.\n\nAs a child, Jodi excelled in school and was always eager to learn. However, when she reached high school, her family's financial struggles made it difficult for her to continue her education. Jodi had to drop out of high school and start working to help support her family. It was a tough decision, but she knew it was necessary to help her family survive.\n\nJodi's love for children and her natural nurturing abilities led her to become a nanny for a wealthy family in her town. She quickly became an essential part of the family and was loved by the children she cared for. Jodi's passion for parenting grew as she watched the children she cared for grow and learn under her guidance.\n\nDespite not having a high school degree, Jodi's intelligence and determination caught the attention of the family she worked for. They offered to pay for her to take online courses and earn her GED. Jodi eagerly accepted the offer and worked hard to complete her studies while still working as a nanny.\n\nOnce she earned her GED, Jodi started to explore her passion for parenting even further. She started a blog and Instagram account, sharing her experiences and advice on parenting. Her exceptional beauty and exceptional face caught the attention of many, and her following quickly grew. Jodi's positive and uplifting messages resonated with her followers, and she became known as a role model for young parents.\n\nNow at 21 years old, Jodi continues to work as a nanny while also pursuing her dream of becoming a parenting coach. She hopes to use her platform to inspire and empower other young parents who may be facing similar challenges as she did. Jodi's journey may not have been easy, but she has proven that with determination and a positive attitude, anything is possible."}
{"Name":"Brenda Thompson","Age":21,"Sex":"female","Country of Origin":"USA","State or Province":"Georgia","Education Level":"High School","MBTI Personality":"ESFJ","Lifestyle":"fashion","Backstory":"Brenda Thompson was born and raised in a small town in Georgia, USA. She was the youngest of three siblings and was always known as the \"fashionista\" of the family. From a young age, Brenda had a love for all things stylish and trendy. She would often spend hours playing dress-up with her older sisters' clothes and experimenting with different makeup looks.\n\nAs she grew older, Brenda's passion for fashion only intensified. She would spend hours scrolling through fashion blogs and magazines, taking note of the latest trends and styles. She even started her own fashion blog in high school, showcasing her own unique sense of style and gaining a small following in her town.\n\nDespite her love for fashion, Brenda's parents always stressed the importance of education. They encouraged her to focus on her studies and pursue a degree in a practical field. So, after graduating high school with top honors, Brenda decided to attend a local community college and study business.\n\nHowever, her love for fashion never faded and she continued to express herself through her personal style and her blog. Her Instagram account became a platform for her to share her outfits, makeup looks, and fashion tips with a wider audience. She quickly gained a large following and became known as a fashion influencer in her town.\n\nBut Brenda's Instagram was more than just a fashion account. It was a reflection of her kind and caring nature. She used her platform to spread positivity and promote body positivity and self-love. Her posts were a source of inspiration for many, and she often received messages from her followers thanking her for being a role model.\n\nNow, at 21 years old, Brenda has graduated from community college with a degree in business. While she has a job in the corporate world, her true passion still lies in fashion. She dreams of one day starting her own fashion line and becoming a successful entrepreneur. But for now, she continues to inspire others through her Instagram and live out her passion for fashion in her everyday life."}
{"Name":"Sandy Collins","Age":28,"Sex":"female","Country of Origin":"USA","State or Province":"Florida","Education Level":"Bachelor","MBTI Personality":"ENTJ","Lifestyle":"business","Backstory":"Sandy Collins was born and raised in sunny Florida, USA. Growing up, she was always a natural leader, constantly organizing and delegating tasks to her siblings and friends. Her parents recognized her talents early on and encouraged her to pursue her passion for business.\n\nAfter graduating high school, Sandy attended the University of Florida where she earned a Bachelor's degree in Business Administration. During her time in college, she was heavily involved in various leadership organizations and held several executive positions. She excelled in her studies and graduated at the top of her class.\n\nAfter graduation, Sandy landed a job at a prestigious consulting firm in Miami. She quickly climbed the corporate ladder, impressing her superiors with her strategic thinking and exceptional leadership skills. However, after a few years in the corporate world, Sandy realized that she wanted to be her own boss and have more control over her career.\n\nAt the age of 28, Sandy took a leap of faith and left her job to start her own business. She used her savings to open a small boutique consulting firm, specializing in helping small businesses and startups reach their full potential. Sandy's business acumen and natural leadership abilities helped her company thrive, and she quickly gained a reputation as a successful and respected businesswoman in the community.\n\nSandy's Instagram account reflects her passion for business and her dedication to helping others succeed. She often shares tips and insights on leadership, long-term planning, and entrepreneurship, inspiring others to chase their dreams and achieve their goals.\n\nDespite her busy schedule, Sandy always makes time for self-care and maintaining a healthy work-life balance. She enjoys spending time at the beach, practicing yoga, and trying out new restaurants with her friends and family.\n\nAlthough Sandy may have an average appearance, her sharp mind and commanding presence make her stand out in any room. Her determination and drive have helped her overcome any obstacles and achieve her dreams, and she continues to inspire others to do the same."}
{"Name":"Michelle Steele","Age":27,"Sex":"female","Country of Origin":"USA","State or Province":"Idaho","Education Level":"High School","MBTI Personality":"ESTJ","Lifestyle":"health","Backstory":"Michelle Steele was born and raised in Boise, Idaho, the youngest of three children. Growing up, she was always a bit of a perfectionist, striving for excellence in everything she did. Her parents, both successful lawyers, instilled in her the importance of hard work and determination.\n\nIn high school, Michelle was a straight-A student and excelled in sports, particularly track and field. She was always pushing herself to be the best she could be, and this drive and determination earned her the nickname \"Steele\" amongst her teammates.\n\nAfter graduating from high school, Michelle decided to take a gap year to travel and explore different cultures. During this time, she discovered her passion for health and wellness. She was fascinated by the connection between the mind and body and how taking care of oneself could lead to a happier and more fulfilling life.\n\nUpon returning to Idaho, Michelle enrolled in a local community college to pursue a degree in nutrition. She worked part-time at a health food store, soaking up as much knowledge as she could about healthy eating and living. Her hard work paid off, and she graduated with honors.\n\nMichelle then decided to move to Los Angeles to pursue a career in the health and wellness industry. She landed a job at a prominent health and fitness company, where she quickly worked her way up to a management position. Her pragmatic and methodical approach to tasks and her responsible and orderly nature made her a valuable asset to the company.\n\nIn her free time, Michelle enjoys hiking, yoga, and experimenting with new healthy recipes. She also loves to travel and has visited many countries, always seeking out new wellness practices and incorporating them into her daily routine.\n\nAt 27 years old, Michelle is content with her life and proud of all that she has accomplished. She may not have the most striking appearance, but she radiates confidence and inner beauty. Her Instagram and lifestyle reflect her passion for health and inspire others to live a balanced and fulfilling life."}
{"Name":"Rachel Farley","Age":25,"Sex":"female","Country of Origin":"USA","State or Province":"Arizona","Education Level":"No High School","MBTI Personality":"ISFP","Lifestyle":"diy","Backstory":"Rachel Farley was born and raised in the hot desert of Arizona, USA. Growing up, her family struggled financially and she was forced to drop out of high school at the age of 16 to help support her family. Despite not having a formal education, Rachel was always a curious and creative individual. She spent most of her days tinkering with random objects, creating something new out of nothing.\n\nAs she grew older, Rachel's love for DIY projects only intensified. She would spend hours watching tutorials and experimenting with different materials, constantly pushing herself to learn new skills. Her passion for DIY not only gave her a sense of fulfillment, but it also helped her cope with the struggles of her daily life.\n\nAt the age of 20, Rachel decided to leave her hometown and move to the bustling city of Phoenix. She landed a job as a waitress at a local caf\u00e9, where she worked long hours to make ends meet. But her free time was dedicated to her true passion \u2013 DIY projects. She would scour thrift stores and garage sales for materials, and her small apartment was filled with her creations.\n\nRachel's unique and flexible nature caught the attention of her coworkers and customers. They were always amazed by her spontaneous adventures and artistic endeavors, and many encouraged her to share her work on social media. With a little push, Rachel created an Instagram account to showcase her DIY projects and adventures.\n\nAs her following grew, Rachel's confidence also grew. She began to see her DIY projects not just as a hobby, but as a potential career. She started selling her creations online and even landed a few commissioned projects. Rachel's Instagram feed became a reflection of her passion and creativity, and she gained a reputation for her unique and flexible approach to DIY.\n\nNow, at 25 years old, Rachel has become a successful DIY influencer, with a loyal following and a thriving business. She may not have a high school degree, but her determination and love for DIY have brought her far in life. She continues to inspire others to embrace their creativity and never give up on their dreams."}
{"Name":"Shannon Wright","Age":23,"Sex":"female","Country of Origin":"USA","State or Province":"California","Education Level":"High School","MBTI Personality":"ISTP","Lifestyle":"diy","Backstory":"Shannon Wright was born and raised in the sunny state of California, USA. She grew up in a small town, surrounded by nature and a close-knit community. From a young age, Shannon was always a curious and creative child, always eager to learn new things and explore the world around her.\n\nAs she got older, Shannon's love for DIY projects and hands-on activities only grew stronger. She was always the first to volunteer for school projects and loved spending her weekends tinkering with different materials and tools in her garage. Her parents were always supportive of her interests and encouraged her to follow her passion.\n\nDespite her love for DIY, Shannon was also a dedicated student. She excelled in her classes and graduated high school with top honors. However, Shannon knew that college wasn't the right path for her. She wanted to pursue a career that allowed her to be hands-on and use her problem-solving skills.\n\nAfter much thought and consideration, Shannon decided to start her own DIY blog and Instagram page. She saw it as the perfect platform to share her projects and ideas with the world. Her posts quickly gained popularity, and before she knew it, she had a loyal following of fellow DIY enthusiasts.\n\nWith her growing success on social media, Shannon decided to turn her passion into a full-time career. She started collaborating with different brands and companies, showcasing their products in her DIY projects. Her unique and practical approach to projects made her stand out in the crowded world of social media influencers.\n\nAt the young age of 23, Shannon has become a well-known name in the DIY community. Her followers admire her for her problem-solving skills, her down-to-earth personality, and her slightly above average beauty and face. She continues to inspire others to get their hands dirty and embrace the joy of creating and building things from scratch.\n\nShannon's journey is a testament to the fact that with hard work, determination, and a little bit of creativity, one can turn their passion into a successful career. And for Shannon, there's nothing more satisfying than seeing her followers try out her projects and sharing their own DIY successes with her."}
{"Name":"Scott Scott","Age":22,"Sex":"male","Country of Origin":"USA","State or Province":"Colorado","Education Level":"High School","MBTI Personality":"ENTP","Lifestyle":"travel","Backstory":"Scott Scott grew up in a small town in the mountains of Colorado. He was always a curious child, constantly asking questions and seeking out new experiences. His parents, both avid travelers, instilled in him a love for adventure and exploration from a young age.\n\nDespite his small town upbringing, Scott was always a quick learner and excelled in school. He was particularly interested in history and philosophy, often engaging in intellectual debates with his peers and teachers. His classmates often described him as argumentative, but Scott saw it as a way to challenge his own ideas and expand his knowledge.\n\nAfter graduating high school, Scott decided to take a gap year to travel the world. He spent months backpacking through Europe, immersing himself in different cultures and meeting people from all walks of life. It was during this trip that he discovered his love for photography and started documenting his travels on Instagram.\n\nUpon returning home, Scott enrolled in a local community college to study history and philosophy. He continued to travel during breaks and used his experiences to fuel his academic pursuits. His Instagram account gained a following as he shared not only beautiful travel photos, but also thought-provoking captions and discussions on various topics.\n\nAfter earning his degree, Scott decided to take a break from formal education and focus on his passion for travel. He worked odd jobs and saved up money to fund his adventures, often taking solo trips to remote and off-the-beaten-path destinations. His Instagram account continued to grow, attracting attention from brands and fellow travelers.\n\nNow, at 22 years old, Scott has become a full-time travel influencer. He uses his platform not only to showcase his stunning photos, but also to share his thoughts and ideas on important issues such as sustainability, cultural sensitivity, and social justice. He hopes to inspire others to explore the world and open their minds to new perspectives.\n\nScott's high beauty and unique appearance have also caught the eye of modeling agencies, but he has chosen to focus on his passion for travel and making a positive impact in the world. He continues to push boundaries, challenge norms, and live life to the fullest, always seeking out new adventures and experiences."}
{"Name":"Samantha Long","Age":20,"Sex":"female","Country of Origin":"USA","State or Province":"North Carolina","Education Level":"High School","MBTI Personality":"ESFP","Lifestyle":"health","Backstory":"Samantha Long was born and raised in the small town of Asheville, North Carolina. She was the youngest of three siblings and was always the free-spirited one in the family. From a young age, Samantha had a love for the outdoors and a deep appreciation for a healthy lifestyle. Her parents, both fitness enthusiasts, instilled in her the importance of taking care of her body and mind.\n\nIn high school, Samantha was known for her infectious energy and positive attitude. She was always involved in sports and extracurricular activities, excelling in track and field and dance. Her peers often described her as having a \"very high beauty and an very high face,\" a compliment that Samantha took with a humble smile.\n\nAfter graduating from high school, Samantha decided to take a gap year before starting college. She wanted to travel and experience different cultures, but also use this time to focus on her passion for health and wellness. She spent the year volunteering at local gyms and health centers, learning about nutrition and fitness from experts in the field.\n\nDuring this time, Samantha also discovered her love for photography and social media. She started an Instagram account to document her travels and share her health journey with others. Her vibrant and lively posts quickly gained a following, and Samantha became known as a health and wellness influencer.\n\nAs her gap year came to an end, Samantha knew that she wanted to pursue a career in the health and wellness industry. She decided to attend a local community college to study nutrition and fitness, while also continuing to build her social media presence.\n\nNow, at 20 years old, Samantha is a certified nutritionist and personal trainer. She uses her platform to promote a balanced and healthy lifestyle, inspiring others to take care of their bodies and minds. She also works part-time at a local gym, where she helps clients reach their fitness goals and spreads her positive energy to those around her.\n\nSamantha's journey has taught her the importance of self-love and embracing one's uniqueness. She continues to travel, try new foods, and challenge herself physically and mentally, all while spreading joy and positivity through her Instagram and lifestyle."}
{"Name":"Wayne Lewis","Age":24,"Sex":"male","Country of Origin":"Canada","State or Province":"Alberta","Education Level":"Bachelor","MBTI Personality":"INTP","Lifestyle":"philosophy","Backstory":"Wayne Lewis was born and raised in the beautiful province of Alberta, Canada. From a young age, he was always curious about the world around him and had a natural talent for critical thinking and deep introspection. Growing up, he was often described as an old soul, wise beyond his years.\n\nAs he got older, Wayne's love for learning and intellectual pursuits only grew stronger. He excelled in school and was always at the top of his class. His parents, who were both professors at the local university, encouraged his love for knowledge and supported him in pursuing his interests.\n\nAfter graduating high school, Wayne decided to follow in his parents' footsteps and attended the same university to study philosophy. It was during his time in college that he truly found his passion. He was fascinated by the complexities of the human mind and the endless possibilities of abstract thought.\n\nWayne's exceptional intellect and natural talent for philosophy soon caught the attention of his professors. They encouraged him to pursue a Bachelor's degree in the subject, and he graduated with top honors.\n\nAfter graduation, Wayne decided to take some time for himself and travel the world. He visited ancient ruins and studied the philosophies of different cultures, further expanding his knowledge and understanding of the world. During his travels, he also discovered his love for photography and began documenting his adventures on his Instagram account.\n\nWayne's Instagram quickly became a platform for him to share his thoughts and ideas on philosophy with the world. His posts were thought-provoking and often sparked deep discussions among his followers. He gained a large following of like-minded individuals who were drawn to his exceptional beauty and exceptional mind.\n\nNow, at 24 years old, Wayne continues to travel and explore the world, always seeking new perspectives and ideas to expand his knowledge. He is a true philosopher at heart, constantly seeking truth and enlightenment in all aspects of life. His Instagram and lifestyle reflect his passion for philosophy, and he hopes to inspire others to think critically and question the world around them."}
{"Name":"Travis Lowe","Age":18,"Sex":"male","Country of Origin":"USA","State or Province":"California","Education Level":"High School","MBTI Personality":"ESTP","Lifestyle":"comedy","Backstory":"Travis Lowe grew up in the sunny state of California, surrounded by palm trees and the ocean breeze. He was the youngest of three siblings and the only boy in the family. From a young age, Travis was known for his quick wit and sense of humor. He was always the class clown, cracking jokes and making his classmates laugh.\n\nAs he entered high school, Travis discovered his love for comedy. He would spend hours watching stand-up specials and studying the comedic timing of his favorite comedians. He also started posting funny skits and videos on his Instagram, quickly gaining a following for his unique and relatable humor.\n\nDespite his love for comedy, Travis also had a passion for adventure and pushing himself to the limit. He was always up for a challenge and would often be found trying new extreme sports or exploring the great outdoors. His Instagram feed was filled with photos and videos of him skydiving, rock climbing, and surfing.\n\nAs he approached graduation, Travis knew he wanted to pursue a career in comedy. He applied to several universities with strong performing arts programs but ultimately decided to take a gap year to focus on his comedy and travel. During this time, he continued to post hilarious content on his Instagram and even started performing stand-up at local open mic nights.\n\nTravis' online presence and natural talent for comedy caught the attention of a talent scout, who offered him a spot on a popular comedy tour. This opportunity propelled Travis into the spotlight, and he quickly gained a large following and recognition in the comedy world.\n\nDespite his newfound success, Travis remained humble and down-to-earth, always making time for his friends and family. He eventually enrolled in a performing arts program at a prestigious university, where he continued to hone his craft and make a name for himself in the comedy industry.\n\nNow at 18 years old, Travis has a high school degree and a promising career ahead of him. His Instagram and lifestyle continue to reflect his love for comedy and adventure, and he is determined to make people laugh and inspire others to pursue their passions."}
{"Name":"Traci Griffin","Age":38,"Sex":"female","Country of Origin":"USA","State or Province":"New York","Education Level":"High School","MBTI Personality":"ESFJ","Lifestyle":"parenting","Backstory":"Traci Griffin was born and raised in New York City, the only child of a hardworking single mother. Growing up in a small apartment in the bustling city, Traci quickly learned the value of independence and self-reliance. Despite the challenges they faced, Traci's mother always instilled in her the importance of education and hard work.\n\nAs a student, Traci was always a dedicated and driven individual. She excelled in her studies and was determined to make the most out of her education. After graduating high school with top honors, Traci went on to attend a local community college, where she earned her degree in early childhood education.\n\nWith her passion for working with children, Traci quickly found a job as a preschool teacher in the heart of New York City. Her kind and nurturing nature made her a favorite among her students and their parents. Traci loved her job and found great joy in helping shape the minds of young children.\n\nAt the age of 25, Traci met the love of her life, Mark, a fellow teacher at the preschool. They shared a love for teaching and a strong connection that quickly blossomed into a relationship. Two years later, they tied the knot in a beautiful ceremony surrounded by their family and friends.\n\nTraci and Mark's marriage was a happy and loving one, but they faced challenges when they struggled to conceive a child. After years of trying, they were blessed with a beautiful baby girl, Lily. Becoming a mother was a dream come true for Traci, and she embraced her new role with all her heart.\n\nAs Lily grew, Traci's passion for parenting only grew stronger. She found herself constantly seeking advice and tips from other parents and sharing her own experiences on social media. Traci's Instagram quickly became a platform for her to connect with other parents and share her journey of motherhood.\n\nNow, at 38 years old, Traci is a proud mother of two, with her son Max joining the family just two years ago. She continues to work as a preschool teacher, but her true passion lies in her role as a mother and sharing her knowledge and experiences with others. Traci's average appearance and face may not stand out in a crowd, but her kind heart and supportive nature make her stand out in the lives of those around her."}
{"Name":"Rebecca Fisher","Age":28,"Sex":"female","Country of Origin":"USA","State or Province":"Virginia","Education Level":"High School","MBTI Personality":"ENFP","Lifestyle":"music","Backstory":"Rebecca Fisher was born and raised in a small town in Virginia, USA. Growing up, she was always surrounded by music, as her parents were both musicians in a local band. From a young age, Rebecca was drawn to the beat and rhythm of the music, and it quickly became her passion.\n\nDespite her love for music, Rebecca was a shy and introverted child. She struggled to find her voice and express herself, until she discovered the power of music. It became her outlet, her way of communicating and connecting with others.\n\nIn high school, Rebecca's love for music only grew stronger. She joined the school choir and started taking guitar lessons. Her natural talent and dedication quickly caught the attention of her music teacher, who encouraged her to pursue a career in music.\n\nAfter graduating from high school, Rebecca decided to take a gap year to travel and explore different cultures and music styles. She backpacked through Europe, immersing herself in the local music scenes and learning from different musicians.\n\nWhen she returned to the States, Rebecca enrolled in a music program at a local community college. She honed her skills and expanded her knowledge of music theory, while also performing at local open mic nights and small gigs.\n\nBut it wasn't until Rebecca discovered Instagram that her music truly took off. She started sharing snippets of her performances and original songs on the platform, and her unique and vibrant style quickly gained a following. People were drawn to her energetic and authentic performances, and her Instagram became a hub for music lovers and aspiring musicians.\n\nNow, at 28 years old, Rebecca has established herself as a musician and influencer. She continues to perform at local venues and festivals, while also collaborating with other artists and creating her own music. Her Instagram has become a platform for her to share her passion for music and inspire others to pursue their dreams.\n\nRebecca's journey has not been without its challenges, but she has always stayed true to herself and her love for music. She may have a slightly above average appearance, but her talent and passion for music are what truly make her stand out. And as she continues to grow and evolve as an artist, Rebecca Fisher is determined to use her platform to spread joy and positivity through her music."}
{"Name":"Megan Webster","Age":24,"Sex":"female","Country of Origin":"USA","State or Province":"Georgia","Education Level":"Bachelor","MBTI Personality":"ISFP","Lifestyle":"gardening","Backstory":"Megan Webster was born and raised in a small town in Georgia, USA. Growing up, she was always surrounded by nature and developed a love for plants and flowers at a young age. Her parents were avid gardeners and taught her the importance of caring for the environment and the beauty of creating a flourishing garden.\n\nAs she grew older, Megan's passion for gardening only grew stronger. She spent countless hours in her family's backyard, tending to the plants and experimenting with different techniques to make them thrive. Her love for nature and creativity also extended to other forms of art, such as painting and photography.\n\nDespite her love for gardening and art, Megan's parents always encouraged her to pursue a more traditional career path. So, after graduating high school, she decided to attend a prestigious university in Georgia and pursue a degree in business. While she excelled in her studies, Megan couldn't shake off her love for gardening and art.\n\nDuring her senior year, Megan decided to take a few elective courses in horticulture and art, which reignited her passion for both. She found solace in the peacefulness of gardening and the freedom of expression in art. After much contemplation, Megan made the bold decision to switch her major to horticulture and minor in art.\n\nAfter graduating with a Bachelor's degree in horticulture, Megan moved back to her hometown in Georgia and started her own gardening business. She used her artistic abilities to create unique and beautiful landscapes for her clients, and her business quickly gained popularity in the community.\n\nIn her free time, Megan enjoyed documenting her gardening journey on Instagram, sharing tips and tricks with her followers, and showcasing her beautiful creations. Her Instagram quickly gained a large following, and she became known as the \"Garden Queen\" in her town.\n\nMegan's adaptability and open-mindedness also led her to explore different gardening techniques and incorporate them into her own style. She loved experimenting with different plants and creating stunning combinations that caught the eye of many.\n\nNow, at 24 years old, Megan is a successful business owner and influencer, inspiring others to find joy and beauty in gardening. She continues to expand her knowledge and skills in horticulture and art, always looking for new ways to express her creativity and share her love for nature with the world. With her high beauty and high face, Megan's Instagram and lifestyle reflect her passion for gardening and her vibrant personality."}
{"Name":"Joseph Woods","Age":26,"Sex":"male","Country of Origin":"USA","State or Province":"Illinois","Education Level":"High School","MBTI Personality":"ESTP","Lifestyle":"sports","Backstory":"Joseph Woods was born and raised in the bustling city of Chicago, Illinois. He grew up in a middle-class family with his parents and two younger siblings. From a young age, Joseph showed a natural talent and love for sports, particularly basketball and football.\n\nAs he entered high school, Joseph joined the school's basketball and football teams, quickly becoming a star player and gaining recognition from his peers and coaches. He was known for his athleticism, determination, and leadership skills on the field and court.\n\nDespite his love for sports, Joseph also excelled academically. He maintained good grades throughout high school and graduated with a high school degree, earning a scholarship to play basketball at a prestigious university.\n\nDuring his college years, Joseph's passion for sports only grew stronger. He became a key player on the university's basketball team, leading them to several championship wins. But it wasn't just his skills on the court that made Joseph stand out. He also had a natural charisma and charm that drew people to him.\n\nAfter graduating from college, Joseph returned to Chicago, where he landed a job as a sports analyst for a local news station. He quickly became a fan favorite, known for his in-depth knowledge of the game and his charismatic on-screen presence.\n\nOutside of work, Joseph's Instagram and lifestyle reflected his passion for sports and his love for life. He was always up for a new adventure, whether it was trying a new extreme sport or exploring a new city. His posts were filled with high-energy activities and spontaneous moments, inspiring others to live life to the fullest.\n\nAt 26 years old, Joseph had achieved success in both his personal and professional life. He had a strong support system of family and friends who admired his drive and determination. With his slightly above average beauty and face, Joseph was a natural charmer, making him a popular figure in the sports world and beyond. He continues to inspire others with his zest for life and his unwavering passion for sports."}
{"Name":"Melinda Walls","Age":22,"Sex":"female","Country of Origin":"USA","State or Province":"Virginia","Education Level":"High School","MBTI Personality":"ISFJ","Lifestyle":"beauty","Backstory":"Melinda Walls was born and raised in the small town of Charlottesville, Virginia. Growing up, she was always fascinated by the world of beauty and makeup. Her mother, a cosmetologist, would often let Melinda play with her makeup and teach her different techniques. It was during these moments that Melinda discovered her passion for all things beauty.\n\nAs she grew older, Melinda's love for makeup only intensified. She would spend hours watching makeup tutorials on YouTube and experimenting with different looks on herself and her friends. Her skills and creativity were evident from a young age, and it wasn't long before she started receiving compliments and requests from people to do their makeup for special occasions.\n\nDespite her love for makeup, Melinda's parents always emphasized the importance of education. So, after graduating from high school, she decided to pursue a degree in business administration at the University of Virginia. While she enjoyed her studies, her heart was always drawn towards the world of beauty.\n\nDuring her sophomore year, Melinda started her own Instagram page where she would share her makeup looks and beauty tips. To her surprise, her page gained a significant following, and she soon became a social media sensation in her small town. Her followers were not only impressed by her makeup skills but also by her warm and caring personality.\n\nAfter graduating from college, Melinda faced a tough decision \u2013 pursue a career in business or follow her passion for beauty. With the support of her family and friends, she took a leap of faith and decided to turn her love for makeup into a career. She started by offering makeup services for weddings and events, and her business quickly grew through word of mouth.\n\nToday, at 22 years old, Melinda is a successful makeup artist with her own studio in Charlottesville. Her Instagram page has thousands of followers, and she regularly collaborates with well-known beauty brands. Despite her success, Melinda remains humble and grateful for the support she has received from her followers and clients. She continues to use her platform to spread positivity and promote self-love through her passion for beauty."}
{"Name":"James Hall","Age":23,"Sex":"male","Country of Origin":"Canada","State or Province":"Alberta","Education Level":"Bachelor","MBTI Personality":"ENTJ","Lifestyle":"tech","Backstory":"James Hall was born and raised in the picturesque province of Alberta, Canada. Growing up, he was always fascinated by technology and the endless possibilities it held. His parents were both engineers, and they instilled in him a love for science and innovation from a young age. James was a natural problem solver and had a keen eye for detail, which made him stand out among his peers.\n\nAs he grew older, James became more and more interested in the world of technology and its ever-evolving landscape. He spent countless hours tinkering with computers and building his own gadgets, much to the amazement of his friends and family. His passion for all things tech only intensified as he entered high school, where he excelled in math and science classes.\n\nUpon graduating, James knew that he wanted to pursue a career in the tech industry. He enrolled in a prestigious university and earned a Bachelor's degree in Computer Science. During his time in college, he became known for his exceptional beauty and exceptional face, which garnered him attention from both his peers and professors.\n\nBut it wasn't just his looks that made James stand out. He had a natural ability to lead and strategize, which he showcased in various group projects and extracurricular activities. His classmates often turned to him for guidance, and he was always willing to lend a helping hand.\n\nAfter graduating, James landed a job at a top tech company in Silicon Valley, California. He quickly rose through the ranks and became a key player in the company's success. But despite his busy schedule, James always made time for his passion for tech. He started an Instagram account to share his knowledge and insights with others, and it quickly gained a large following.\n\nJames' posts on Instagram reflect his strong presence and focus on achieving goals. He is always pushing himself to learn and grow, and his followers admire his dedication and drive. Through his posts, he hopes to inspire others to pursue their passions and reach their full potential.\n\nNow, at 23 years old, James continues to thrive in the tech industry and is considered a rising star in the field. He remains humble and grounded, grateful for the opportunities that have come his way. With his exceptional beauty and exceptional mind, James is determined to make a lasting impact in the world of technology and inspire others to do the same."}
{"Name":"Wendy Freeman","Age":24,"Sex":"female","Country of Origin":"USA","State or Province":"California","Education Level":"High School","MBTI Personality":"ENFP","Lifestyle":"fashion","Backstory":"Wendy Freeman was born and raised in sunny California, USA. She was the youngest of three siblings and grew up in a loving and supportive family. From a young age, Wendy showed a natural talent and interest in fashion. She would spend hours playing dress-up and putting together outfits from her mother's closet.\n\nAs she got older, Wendy's love for fashion only grew stronger. She would spend her weekends scouring thrift stores and flea markets, looking for unique pieces to add to her wardrobe. Her friends and family were always amazed by her ability to put together stylish and trendy outfits on a budget.\n\nDespite her passion for fashion, Wendy was also a dedicated student. She excelled in her high school classes and graduated with top honors. However, she knew that college was not the right path for her. Instead, she decided to pursue her dream of becoming a fashion influencer.\n\nAt the age of 18, Wendy created her own fashion blog and Instagram account, where she shared her outfits, styling tips, and fashion inspiration. Her unique sense of style and bubbly personality quickly gained her a following, and before she knew it, she had thousands of loyal followers.\n\nWendy's Instagram and lifestyle reflected her love for fashion and adventure. She would often travel to different cities and countries, exploring new cultures and incorporating them into her fashion sense. Her creativity and optimism were evident in every post, and her followers loved her for it.\n\nNow, at the age of 24, Wendy has established herself as a successful fashion influencer. She has collaborated with numerous brands and has even launched her own clothing line. Despite her success, she remains humble and down-to-earth, always using her platform to spread positivity and inspire others to follow their passions.\n\nWith her slightly above average beauty and face, Wendy continues to inspire and empower others through her fashion and lifestyle choices. She is proof that with determination and hard work, anyone can turn their dreams into reality."}
{"Name":"Yvonne Acosta","Age":29,"Sex":"female","Country of Origin":"USA","State or Province":"Pennsylvania","Education Level":"Bachelor","MBTI Personality":"INTJ","Lifestyle":"psychology","Backstory":"Yvonne Acosta was born and raised in a small town in Pennsylvania, USA. Her parents were both hardworking immigrants from Mexico who instilled in her the value of education and determination. From a young age, Yvonne showed a natural curiosity and interest in the human mind, often asking thought-provoking questions and observing people's behaviors.\n\nAs she grew older, Yvonne's passion for psychology only intensified. She excelled in her studies and graduated at the top of her high school class. With the support of her family, she went on to pursue a Bachelor's degree in Psychology at a prestigious university.\n\nDuring her time in college, Yvonne immersed herself in her studies, eager to learn as much as she could about the complexities of the human mind. She also took on various internships and research opportunities, gaining hands-on experience in the field.\n\nAfter graduating with honors, Yvonne landed a job at a renowned psychology firm in the city. Her strategic thinking and innovative ideas quickly caught the attention of her colleagues and superiors. She became known for her ability to come up with long-term plans and solutions to complex problems.\n\nOutside of work, Yvonne's love for psychology spilled over into her personal life. She started an Instagram account where she shared her insights and knowledge about the subject. Her content was well-received, and she gained a following of people who were interested in her unique perspective.\n\nDespite her busy schedule, Yvonne always made time for self-care and maintaining a healthy lifestyle. She believed that taking care of her mind and body was crucial in her line of work. Her appearance was described as slightly above average, but it was her intelligence and confidence that made her stand out.\n\nNow, at 29 years old, Yvonne is a successful and respected psychologist. She continues to inspire others with her passion for psychology and her dedication to helping people understand themselves better. Her future plans include opening her own practice and writing a book on her experiences in the field. Yvonne's journey is a testament to the power of hard work, determination, and a love for learning."}
{"Name":"Ashley Parks","Age":28,"Sex":"female","Country of Origin":"USA","State or Province":"New York","Education Level":"High School","MBTI Personality":"INFJ","Lifestyle":"psychology","Backstory":"Ashley Parks was born and raised in New York City, the youngest of three siblings. Growing up, she was always a curious and empathetic child, often trying to understand the emotions and behaviors of those around her. Her parents, both successful lawyers, instilled in her a love for learning and encouraged her to pursue her passions.\n\nIn high school, Ashley excelled in her psychology classes and found herself drawn to the subject more and more. She was fascinated by the inner workings of the human mind and the complexities of human behavior. Despite her parents' expectations for her to follow in their footsteps and become a lawyer, Ashley knew that her true calling was in psychology.\n\nAfter graduating from high school, Ashley decided to pursue a degree in psychology at a local university. She worked hard and graduated with top honors, determined to make a difference in the world through her knowledge of the human mind.\n\nAfter college, Ashley started working at a mental health clinic, where she gained hands-on experience in the field of psychology. She quickly became known for her intuitive nature and ability to connect with her patients on a deeper level. Her colleagues and superiors were impressed by her dedication and passion for her work.\n\nOutside of her job, Ashley's love for psychology spilled over into her personal life. She started a blog and Instagram account, sharing her insights and thoughts on various psychological topics. Her posts and content quickly gained a following, and she became known as a go-to source for all things related to psychology.\n\nAs her online presence grew, so did her desire to further her education. Ashley decided to pursue a Master's degree in clinical psychology, with a focus on trauma and addiction. She wanted to use her knowledge and skills to help those who were struggling with mental health issues.\n\nNow, at 28 years old, Ashley is a successful therapist, helping her clients navigate through their emotional struggles and find healing. Her Instagram and lifestyle reflect her passion for psychology, and she continues to share her insights and knowledge with her followers. With her slightly above average beauty and face, Ashley uses her platform to break the stigma surrounding mental health and promote self-care and self-love. She is determined to make a positive impact on the world, one person at a time."}
{"Name":"Jonathan Robinson","Age":19,"Sex":"male","Country of Origin":"USA","State or Province":"Pennsylvania","Education Level":"High School","MBTI Personality":"ENTJ","Lifestyle":"economics","Backstory":"Jonathan Robinson was born and raised in a small town in Pennsylvania, USA. He was the only child of a hardworking couple who instilled in him the value of education and ambition. From a young age, Jonathan showed a natural aptitude for numbers and a keen interest in economics.\n\nAs he grew older, Jonathan's passion for economics only intensified. He devoured books on the subject and spent countless hours analyzing financial data and market trends. His high school teachers were impressed by his intelligence and determination, and it was no surprise when he graduated at the top of his class.\n\nDespite his academic success, Jonathan didn't have many friends in high school. He was often seen as aloof and distant, more interested in studying than socializing. But deep down, Jonathan longed for connection and companionship. He found solace in his online community, where he could engage in thought-provoking discussions about economics and leadership.\n\nAfter graduating, Jonathan was accepted into a prestigious university to study economics. However, his parents couldn't afford the tuition, and Jonathan didn't want to burden them with student loans. So, he made the difficult decision to decline the offer and instead enrolled in a local community college.\n\nWhile attending community college, Jonathan worked part-time at a local bank, gaining valuable experience in the world of finance. He also continued to expand his knowledge through online courses and self-study. His dedication and hard work paid off when he was offered a scholarship to transfer to a top university, where he could finally pursue his dream of studying economics.\n\nNow, at 19 years old, Jonathan is in his second year of university, majoring in economics with a minor in leadership. He has become known as the go-to person for financial advice among his peers and has gained a significant following on Instagram for his insightful posts on economics and strategic thinking.\n\nDespite his busy schedule, Jonathan still finds time to connect with his online community and engage in meaningful discussions. He hopes to one day use his knowledge and skills to make a positive impact on the world, whether it be through his career or by mentoring others in the field of economics.\n\nWith his above average looks and commanding presence, Jonathan may seem intimidating at first, but those who get to know him see a kind and driven individual with a passion for making a difference. And as he continues to chase his dreams, Jonathan Robinson's future looks bright and full of endless possibilities."}
{"Name":"Melissa Mack","Age":22,"Sex":"female","Country of Origin":"Canada","State or Province":"Newfoundland and Labrador","Education Level":"High School","MBTI Personality":"ESFJ","Lifestyle":"parenting","Backstory":"Melissa Mack was born and raised in the small coastal town of St. John's, Newfoundland and Labrador. Growing up, she was always known for her kind and caring nature, and her parents often joked that she had a natural talent for motherhood even at a young age.\n\nAs the oldest of four siblings, Melissa took on a lot of responsibility in helping to raise her younger brothers and sisters. She was always the one to soothe their tears, play with them, and teach them new things. Her parents were hardworking and often busy, so Melissa took it upon herself to make sure her siblings were well taken care of.\n\nDespite her natural nurturing abilities, Melissa struggled in school. She had a hard time focusing and often felt overwhelmed by the pressure to succeed. However, she never gave up and graduated high school with a degree in hand.\n\nAfter graduation, Melissa decided to take a break from school and focus on her passion for parenting. She had always dreamed of having a big family of her own and wanted to gain more experience before pursuing a career. She took on various babysitting and nanny jobs, and quickly became known as the go-to person for parents in the community.\n\nMelissa's love for children and her caring nature didn't go unnoticed on social media. She started an Instagram account where she shared her experiences and tips on parenting. Her posts quickly gained a following, and she became known as a parenting influencer in her small town.\n\nAs her following grew, so did her confidence in herself. Melissa realized that she had a talent for connecting with people and helping them feel supported and understood. She used her platform to spread positivity and promote a harmonious lifestyle, which resonated with her followers.\n\nNow, at 22 years old, Melissa continues to inspire and support parents through her social media presence. She has also started taking online courses in child development and hopes to one day open her own daycare center. Melissa's passion for parenting has not only shaped her life but has also touched the lives of many others, making her a beloved and respected member of her community."}
{"Name":"Rebecca Knapp","Age":20,"Sex":"female","Country of Origin":"USA","State or Province":"New Jersey","Education Level":"No High School","MBTI Personality":"ISFJ","Lifestyle":"astrology","Backstory":"Rebecca Knapp was born and raised in a small town in New Jersey, USA. She grew up in a loving and supportive family, but even from a young age, she always felt like she didn't quite fit in. While her classmates were more interested in sports and parties, Rebecca was always fascinated by the stars and the mysteries of the universe.\n\nAs she got older, Rebecca's love for astrology only grew stronger. She spent countless hours studying and learning about the different zodiac signs, planetary alignments, and the impact they have on our lives. Her family and friends didn't quite understand her obsession, but it didn't stop her from diving deeper into her passion.\n\nHowever, things took a turn for the worse when Rebecca's parents divorced during her freshman year of high school. The sudden change in her family dynamic left her feeling lost and alone. She started skipping school and eventually dropped out, unable to cope with the emotional turmoil.\n\nWith no high school degree, Rebecca struggled to find a job and felt like she was falling behind in life. But she refused to let her circumstances define her. She turned to social media as an outlet to express her love for astrology and share her knowledge with others. To her surprise, her posts gained a lot of attention and she quickly gained a following of like-minded individuals who were drawn to her authenticity and passion.\n\nRebecca's online presence became her sanctuary and she found solace in connecting with others who shared her interests. Through her interactions with her followers, she discovered her natural talent for offering guidance and support to those in need. Her caring nature and intuitive insights earned her a reputation as a trusted confidant and friend.\n\nNow at 20 years old, Rebecca has embraced her role as an astrologer and influencer. She may not have a traditional education, but her knowledge and wisdom in the realm of astrology have gained her respect and recognition in the online community. She continues to share her insights and inspire others to embrace their true selves, just as she has done."}
{"Name":"Monica Le","Age":19,"Sex":"female","Country of Origin":"USA","State or Province":"California","Education Level":"High School","MBTI Personality":"INTP","Lifestyle":"philosophy","Backstory":"Monica Le was born and raised in the sunny state of California, USA. Growing up in a middle-class family, she was always encouraged to pursue her interests and passions. From a young age, Monica showed a keen interest in the world around her, constantly questioning and seeking answers to life's big questions.\n\nAs a child, Monica was always drawn to books and loved to spend hours lost in the pages of philosophical texts. She was fascinated by the concepts of existence, morality, and the human condition. Her parents, both avid readers themselves, nurtured her love for philosophy and encouraged her to explore different perspectives and ideologies.\n\nIn high school, Monica excelled academically and was known for her thought-provoking discussions in class. She was also a natural leader and was involved in various extracurricular activities, such as debate club and student government. Despite her busy schedule, Monica always found time to read and expand her knowledge in the field of philosophy.\n\nAfter graduating high school with top honors, Monica decided to take a gap year before pursuing higher education. During this time, she traveled to different countries, immersing herself in different cultures and gaining a deeper understanding of the world. She also used this time to further her studies in philosophy, attending lectures and seminars by renowned philosophers.\n\nIt was during this gap year that Monica's passion for philosophy truly blossomed. She started sharing her thoughts and ideas on social media, particularly on Instagram, where she quickly gained a following of like-minded individuals. Her posts were not just about deep philosophical concepts, but also about applying them to everyday life. She believed that philosophy was not just a subject to be studied, but a way of life.\n\nNow, at 19 years old, Monica has earned a reputation as a young philosopher with a unique perspective. Her Instagram feed is a mix of aesthetically pleasing photos and thought-provoking captions that challenge societal norms and encourage critical thinking. She has also started her own blog, where she shares longer essays and engages in discussions with her readers.\n\nMonica's appearance is often described as above average, but she pays little attention to it. For her, true beauty lies in the mind and soul, and she strives to embody this belief in her everyday life.\n\nAs she prepares to start college, Monica is excited to continue her journey of exploration and discovery. She hopes to major in philosophy and use her platform to spread the importance of critical thinking and self-reflection. With her intelligence, beauty, and passion for philosophy, Monica is determined to make a positive impact on the world and inspire others to do the same."}
{"Name":"Gabriel Baker","Age":30,"Sex":"male","Country of Origin":"USA","State or Province":"New York","Education Level":"Master","MBTI Personality":"ENTJ","Lifestyle":"economics","Backstory":"Gabriel Baker was born and raised in New York City, the eldest son of a successful businessman and a prominent lawyer. From a young age, Gabriel was exposed to the fast-paced world of finance and economics, and it quickly became his passion. He was always fascinated by the intricate workings of the stock market and the power of numbers to predict and influence the economy.\n\nAs a child, Gabriel excelled in math and was always top of his class. He was a natural leader and had a knack for strategizing and problem-solving. His parents recognized his potential and encouraged him to pursue a career in economics. Gabriel took their advice and enrolled in one of the top universities in New York, where he majored in Economics and graduated with top honors.\n\nAfter completing his undergraduate degree, Gabriel decided to further his education and pursue a Master's degree in Economics. He was determined to gain a deeper understanding of the global economy and become a leader in the field. His hard work and dedication paid off, and he graduated at the top of his class once again.\n\nWith his impressive academic background, Gabriel was quickly recruited by a prestigious financial firm in New York City. He rose through the ranks quickly, earning a reputation as a brilliant economist and a natural leader. His strategic thinking and ability to predict market trends made him a valuable asset to the company.\n\nOutside of work, Gabriel's Instagram and lifestyle reflect his passion for economics. He often posts about the latest economic news and offers his insights on various market trends. His posts exhibit a strong presence and a focus on achieving goals, reflecting his natural ability to lead and strategize.\n\nDespite his success, Gabriel remains humble and grounded. He is always willing to share his knowledge and mentor young economists. He is also actively involved in various philanthropic causes, using his expertise to make a positive impact on the world.\n\nAt 30 years old, Gabriel Baker has already achieved more than most people his age. But he is always hungry for more knowledge and success, constantly setting new goals and striving to reach greater heights in his career. With his intelligence, drive, and natural leadership abilities, there is no doubt that Gabriel will continue to make a significant impact in the world of economics."}
{"Name":"Danielle Jimenez","Age":26,"Sex":"female","Country of Origin":"USA","State or Province":"Maryland","Education Level":"High School","MBTI Personality":"INTP","Lifestyle":"travel","Backstory":"Danielle Jimenez was born and raised in a small town in Maryland, USA. Growing up, she was always curious and had a thirst for knowledge. Her parents, both teachers, instilled in her a love for learning and encouraged her to pursue her interests.\n\nIn high school, Danielle excelled in her academics and was known as the go-to person for help with math and science. She was also a member of the debate team and often won competitions with her logical arguments and analytical skills. Despite her academic success, Danielle always felt a bit out of place in her small town. She longed to see more of the world and experience different cultures.\n\nAfter graduating high school, Danielle decided to take a gap year to travel. She backpacked through Europe, immersing herself in the history and culture of each country she visited. It was during this trip that she discovered her love for photography and documenting her travels on social media.\n\nUpon returning to the US, Danielle enrolled in a local community college to study photography and journalism. She used her gap year experiences as inspiration for her projects and quickly gained recognition for her work. Her Instagram account, filled with stunning photos and thoughtful captions, gained a large following and caught the attention of travel companies and publications.\n\nAfter obtaining her associate's degree, Danielle transferred to a university to study international relations and political science. She was determined to make a difference in the world and believed that understanding different cultures and global issues was the first step. Her academic pursuits and love for travel continued to go hand in hand, as she often used her breaks to explore new destinations and gain a deeper understanding of the world.\n\nNow, at 26 years old, Danielle has graduated with a degree in international relations and is working for a non-profit organization that focuses on promoting cultural exchange and understanding. She continues to travel whenever she can, using her platform to share her experiences and promote the importance of global awareness and empathy.\n\nDanielle's beauty and intellect often catch people off guard, but she doesn't let it define her. She is humble and down to earth, always eager to learn and share her knowledge with others. Her love for logical analysis and theoretical exploration has not wavered, and she uses it to approach every aspect of her life. As she continues to make her mark on the world, Danielle remains true to herself and her passion for travel, always seeking new adventures and opportunities to learn and grow."}
{"Name":"Mason Johnston","Age":30,"Sex":"male","Country of Origin":"Canada","State or Province":"Ontario","Education Level":"Bachelor","MBTI Personality":"ENTJ","Lifestyle":"history","Backstory":"Mason Johnston was born and raised in the bustling city of Toronto, Ontario. From a young age, he was always fascinated by history and spent countless hours reading books and visiting museums. His parents, both avid travelers, nurtured his love for learning about different cultures and civilizations.\n\nAs he grew older, Mason's passion for history only intensified. He excelled in his history classes throughout high school and went on to pursue a Bachelor's degree in History at the University of Toronto. During his time there, he became known for his sharp mind and natural leadership skills.\n\nAfter graduating with top honors, Mason landed a job at a prestigious museum in Toronto. He quickly rose through the ranks, becoming the youngest curator in the museum's history. His colleagues and superiors were impressed by his ability to strategize and lead projects, which resulted in record-breaking attendance and revenue for the museum.\n\nOutside of work, Mason's love for history spilled over into his personal life. He was an avid traveler, often taking trips to explore ancient ruins and historical sites around the world. His Instagram feed was filled with stunning photos of his adventures, and his followers were constantly in awe of his ability to bring history to life.\n\nAt 30 years old, Mason's appearance was often described as strikingly handsome, with sharp features and a strong jawline. But it was his intelligence and passion for history that truly made him stand out. He had a commanding presence and a natural charisma that drew people to him.\n\nDespite his success, Mason remained humble and grounded. He never forgot his roots and was always eager to share his knowledge and love for history with others. As he continued to make a name for himself in the world of history, Mason's ultimate goal was to inspire others to appreciate the past and learn from it."}
{"Name":"Briana Williams","Age":25,"Sex":"female","Country of Origin":"USA","State or Province":"New York","Education Level":"Bachelor","MBTI Personality":"ESFJ","Lifestyle":"beauty","Backstory":"Briana Williams was born and raised in the bustling city of New York. She was the only child of a single mother who worked hard to provide for them both. Growing up, Briana was always drawn to the world of beauty and fashion. She loved experimenting with different makeup looks and trying out new hairstyles.\n\nDespite her passion for beauty, Briana was also a dedicated student. She excelled in school and graduated with top honors from high school. With the support of her mother, she went on to attend a prestigious university in New York City, where she earned a Bachelor's degree in Marketing.\n\nAfter graduation, Briana landed a job at a top advertising agency in the city. She quickly climbed the corporate ladder and became known for her creativity and innovative ideas. However, as she climbed higher in her career, she realized that her true passion lay in the world of beauty.\n\nBriana decided to take a leap of faith and left her job to pursue her dream of becoming a beauty influencer. She started a blog and Instagram account, where she shared her makeup tutorials, beauty tips, and product reviews. Her content quickly gained a following, and soon she was collaborating with top beauty brands and attending exclusive events.\n\nAside from her love for beauty, Briana's posts also reflected her commitment to nurturing relationships and creating a supportive community atmosphere. She used her platform to promote self-love and confidence and to encourage her followers to embrace their unique beauty.\n\nAt 25 years old, Briana has become a successful beauty influencer, with a loyal following and a thriving career. She continues to inspire others with her passion for beauty and her genuine personality. Through her work, she hopes to empower others to feel confident and beautiful in their own skin."}
{"Name":"Jeffrey May","Age":27,"Sex":"male","Country of Origin":"USA","State or Province":"New Jersey","Education Level":"Master","MBTI Personality":"ISTJ","Lifestyle":"education","Backstory":"Jeffrey May was born and raised in a small town in New Jersey, USA. From a young age, he showed a natural curiosity and love for learning. His parents, both teachers, instilled in him the importance of education and encouraged him to pursue his interests. As a result, Jeffrey excelled in school and was always at the top of his class.\n\nAfter graduating high school, Jeffrey decided to attend a prestigious university to further his education. He studied diligently and earned a Master's degree in Education. During his time in college, Jeffrey also discovered his love for photography and started an Instagram account to showcase his work.\n\nUpon graduating, Jeffrey landed a job as a high school history teacher. He was passionate about teaching and dedicated to helping his students succeed. His students often described him as a knowledgeable and caring teacher who always went above and beyond to ensure their success.\n\nOutside of work, Jeffrey's Instagram account gained a large following due to his exceptional photography skills and his inspiring captions about the importance of education. His photos often featured beautiful landscapes and historic sites, which he would tie into educational lessons for his followers.\n\nDespite his busy schedule, Jeffrey always made time for his family and friends. He believed in the value of traditional values and spent quality time with his loved ones, often planning meticulously crafted outings and get-togethers.\n\nJeffrey's exceptional beauty and exceptional face were often the subject of admiration among his peers. However, he remained humble and focused on his passion for education and helping others.\n\nAs he approached his late twenties, Jeffrey's dedication to education and his community had made him a well-respected and admired figure in his town. He continued to inspire and educate others through his work as a teacher and his Instagram presence, always striving to make a positive impact on the world."}
{"Name":"Laurie Serrano DDS","Age":18,"Sex":"female","Country of Origin":"USA","State or Province":"New York","Education Level":"High School","MBTI Personality":"ISTP","Lifestyle":"fitness","Backstory":"Laurie Serrano DDS was born and raised in the bustling city of New York. From a young age, she was always drawn to physical activities and sports, constantly pushing herself to be the best she could be. Her parents, both successful doctors, instilled in her the importance of hard work and dedication.\n\nAs she grew older, Laurie's passion for fitness only intensified. She spent countless hours in the gym, honing her skills and pushing her body to its limits. Her determination and discipline paid off as she became known as one of the top athletes in her high school.\n\nDespite her love for fitness, Laurie also excelled in her academics. She graduated high school with top honors and a strong desire to follow in her parents' footsteps and become a doctor. However, she couldn't shake off her love for fitness and decided to combine her two passions by pursuing a degree in dentistry.\n\nAt the young age of 18, Laurie graduated from high school and was accepted into a prestigious dental program. She was determined to excel in her studies while also maintaining her fitness routine. Her hard work paid off as she graduated top of her class and became a certified dentist at the age of 24.\n\nLaurie's Instagram account reflects her love for fitness and her dedication to leading a healthy lifestyle. She shares her workout routines, healthy meal ideas, and motivational quotes to inspire others to live their best lives. Her stunning appearance and fit physique have also gained her a large following on social media.\n\nAs a dentist, Laurie is known for her skillful handling of tangible tasks and immediate challenges. She takes great pride in her work and is always looking for ways to improve and innovate in her field. Her patients appreciate her gentle demeanor and attention to detail, making her one of the most sought-after dentists in New York.\n\nDespite her busy schedule, Laurie always makes time for her fitness routine, believing that a healthy body leads to a healthy mind. She continues to push herself to be the best version of herself and inspire others to do the same. With her determination and passion, there's no doubt that Laurie Serrano DDS will continue to achieve great success in both her personal and professional life."}
{"Name":"Darin Owens","Age":26,"Sex":"male","Country of Origin":"USA","State or Province":"Iowa","Education Level":"Master","MBTI Personality":"ENTP","Lifestyle":"politics","Backstory":"Darin Owens was born and raised in a small town in Iowa, USA. From a young age, he was always fascinated by politics and current events, often engaging in debates with his family and friends. His parents, both teachers, instilled in him a love for learning and critical thinking, which would shape his future endeavors.\n\nIn high school, Darin was known as the \u201cpolitical junkie\u201d among his peers. He was always up to date on the latest news and had a vast knowledge of political history. His passion for politics only grew stronger as he pursued a Bachelor's degree in Political Science at the University of Iowa.\n\nDuring his time at university, Darin was actively involved in various political organizations and campaigns. He was a natural leader and quickly rose through the ranks, becoming the president of the College Democrats. His charisma and intelligence made him a well-respected figure on campus.\n\nAfter graduating with top honors, Darin decided to further his education and pursue a Master's degree in Political Science. He was accepted into a prestigious program at Georgetown University in Washington D.C. It was here that Darin truly found his calling. Surrounded by like-minded individuals and immersed in the heart of American politics, he thrived in this environment.\n\nDarin's studies focused on unconventional and radical political theories, which sparked his interest in challenging the status quo. He became known for his unique and thought-provoking ideas, earning him a reputation as an intellectual and a rebel.\n\nAs he completed his Master's degree, Darin's passion for politics only continued to grow. He started a blog and created an Instagram account to share his thoughts and ideas with a wider audience. His striking appearance and sharp intellect quickly gained him a large following, and he became somewhat of an influencer in the political sphere.\n\nNow, at 26 years old, Darin is a force to be reckoned with in the world of politics. He uses his platform to advocate for change and challenge traditional beliefs. He continues to push the boundaries and inspire others to think critically about the world around them. With his master's degree in hand and a bright future ahead, Darin Owens is poised to make a significant impact on the political landscape of the United States."}
{"Name":"Barbara Fleming","Age":33,"Sex":"female","Country of Origin":"USA","State or Province":"Colorado","Education Level":"Master","MBTI Personality":"ISFJ","Lifestyle":"psychology","Backstory":"Barbara Fleming was born and raised in the beautiful state of Colorado, USA. From a young age, she was always fascinated by the intricacies of the human mind and behavior. Growing up in a small town, she would often spend hours observing people and trying to understand their thoughts and emotions.\n\nAs she got older, Barbara's passion for psychology only grew stronger. She excelled in school and was determined to pursue a career in the field. After graduating high school, she attended the University of Colorado, where she obtained her Bachelor's degree in Psychology. During her time in college, she also volunteered at a local mental health clinic, gaining hands-on experience and further solidifying her passion for helping others.\n\nAfter completing her undergraduate studies, Barbara decided to continue her education and pursue a Master's degree in Psychology. She worked tirelessly, juggling classes and internships, and finally earned her degree with top honors.\n\nWith her Master's degree in hand, Barbara was ready to make a difference in the world. She landed a job as a therapist at a prestigious counseling center in Denver, where she quickly gained a reputation for her caring and empathetic nature. She was known for going above and beyond for her clients, always making them feel heard and understood.\n\nOutside of her work, Barbara's love for psychology spilled over into her personal life. She started a blog and Instagram account, where she shared her knowledge and insights on various mental health topics. Her posts were always well-researched and relatable, and she gained a following of people who looked to her for guidance and support.\n\nDespite her success, Barbara remained humble and down-to-earth. She was described as having average beauty and an average face, but her warm and caring personality made her stand out. She used her platform to spread awareness and break the stigma surrounding mental health, and her followers admired her for it.\n\nAt 33 years old, Barbara continues to make a positive impact in the field of psychology. She is dedicated to helping others and uses her knowledge and expertise to make the world a better place, one person at a time."}
{"Name":"Marissa Simmons","Age":26,"Sex":"female","Country of Origin":"USA","State or Province":"Florida","Education Level":"Bachelor","MBTI Personality":"ESFJ","Lifestyle":"fashion","Backstory":"Marissa Simmons was born and raised in the sunny state of Florida, USA. She was the youngest of three siblings and always had a love for fashion and beauty from a young age. Her parents, both successful lawyers, instilled in her the importance of education and hard work. Marissa excelled in school and was determined to make something of herself.\n\nAfter graduating high school, Marissa attended the University of Florida where she pursued a degree in Fashion Merchandising. She was always drawn to the creative aspect of the fashion industry and knew that this was her true passion. Her hard work and dedication paid off when she graduated with honors and landed a job at a top fashion magazine in New York City.\n\nHowever, the fast-paced and cutthroat atmosphere of the city was not for Marissa. She missed the warm weather and laid-back lifestyle of her hometown in Florida. So, after a year in New York, she decided to move back and start her own fashion blog and Instagram page.\n\nMarissa's blog and Instagram quickly gained a following as she shared her unique fashion sense and beauty tips. Her stunning looks and charismatic personality made her stand out among other influencers. People were drawn to her not only for her fashion sense but also for her genuine and supportive nature.\n\nDespite her success, Marissa remained humble and down-to-earth. She used her platform to spread positivity and inspire others to follow their dreams. Her posts often reflected her commitment to nurturing relationships and creating a supportive community atmosphere.\n\nNow, at 26 years old, Marissa has established herself as a successful fashion influencer and entrepreneur. She continues to use her platform to spread love and positivity, while also pursuing her dream of launching her own fashion line. Marissa's above average beauty and face may have caught people's attention, but it's her kind heart and passion for fashion that keeps them coming back for more."}
{"Name":"Allison Martin","Age":29,"Sex":"female","Country of Origin":"USA","State or Province":"Arizona","Education Level":"Master","MBTI Personality":"ESTP","Lifestyle":"vlogging","Backstory":"Allison Martin was born and raised in the sunny state of Arizona, USA. Growing up, she was always a curious and outgoing child, constantly seeking new experiences and adventures. Her parents, both successful business owners, instilled in her a strong work ethic and a drive to succeed.\n\nAs she got older, Allison's thirst for knowledge and love for travel led her to pursue a Bachelor's degree in Communications at Arizona State University. During her time there, she discovered a passion for videography and vlogging, using her skills to document her travels and share her experiences with the world.\n\nAfter graduating with top honors, Allison decided to further her education and enrolled in a Master's program in Digital Media at the University of Arizona. It was during this time that she honed her vlogging skills and became an expert in social media marketing.\n\nUpon completing her Master's degree, Allison landed a job at a prestigious media company in Los Angeles, California. She quickly made a name for herself as a talented and innovative content creator, and her vlogs gained a large following on social media.\n\nDespite her success, Allison always felt a pull towards her hometown of Arizona. She missed the warm weather, laid-back lifestyle, and the beautiful desert landscapes. So, after three years in LA, she made the bold decision to leave her job and move back home.\n\nWith her newfound free time, Allison focused on growing her personal brand and expanding her vlogging career. She started sharing more about her daily life, showcasing her love for hiking, rock climbing, and other high-energy activities. Her posts caught the attention of many, and she gained a loyal following of people who were inspired by her zest for life.\n\nToday, at 29 years old, Allison is a successful vlogger and social media influencer, living her dream life in Arizona. She continues to travel and document her adventures, all while inspiring others to live life to the fullest. With her slightly above average beauty and infectious energy, Allison has become a role model for many, proving that with hard work and determination, anything is possible."}
{"Name":"Kristin Frazier","Age":27,"Sex":"female","Country of Origin":"USA","State or Province":"Missouri","Education Level":"Master","MBTI Personality":"ENTJ","Lifestyle":"parenting","Backstory":"Kristin Frazier was born and raised in a small town in Missouri, USA. From a young age, she was always known for her intelligence and drive. Her parents, both successful business owners, instilled in her the importance of hard work and determination. Growing up, Kristin was always involved in various extracurricular activities, excelling in academics, sports, and leadership roles.\n\nAfter graduating from high school, Kristin attended a prestigious university where she pursued a degree in Business Management. She was determined to follow in her parents' footsteps and become a successful business owner herself. During her time in college, Kristin also discovered her love for parenting, as she volunteered at a local daycare center and mentored younger students.\n\nUpon graduating with top honors, Kristin landed a job at a well-known corporation where she quickly climbed the ranks and became a manager at the young age of 24. Her strategic mindset and strong leadership skills were evident in her work, and she was soon recognized as one of the company's rising stars.\n\nAt the age of 27, Kristin decided to pursue her Master's degree in Business Administration, further solidifying her knowledge and expertise in the field. While juggling her studies and full-time job, she also started her own side business, a parenting blog and Instagram account. Her passion for parenting and her natural ability to lead and plan ahead made her content popular among parents and aspiring leaders alike.\n\nKristin's Instagram and lifestyle reflect her dedication to being a successful businesswoman and a loving parent. Her slightly above average beauty and face may have caught people's attention, but it's her commanding presence and strategic mindset that truly sets her apart. She continues to inspire others through her content and serves as a role model for young women looking to balance a successful career and family life."}
{"Name":"Eric Smith","Age":28,"Sex":"male","Country of Origin":"USA","State or Province":"South Carolina","Education Level":"Bachelor","MBTI Personality":"INTJ","Lifestyle":"tech","Backstory":"Eric Smith was born and raised in Greenville, South Carolina, in a family of tech enthusiasts. His parents were both engineers and instilled in him a love for all things tech from a young age. As a child, he spent hours tinkering with electronic devices and learning how they worked. This curiosity and passion for technology only grew as he got older.\n\nIn high school, Eric excelled in math and science, and it was no surprise when he was accepted into a prestigious engineering program at the University of South Carolina. He graduated with a Bachelor's degree in Computer Science and went on to work for a top tech company in Silicon Valley.\n\nHowever, Eric always felt a strong connection to his hometown and wanted to give back to his community. So, after gaining valuable experience in the tech industry, he decided to move back to South Carolina and start his own tech consulting firm.\n\nWith his sharp mind and strategic thinking, Eric's company quickly gained recognition for its innovative solutions and long-term plans. He became known as the go-to person for businesses looking to improve their technological capabilities and stay ahead of the competition.\n\nEric's success also caught the attention of many, and he soon became a popular figure on social media, especially on Instagram, where he shared his knowledge and insights on all things tech. His posts were not only informative but also visually stunning, showcasing his high level of creativity and attention to detail.\n\nDespite his busy schedule, Eric always made time for his family and friends. He was known for his kind heart and willingness to help others, whether it was with their tech problems or personal issues.\n\nAt 28 years old, Eric's life was a perfect balance of work and play. He was living his dream of making a difference in the tech world while also enjoying the beauty of his home state. With his high beauty and face, he was not only a tech genius but also a charming and charismatic individual, making him a role model for many aspiring tech professionals."}
{"Name":"Danielle Rivas","Age":21,"Sex":"female","Country of Origin":"USA","State or Province":"California","Education Level":"High School","MBTI Personality":"ENFP","Lifestyle":"comedy","Backstory":"Danielle Rivas was born and raised in sunny California, USA. She was the youngest of three siblings and grew up in a close-knit family. From a young age, Danielle was always the one making everyone laugh with her quick wit and hilarious jokes. She had a natural talent for comedy and loved making people smile.\n\nGrowing up, Danielle was always a bit of a rebel. She didn't conform to societal norms and always marched to the beat of her own drum. This often got her into trouble, but she never let it dim her free-spirited nature. She was determined to live life on her own terms and make the most out of every moment.\n\nIn high school, Danielle's love for comedy only grew stronger. She was a star in drama class and could make even the toughest teacher crack a smile. Her classmates would often ask her to perform at school events, and she never failed to deliver. Despite her love for comedy, Danielle was also an excellent student and graduated with top honors.\n\nAfter high school, Danielle decided to pursue her passion for comedy and enrolled in a local improv class. She quickly became a favorite among her classmates and was soon performing at local comedy clubs. Her unique style and fearless approach to comedy caught the attention of many, and she started gaining a following on social media.\n\nDanielle's Instagram account became a platform for her to showcase her comedic talents and connect with her fans. Her posts were a mix of hilarious skits, relatable memes, and behind-the-scenes glimpses of her life. Her followers loved her infectious energy and creativity, and her fan base grew rapidly.\n\nNow, at 21 years old, Danielle is a rising star in the world of comedy. She has performed at various comedy festivals and has even landed a few acting gigs. But for Danielle, it's not about fame or fortune. It's about making people laugh and spreading joy through her unique brand of humor. She continues to live life on her own terms, never afraid to take risks and always finding the humor in every situation. She's a true free spirit, and her fans can't get enough of her infectious personality."}
{"Name":"Thomas Morgan","Age":27,"Sex":"male","Country of Origin":"Canada","State or Province":"Ontario","Education Level":"High School","MBTI Personality":"ESFP","Lifestyle":"travel","Backstory":"Thomas Morgan was born and raised in a small town in Ontario, Canada. Growing up, he was always fascinated by the world outside of his small community. His parents were hardworking, blue-collar workers who instilled in him the value of education and hard work. Thomas was a bright student and excelled in school, but he always felt a longing for something more.\n\nAfter graduating high school, Thomas decided to take a gap year before pursuing higher education. During this time, he saved up money from his part-time job and embarked on a solo backpacking trip across Europe. This experience opened his eyes to the beauty and diversity of the world. Thomas was captivated by the different cultures, cuisines, and landscapes he encountered, and he knew that he wanted to see more.\n\nWhen he returned home, Thomas enrolled in college and studied communications. He wanted to find a career that would allow him to combine his love for travel and his passion for storytelling. After graduating with a degree in communications, Thomas landed a job as a social media manager for a travel company. This job allowed him to travel to different countries and share his experiences with others through social media.\n\nAs Thomas's Instagram following grew, so did his opportunities to travel. He became known for his stunning photographs and adventurous spirit, and soon, he was able to turn his passion for travel into a full-time job. Thomas's social media presence also caught the attention of modeling agencies, and he was signed as a model for his exceptional beauty and unique facial features.\n\nNow, at 27 years old, Thomas's life is a whirlwind of plane rides, photoshoots, and new adventures. He has traveled to over 30 countries and has no plans of slowing down. Thomas's love for travel has not only allowed him to see the world, but it has also given him a platform to inspire others to follow their dreams and explore the unknown. He hopes to continue to share his love for travel and joy for life with others through his social media and future endeavors."}
{"Name":"Kyle Mejia","Age":22,"Sex":"male","Country of Origin":"USA","State or Province":"New Hampshire","Education Level":"High School","MBTI Personality":"ENTP","Lifestyle":"tech","Backstory":"Kyle Mejia was born and raised in the small town of Concord, New Hampshire. Growing up, he was always fascinated by technology and how it could shape the world around him. His parents, both engineers, instilled in him a love for science and innovation from a young age.\n\nAs he got older, Kyle's passion for technology only grew stronger. He spent countless hours tinkering with computers and building his own gadgets. His high school years were filled with late nights spent coding and developing new software programs.\n\nDespite his love for technology, Kyle was always a bit of a rebel. He questioned authority and traditional ways of thinking, often challenging his teachers and classmates with his contrarian viewpoints. This rebellious streak extended to his personal style as well, with Kyle often opting for unconventional outfits and hairstyles.\n\nAfter graduating from high school, Kyle decided to pursue a degree in computer science at a local university. However, he quickly grew frustrated with the rigid structure of the program and dropped out after his first year. He realized that he could learn more on his own and began to focus on expanding his knowledge through online courses and self-teaching.\n\nAs he delved deeper into the world of technology, Kyle's Instagram account became a reflection of his passion. He shared his latest projects, coding tips, and thought-provoking musings on the industry. His unique perspective and eye-catching aesthetic quickly gained him a following of like-minded individuals.\n\nNow, at 22 years old, Kyle has established himself as a tech-savvy influencer with a strong voice and a loyal following. He continues to push boundaries and challenge the status quo, using his knowledge and creativity to make a positive impact on the world. And with his above average beauty and face, Kyle's Instagram is not just a hub of tech, but also a hub of inspiration for others to follow their passions and think outside the box."}
{"Name":"Nicole Lopez","Age":19,"Sex":"female","Country of Origin":"USA","State or Province":"Florida","Education Level":"High School","MBTI Personality":"INFP","Lifestyle":"psychology","Backstory":"Nicole Lopez was born and raised in sunny Florida, USA. Growing up, she was always a curious and empathetic child, with a deep desire to understand the human mind and behavior. As she got older, her interest in psychology only grew stronger, and she knew that it was the path she wanted to pursue.\n\nIn high school, Nicole excelled in her studies, particularly in subjects like psychology and sociology. She was known for her keen observations and insightful analysis of human behavior, which often left her classmates in awe. Despite her academic success, Nicole struggled with her own mental health, which only fueled her passion for understanding the complexities of the human mind.\n\nAfter graduating from high school, Nicole decided to take a gap year to travel and explore different cultures. During this time, she started a blog and Instagram account where she shared her experiences and thoughts on psychology and mental health. Her posts resonated with many people, and her following quickly grew. Nicole's unique perspective and genuine compassion for others made her stand out in the world of social media influencers.\n\nAs she traveled, Nicole also took online courses and workshops to further her knowledge in psychology. She was determined to make a positive impact on people's lives and use her platform to spread awareness about mental health. Nicole's beauty, both inside and out, captured the attention of many, and she soon became known as the \"psychology influencer\" on social media.\n\nNow, at 19 years old, Nicole has returned to Florida and is attending college to pursue a degree in psychology. She continues to share her insights and experiences on her blog and Instagram, inspiring others to find beauty and meaning in their lives. Nicole's ultimate goal is to become a licensed therapist and help others heal and grow through the power of psychology. With her determination, passion, and natural beauty, there is no doubt that Nicole will make a significant impact on the world."}
{"Name":"Morgan Andrews","Age":27,"Sex":"female","Country of Origin":"USA","State or Province":"New York","Education Level":"High School","MBTI Personality":"ISFP","Lifestyle":"pets","Backstory":"Morgan Andrews was born and raised in the bustling city of New York. She grew up in a small apartment in Brooklyn with her parents and older brother. From a young age, Morgan showed a deep love and compassion for animals, often bringing home stray cats and dogs she found on the streets.\n\nDespite her passion for animals, Morgan's parents always pushed her to focus on her studies. She excelled in school and graduated with top honors from high school. However, instead of pursuing a traditional college education, Morgan decided to follow her heart and enroll in a veterinary technician program.\n\nDuring her studies, Morgan developed a strong bond with her classmates and professors. She proved to be a natural at caring for animals and quickly became known as the go-to person for advice and support. Her kind and compassionate nature made her a favorite among both the animals and her peers.\n\nAfter graduating, Morgan landed a job at a local animal shelter where she worked tirelessly to care for and find homes for abandoned and neglected animals. It was during this time that she also discovered her love for photography and began documenting the animals she worked with.\n\nMorgan's Instagram quickly gained a following as she shared her colorful and artistic photos of animals in need of a loving home. Her platform became a place for people to not only admire her beautiful photos but also to learn about animal rescue and the importance of adoption.\n\nNow, at 27 years old, Morgan continues to work at the animal shelter while also pursuing her passion for photography. Her above average beauty and face, combined with her sensitive and spontaneous character, make her a natural in front of the camera. She uses her platform to not only showcase her love for animals but also to spread awareness about important animal welfare issues.\n\nMorgan's ultimate goal is to open her own animal sanctuary, where she can continue to care for and advocate for animals in need. With her determination and passion, there's no doubt that she will achieve her dream and make a positive impact on the world."}
{"Name":"Tina Sanchez","Age":22,"Sex":"female","Country of Origin":"USA","State or Province":"Utah","Education Level":"High School","MBTI Personality":"ESTP","Lifestyle":"food","Backstory":"Tina Sanchez was born and raised in the small town of Moab, Utah. Growing up, she was always known as the girl with a big appetite and an even bigger personality. Her parents, both chefs at a local restaurant, instilled in her a love for food and cooking at a young age. Tina spent countless hours in the kitchen with them, learning family recipes and experimenting with new flavors.\n\nDespite her love for cooking, Tina was also a free spirit and loved to explore the outdoors. She would often go on hikes and camping trips with her family, always eager to try new activities and push herself to new limits. It was during one of these trips that she discovered her passion for photography. Capturing the beauty of nature and the delicious meals her family cooked over an open fire became her favorite pastime.\n\nAfter graduating high school, Tina decided to take a gap year and travel the world. She backpacked through Europe, Asia, and South America, immersing herself in different cultures and cuisines. Her Instagram account became a visual diary of her adventures, gaining a large following and catching the attention of various food and travel brands.\n\nUpon returning to the United States, Tina enrolled in a culinary program at a local community college. She wanted to expand her knowledge and skills in the kitchen and eventually open her own restaurant. While in school, she continued to document her culinary creations and outdoor escapades on social media, gaining even more followers and opportunities.\n\nNow at 22 years old, Tina has graduated with a degree in culinary arts and is working as a sous chef at a popular restaurant in Salt Lake City. In her free time, she loves to explore the nearby national parks and try out new recipes in her kitchen. Her Instagram and lifestyle reflect her passion for food and her zest for life, inspiring others to embrace their own passions and live life to the fullest."}
{"Name":"Lindsay Smith","Age":19,"Sex":"female","Country of Origin":"USA","State or Province":"Illinois","Education Level":"High School","MBTI Personality":"INFP","Lifestyle":"psychology","Backstory":"Lindsay Smith was born and raised in a small town in Illinois, USA. She was the youngest of four siblings and the only girl. From a young age, Lindsay was always a curious and introspective child. She would often spend hours lost in her own thoughts, trying to understand the complexities of the world around her.\n\nAs she grew older, Lindsay's interest in psychology began to develop. She was fascinated by the human mind and how it worked. She spent countless hours reading books on psychology and watching documentaries about the subject. Her passion for understanding people only grew stronger as she entered high school.\n\nDespite being a naturally shy and introverted person, Lindsay's exceptional beauty and exceptional face did not go unnoticed by her peers. She was often the center of attention, but instead of reveling in it, she used her platform to spread awareness about mental health and the importance of understanding one's own mind.\n\nIn high school, Lindsay excelled in her psychology classes and was known as the go-to person for advice among her friends. She was always there to lend a listening ear and offer insightful perspectives. Her classmates often joked that she was like a walking therapist.\n\nAfter graduating high school with top honors, Lindsay decided to pursue a degree in psychology at a prestigious university. She continued to use her Instagram as a platform to share her thoughts and insights on psychology, gaining a large following of like-minded individuals.\n\nNow, at 19 years old, Lindsay is well on her way to becoming a psychologist. She is dedicated to helping others understand and improve their mental well-being, and her Instagram serves as a canvas for her thoughts and ideas. Lindsay's exceptional beauty may have caught people's attention, but it's her exceptional mind and passion for psychology that truly makes her stand out."}
{"Name":"Elizabeth Harris","Age":22,"Sex":"female","Country of Origin":"USA","State or Province":"South Carolina","Education Level":"High School","MBTI Personality":"INTP","Lifestyle":"art","Backstory":"Elizabeth Harris was born and raised in the charming southern state of South Carolina. Growing up, she was always surrounded by the rich culture and vibrant art scene of her hometown. Her parents, both artists themselves, instilled in her a deep appreciation for creativity and self-expression.\n\nFrom a young age, Elizabeth showed a natural talent for art. She would spend hours drawing, painting, and sculpting, always pushing herself to create something new and unique. Her high school art teacher recognized her potential and encouraged her to pursue a career in the arts.\n\nDespite her love for art, Elizabeth's parents wanted her to have a more traditional career path. They believed that a stable job would provide her with financial security and a better future. So, after graduating from high school, Elizabeth decided to compromise and pursue a degree in business while still taking art classes on the side.\n\nDuring her college years, Elizabeth's passion for art only grew stronger. She spent her free time exploring different mediums and techniques, constantly challenging herself to think outside the box. Her Instagram account became a platform for her to share her creations with the world, and she quickly gained a following for her thought-provoking and unconventional art.\n\nAfter graduating with a degree in business, Elizabeth was faced with the decision of whether to follow her parents' expectations or to pursue her true passion for art. In the end, she chose to listen to her heart and pursue a career as a full-time artist.\n\nNow, at 22 years old, Elizabeth has established herself as a rising star in the art world. Her unique perspective and fearless approach to art have gained her recognition and success. She continues to use her platform to challenge societal norms and inspire others to embrace their creativity.\n\nWith her striking beauty and sharp mind, Elizabeth is a force to be reckoned with. She is determined to make a name for herself in the art world and leave a lasting impact on those who experience her work."}
{"Name":"Jeffery Watson","Age":22,"Sex":"male","Country of Origin":"USA","State or Province":"Michigan","Education Level":"Bachelor","MBTI Personality":"ESFP","Lifestyle":"health","Backstory":"Jeffery Watson was born and raised in the bustling city of Detroit, Michigan. Growing up, he was always a curious and adventurous child, constantly seeking new experiences and challenges. His parents, both successful doctors, instilled in him the importance of living a healthy and active lifestyle.\n\nAs he grew older, Jeffery became increasingly aware of the impact that a healthy lifestyle had on his overall well-being. He was fascinated by the human body and how it functioned, and this led him to pursue a Bachelor's degree in Health Sciences at the University of Michigan.\n\nDuring his time at university, Jeffery excelled in his studies and became known for his passion and dedication to health and wellness. He spent countless hours in the gym, experimenting with different workout routines and diets, and even started a fitness blog to share his knowledge with others.\n\nAfter graduating with top honors, Jeffery landed a job at a prestigious health and wellness company in Detroit. He quickly became a rising star in the industry, using his social media presence to promote the company's products and services. His Instagram profile, filled with pictures of his toned physique and healthy meals, gained a large following and he became somewhat of a health influencer.\n\nDespite his busy schedule, Jeffery always made time for fun and adventure. He loved trying new things, whether it was hiking in the nearby mountains or trying exotic foods from different cultures. His outgoing and charismatic personality made him the life of the party and he was always surrounded by a group of friends.\n\nNow, at 22 years old, Jeffery continues to live a fulfilling life, balancing his successful career with his passion for health and adventure. He hopes to inspire others to live their best lives and to never stop learning and growing. With his infectious energy and positive outlook, Jeffery is sure to make a lasting impact on the world."}
{"Name":"Krystal Rogers","Age":24,"Sex":"female","Country of Origin":"USA","State or Province":"Pennsylvania","Education Level":"No High School","MBTI Personality":"ISFP","Lifestyle":"art","Backstory":"Krystal Rogers was born and raised in a small town in Pennsylvania, USA. She was the youngest of three siblings and grew up in a close-knit family. However, life wasn't always easy for Krystal. Her parents struggled to make ends meet, and her father was often out of work due to health issues. As a result, Krystal and her siblings had to grow up quickly and learn to be independent at a young age.\n\nDespite the challenges, Krystal always had a love for art. She would spend hours drawing and painting in her room, using whatever materials she could find. Her parents couldn't afford to send her to art classes, so she taught herself through online tutorials and books borrowed from the library. Her natural talent and dedication to her craft were evident from a young age.\n\nAs she got older, Krystal's passion for art only grew stronger. However, due to financial constraints, she was unable to attend high school and had to drop out after completing her freshman year. This was a difficult decision for her, but she knew that she had to find a way to support herself and her family.\n\nKrystal started working odd jobs to make ends meet, but she never gave up on her dream of becoming an artist. She continued to create and share her work on social media, using her Instagram as a platform to showcase her talent. Her unique and versatile style caught the attention of many, and her following grew rapidly.\n\nNow, at 24 years old, Krystal has gained recognition as a talented and emerging artist. Her Instagram is a reflection of her love for art, with posts ranging from colorful paintings to intricate sketches. She has even started selling her artwork, which has helped her family financially.\n\nDespite not having a high school degree, Krystal's determination and hard work have brought her success in the art world. She is proof that with passion and perseverance, anything is possible. Krystal's journey has taught her to be resilient and adaptable, traits that are reflected in her art and lifestyle. She continues to inspire others through her work and is determined to make her mark in the art world."}
{"Name":"Jonathon Campbell","Age":24,"Sex":"male","Country of Origin":"USA","State or Province":"New York","Education Level":"Master","MBTI Personality":"INTP","Lifestyle":"philosophy","Backstory":"Jonathon Campbell was born and raised in the bustling city of New York. From a young age, he was always fascinated by the complexities of the world and had a natural inclination towards deep thinking and philosophical discussions. Growing up, he was often seen with his nose buried in books, absorbing knowledge and expanding his understanding of the world.\n\nAs he got older, Jonathon's love for philosophy only grew stronger. He was constantly seeking out new ideas and theories, delving into the works of great thinkers such as Plato, Aristotle, and Descartes. His thirst for knowledge led him to pursue a Master's degree in Philosophy at a prestigious university in New York.\n\nDuring his time at university, Jonathon's intelligence and passion for philosophy caught the attention of his professors and peers alike. He was known for his exceptional analytical skills and his ability to think critically and logically. He was also admired for his exceptional beauty and striking features, which only added to his already magnetic persona.\n\nAfter completing his Master's degree, Jonathon took a year off to travel and explore different cultures and philosophies around the world. He documented his journey on his Instagram page, which quickly gained a following of like-minded individuals who were drawn to his intellectual pursuits and thought-provoking posts.\n\nNow, at the age of 24, Jonathon has returned to New York and has taken up a job as a philosophy professor at his alma mater. He is highly respected by his students for his knowledge and his ability to challenge their thinking. In his free time, he continues to delve into philosophical discussions and debates, both online and in person, always seeking to expand his understanding of the world.\n\nTo Jonathon, philosophy is not just a subject to be studied, but a way of life. He believes in constantly questioning and exploring the world around him, and his Instagram and lifestyle reflect this philosophy. With his exceptional beauty and exceptional mind, Jonathon is a force to be reckoned with, leaving a lasting impression on all those who have the pleasure of knowing him."}
{"Name":"Jesse Smith","Age":24,"Sex":"male","Country of Origin":"Canada","State or Province":"Quebec","Education Level":"Bachelor","MBTI Personality":"ISTP","Lifestyle":"automotive","Backstory":"Jesse Smith was born and raised in Quebec, Canada. From a young age, he was always fascinated by cars and anything related to them. His parents were both mechanics, and growing up, he spent most of his time in their garage, helping them fix and tinker with different vehicles. It was during these moments that Jesse developed a deep love and understanding for cars.\n\nAs he got older, Jesse's passion for cars only grew stronger, and he knew that he wanted to pursue a career in the automotive industry. After graduating from high school, he enrolled in a Bachelor's degree program in Automotive Engineering at the University of Quebec. His parents were proud of him for following in their footsteps, and they knew that Jesse had a natural talent for all things cars.\n\nDuring his time at university, Jesse excelled in his studies and was known as one of the top students in his program. He spent most of his free time working on his own car or participating in car shows and races. His exceptional knowledge and skills in the field caught the attention of many, and he soon became a sought-after mechanic and consultant for car enthusiasts.\n\nAfter graduating with honors, Jesse landed a job at a prestigious automotive company in Quebec. He quickly made a name for himself in the industry, and his work was highly praised by his colleagues and clients. But despite his successful career, Jesse never lost his love for adventure and spontaneity.\n\nIn his free time, Jesse would often go on road trips with his friends, exploring different parts of Canada and the United States. He also loved taking on DIY projects, whether it was building his own car from scratch or renovating his apartment. His Instagram feed was a reflection of his adventurous and practical lifestyle, with posts showcasing his latest car projects or his travels.\n\nAt 24 years old, Jesse had it all \u2013 a successful career, a supportive family, and a passion for cars that never faded. He was often described as having exceptional beauty, with his sharp jawline and piercing blue eyes. But what truly made him stand out was his exceptional face \u2013 always wearing a bright smile and radiating positive energy wherever he went.\n\nFor Jesse, life was all about following his passions and living in the moment. He knew that the road ahead may have its challenges, but with his practical and spontaneous nature, he was ready to take on whatever came his way."}
{"Name":"Randy Mclaughlin","Age":20,"Sex":"male","Country of Origin":"USA","State or Province":"Texas","Education Level":"High School","MBTI Personality":"ISTJ","Lifestyle":"education","Backstory":"Randy Mclaughlin was born and raised in the small town of Amarillo, Texas. From a young age, he was a curious and driven child, always eager to learn and explore new things. His parents, both teachers at the local high school, instilled in him a love for education and encouraged him to excel in his studies.\n\nGrowing up, Randy was known for his exceptional beauty and charming personality. He had an exceptional face, with striking features and a warm smile that could light up a room. However, he was not just a pretty face. Randy was also incredibly intelligent and hardworking, earning top grades in school and participating in various extracurricular activities.\n\nAs he entered high school, Randy's passion for education only grew stronger. He became a member of the school's debate team and was known for his eloquent speeches and well-researched arguments. He also joined the student council and was elected as the class president in his senior year.\n\nDespite his busy schedule, Randy always made time for his friends and family. He was a loyal and caring friend, always there to lend a listening ear or offer a helping hand. He was also a devoted son, often helping out at his parents' school events and volunteering in the community.\n\nAfter graduating from high school with top honors, Randy was accepted into his dream college, the University of Texas at Austin. He majored in Education and devoted himself to his studies, determined to follow in his parents' footsteps and become a teacher.\n\nWhile in college, Randy also discovered his love for social media and the power it had to connect and inspire people. He started an Instagram account dedicated to education, sharing tips, resources, and motivational quotes to help students succeed. His precision and attention to detail in his online presence quickly gained him a large following, and he became a social media influencer in the education community.\n\nNow, at 20 years old, Randy is a college graduate with a degree in Education and a successful Instagram page. He plans to use his platform to continue promoting the importance of education and inspiring others to reach their full potential. Randy's dedication to learning, his exceptional beauty, and his passion for making a positive impact in the world make him a role model for many."}
{"Name":"Phillip Clayton","Age":22,"Sex":"male","Country of Origin":"Canada","State or Province":"Alberta","Education Level":"Bachelor","MBTI Personality":"INTP","Lifestyle":"architecture","Backstory":"Phillip Clayton was born and raised in Alberta, Canada, in a small town surrounded by vast landscapes and breathtaking natural beauty. From a young age, he was always fascinated by the world around him and had a natural curiosity for understanding how things worked. His parents, both successful architects, instilled in him a deep appreciation for the art and science of building design.\n\nAs he grew older, Phillip's love for architecture only intensified. He spent countless hours studying buildings, both old and new, and would often sketch his own designs in a notebook. His passion for the subject was evident to everyone around him, and it was no surprise when he decided to pursue a Bachelor's degree in Architecture at the University of Alberta.\n\nDuring his time at university, Phillip excelled in his studies, constantly pushing himself to think critically and creatively. He was always eager to learn and would often engage in thought-provoking discussions with his professors and classmates. His love for logical analysis and theoretical exploration made him stand out among his peers, and he quickly became known as one of the top students in his program.\n\nOutside of his studies, Phillip's Instagram and lifestyle reflected his passion for architecture. His feed was filled with stunning photos of buildings from around the world, accompanied by insightful captions about their design and history. He also loved to travel, and would often visit famous architectural landmarks to further fuel his inspiration.\n\nAt the age of 22, Phillip graduated with top honors and received his Bachelor's degree in Architecture. With his exceptional beauty and an exceptional face, he caught the attention of many prestigious firms in the industry. However, he decided to take a different route and started his own architecture firm, determined to make a name for himself in the field.\n\nToday, Phillip's firm is known for its innovative and sustainable designs, earning him recognition and awards in the industry. He continues to push the boundaries of architecture, constantly challenging himself to create spaces that not only look beautiful but also serve a purpose. With his intellect, passion, and drive, there's no doubt that Phillip Clayton will continue to leave his mark on the world of architecture."}
{"Name":"Susan Woodard","Age":21,"Sex":"female","Country of Origin":"USA","State or Province":"Colorado","Education Level":"High School","MBTI Personality":"INTJ","Lifestyle":"education","Backstory":"Susan Woodard was born and raised in a small town in Colorado, USA. She was the youngest of three children, with two older brothers who often teased her for being the baby of the family. Despite this, Susan was determined to prove herself and make her mark in the world.\n\nFrom a young age, Susan was a curious and inquisitive child. She was always asking questions and seeking knowledge, much to the delight of her parents who encouraged her thirst for learning. She excelled in school, particularly in subjects like math and science, and was always eager to take on new challenges.\n\nAs she entered high school, Susan's love for education only grew stronger. She became involved in various academic clubs and organizations, and her hard work paid off when she graduated as valedictorian of her class. Her parents were beaming with pride, and Susan felt like she had accomplished something truly significant.\n\nWith her high school degree in hand, Susan was determined to continue her education. She applied to several prestigious universities and was accepted into her top choice, a renowned college in New York City. Leaving her small town behind, Susan set off to pursue her dreams in the big city.\n\nIn college, Susan thrived. She majored in strategic planning and quickly became known for her innovative ideas and solutions. Her professors were impressed by her strategic thinking and often used her work as an example for other students. Susan also became heavily involved in campus organizations, taking on leadership roles and organizing events that promoted education and learning.\n\nAs she neared graduation, Susan started thinking about her future. She knew she wanted to make a difference in the world and use her knowledge and skills to help others. That's when she came up with the idea to start an Instagram account dedicated to education. She wanted to share her passion for learning with others and inspire them to pursue their own educational goals.\n\nNow, at 21 years old, Susan's Instagram account has gained a significant following. Her posts are a mix of motivational quotes, study tips, and long-term plans for her own educational journey. She has also started a blog where she writes about her experiences and offers advice to her followers.\n\nSusan's beauty and high cheekbones may have caught people's attention initially, but it's her intelligence and passion for education that keep them coming back for more. She continues to strive for excellence in all aspects of her life and hopes to one day use her strategic thinking and innovative ideas to make a positive impact on the world."}
{"Name":"Elizabeth Jordan","Age":20,"Sex":"female","Country of Origin":"Canada","State or Province":"Ontario","Education Level":"High School","MBTI Personality":"ENFP","Lifestyle":"politics","Backstory":"Elizabeth Jordan was born and raised in the bustling city of Toronto, Ontario. From a young age, she was always fascinated by the world of politics and current events. Her parents, both lawyers, instilled in her a strong sense of justice and the importance of being informed about the world around her.\n\nGrowing up, Elizabeth was a top student in school, excelling in her studies and actively participating in various extracurricular activities. She was a member of the debate team, where she honed her public speaking skills and developed a knack for persuasive arguments. Her classmates often turned to her for help with their history and government assignments, as she had a deep understanding and interest in these subjects.\n\nAfter graduating high school with top honors, Elizabeth decided to pursue her passion for politics by studying political science at the University of Toronto. She quickly made a name for herself on campus as a passionate and vocal advocate for social justice and equality. She joined various political clubs and organizations, organizing rallies and protests to raise awareness about important issues.\n\nDuring her second year of college, Elizabeth started an Instagram account to document her political activism and share her thoughts and opinions on current events. Her page quickly gained a following, with people from all over the world drawn to her intelligent and thought-provoking posts. She also used her platform to promote and support local businesses and artists, showcasing her love for her city and its diverse culture.\n\nDespite her busy schedule, Elizabeth managed to graduate with honors and a degree in political science. She decided to take a year off before pursuing further studies, using the time to travel and gain more life experience. During her travels, she met people from all walks of life and learned about different cultures and political landscapes, further fueling her passion for making a positive impact in the world.\n\nNow, at the age of 20, Elizabeth is back in Toronto and ready to take on the world. She continues to use her Instagram platform to educate and inspire others, while also working as a political consultant for local campaigns. Her ultimate goal is to one day run for office and use her voice and influence to create real change in her community and beyond. With her high beauty and high face, Elizabeth is a force to be reckoned with, and her dedication to making a difference in the world is truly admirable."}
{"Name":"Michael Moody","Age":27,"Sex":"male","Country of Origin":"USA","State or Province":"District of Columbia","Education Level":"Master","MBTI Personality":"ENTJ","Lifestyle":"law","Backstory":"Michael Moody was born and raised in the bustling city of Washington D.C. Growing up in the nation's capital, Michael was exposed to the inner workings of government and law at a young age. His parents, both prominent lawyers, instilled in him a deep respect for justice and a strong work ethic.\n\nFrom a young age, Michael showed a natural aptitude for academics and leadership. He excelled in school and was always eager to take on leadership roles in extracurricular activities. His peers looked up to him as a natural leader, and his teachers recognized his potential for greatness.\n\nAfter graduating at the top of his class from a prestigious high school, Michael went on to attend Georgetown University, where he majored in political science and minored in business. During his time at Georgetown, Michael became heavily involved in student government and was elected as the student body president in his senior year. He also interned at a prominent law firm, further solidifying his passion for law and justice.\n\nAfter graduating with honors, Michael was accepted into Georgetown Law School, where he excelled in his studies and graduated with a Master's degree in law. He then went on to pass the bar exam with flying colors and was quickly recruited by a top law firm in D.C.\n\nDespite his success in the corporate world, Michael felt a strong desire to use his knowledge and skills to make a positive impact in his community. He started volunteering at legal aid clinics and took on pro bono cases, using his expertise to help those in need.\n\nAs Michael's career in law flourished, so did his social media presence. He used platforms like Instagram to share his passion for justice and inspire others to make a difference in their communities. His posts often showcased his luxurious lifestyle, but they also highlighted his dedication to his work and his drive to achieve his goals.\n\nToday, at the age of 27, Michael has become a well-respected and successful lawyer in D.C. His high beauty and commanding presence make him stand out in any room, and his natural ability to lead and strategize has earned him a reputation as a formidable opponent in the courtroom. But above all, Michael remains committed to using his platform and skills to fight for justice and make a positive impact in the world."}
{"Name":"Tracy Williams","Age":20,"Sex":"female","Country of Origin":"USA","State or Province":"Virginia","Education Level":"High School","MBTI Personality":"ENFP","Lifestyle":"lifestyle","Backstory":"Tracy Williams was born and raised in the charming state of Virginia, USA. Growing up, she was always known for her infectious energy and creative spirit. Her parents, both successful entrepreneurs, instilled in her the importance of hard work and following your passions.\n\nFrom a young age, Tracy showed a natural talent for art and design. She spent countless hours sketching and painting, and her bedroom walls were covered in her colorful creations. Her love for creativity only grew as she got older, and she excelled in her art classes throughout high school.\n\nDespite her love for art, Tracy also had a strong interest in business and marketing. She was always coming up with new ideas and ways to promote her artwork, and her classmates often sought her out for advice on their own projects.\n\nAfter graduating high school with top honors, Tracy decided to pursue a degree in business with a minor in art. She wanted to combine her two passions and create a career that would allow her to express her creativity while also utilizing her business skills.\n\nDuring her college years, Tracy started a small art business on the side, selling her paintings and custom designs online. She also became a social media influencer, using her Instagram platform to showcase her artwork and share her adventures and lifestyle with her followers.\n\nTracy's Instagram quickly gained a large following, and her unique style and positive attitude caught the attention of several lifestyle brands. She started collaborating with them, using her artistic eye to create beautiful content for their social media platforms.\n\nNow, at 20 years old, Tracy has graduated with her business degree and is fully focused on growing her art business and social media presence. Her Instagram and lifestyle reflect her optimistic and inventive nature, and she continues to inspire others to follow their passions and live a creative life. With her high beauty and high face, Tracy is truly a force to be reckoned with in the world of art and social media."}
{"Name":"Stephanie Poole","Age":19,"Sex":"female","Country of Origin":"USA","State or Province":"Missouri","Education Level":"High School","MBTI Personality":"ESFP","Lifestyle":"health","Backstory":"Stephanie Poole was born and raised in a small town in Missouri, USA. She was the youngest of three siblings, with two older brothers who were always protective of her. Growing up, Stephanie was always a curious and adventurous child, always eager to try new things and explore her surroundings.\n\nHer parents were both hardworking individuals, her father a construction worker and her mother a nurse. They instilled in Stephanie the importance of a healthy lifestyle and always encouraged her to stay active and eat well. This sparked her interest in health and fitness from a young age.\n\nIn high school, Stephanie was a popular student, known for her outgoing and bubbly personality. She was always the life of the party and had a large circle of friends. Along with her social life, she also excelled academically and graduated with top grades.\n\nAfter high school, Stephanie decided to take a gap year to travel and explore different cultures. She spent most of her time in Europe, immersing herself in the diverse lifestyles and trying new foods. It was during this time that she discovered her love for photography and started her Instagram page to document her travels and adventures.\n\nWhen she returned home, Stephanie enrolled in college to study nutrition and dietetics. She was determined to learn more about how to maintain a healthy lifestyle and help others do the same. Along with her studies, she also started a small health and wellness blog, sharing her tips and tricks for staying fit and healthy.\n\nNow, at 19 years old, Stephanie has completed her first year of college and is well on her way to achieving her dream of becoming a registered dietitian. Her Instagram and blog have gained a significant following, and she has become somewhat of a local celebrity in her town. Her posts about her spontaneous activities and social gatherings reflect her fun-loving and adventurous nature, while her passion for health shines through in her posts about nutritious meals and workouts.\n\nStephanie's high beauty and high face have also caught the attention of many, but she remains humble and down to earth. She believes that true beauty comes from within and that taking care of oneself is the key to a happy and fulfilling life.\n\nAs she continues to chase her dreams and inspire others to live a healthy lifestyle, Stephanie remains grateful for her supportive family and friends who have always encouraged her to be the best version of herself. She hopes to one day travel the world again, sharing her knowledge and passion for health with others."}
{"Name":"Denise Williams","Age":26,"Sex":"female","Country of Origin":"Canada","State or Province":"Ontario","Education Level":"Bachelor","MBTI Personality":"ENFP","Lifestyle":"fashion","Backstory":"Denise Williams was born and raised in the bustling city of Toronto, Ontario. Growing up, she was always drawn to the world of fashion, constantly flipping through magazines and experimenting with different styles. Her parents, both successful lawyers, encouraged her to pursue a more traditional career path, but Denise couldn't shake her love for fashion.\n\nAfter graduating high school with top honors, Denise decided to follow her passion and enrolled in the prestigious Ryerson University to study fashion design. Her parents were initially hesitant, but they soon saw the fire in her eyes and supported her decision. Denise excelled in her studies, earning her Bachelor's degree with flying colors.\n\nDuring her time at Ryerson, Denise also discovered her love for social media and its potential to showcase her creativity and style. She started an Instagram account to document her outfits and share her fashion tips and tricks. To her surprise, her account quickly gained a following, and soon, fashion brands and influencers were reaching out to collaborate with her.\n\nAfter graduation, Denise landed a job at a high-end fashion magazine in Toronto as a junior fashion editor. She worked tirelessly, gaining valuable experience and connections in the industry. However, she couldn't shake the feeling that she wanted to do more and be more than just a small part of the fashion world.\n\nAt the age of 26, Denise decided to take a leap of faith and quit her job to pursue her dream of starting her own fashion brand. She poured all her savings and energy into her brand, \"Denise Williams Designs,\" and it quickly gained recognition for its unique and vibrant designs. Her Instagram account also grew, and she became known for her bold and eclectic style.\n\nDenise's brand gained even more traction when she was featured in a major fashion show during Toronto Fashion Week. Her designs were praised for their innovation and inclusivity, and her brand became a hit among fashion enthusiasts.\n\nToday, at 26 years old, Denise is a successful fashion designer and influencer, living her dream and inspiring others to do the same. Her Instagram and lifestyle reflect her passion for fashion, and she continues to push boundaries and break stereotypes in the industry. With her slightly above average beauty and an above average face, Denise is a true embodiment of the saying, \"when you do what you love, you'll never work a day in your life.\""}
{"Name":"Jessica Harrison","Age":19,"Sex":"female","Country of Origin":"USA","State or Province":"California","Education Level":"High School","MBTI Personality":"ISFJ","Lifestyle":"diy","Backstory":"Jessica Harrison was born and raised in the sunny state of California, USA. She grew up in a loving and supportive family, with two hardworking parents who instilled in her the importance of education, kindness, and giving back to the community. From a young age, Jessica showed a natural talent for creativity and a passion for helping others, which would shape her into the remarkable young woman she is today.\n\nIn high school, Jessica was known for her above-average beauty and her above-average face, but she never let her looks define her. Instead, she focused on her studies and excelled academically, earning top grades and a reputation as a dedicated and driven student. Outside of school, Jessica spent most of her free time crafting and creating, always looking for new and innovative ways to express her creativity.\n\nAs she entered her senior year of high school, Jessica's love for DIY projects had grown into a full-blown passion. She spent hours watching tutorials, reading blogs, and experimenting with different materials and techniques. Her skills and projects caught the attention of her peers, who were amazed by her talent and often sought her help with their own DIY endeavors.\n\nBut Jessica's interests didn't stop there. She also had a heart for community service and making a positive impact in the world. She volunteered at local charities and organized fundraisers, using her DIY skills to create unique and eye-catching items to sell and raise money for various causes. Her altruistic spirit and dedication to helping others inspired those around her, and she quickly became a role model for her peers.\n\nAfter graduating high school with top honors, Jessica decided to take a gap year to explore her passions and figure out her next steps. During this time, she continued to create and share her DIY projects on social media, gaining a following of people who were inspired by her creativity and philanthropy. Jessica used her platform to raise awareness for various social issues and encourage her followers to give back to their communities.\n\nNow, at 19 years old, Jessica is a high school graduate with a passion for DIY, a heart for service, and a growing social media presence. She plans to attend college in the fall and major in art and design, with the goal of one day using her talents to make a positive impact on the world. Jessica's journey is just beginning, and she is determined to continue spreading kindness, creativity, and positivity wherever she goes."}
{"Name":"Mark Mccann","Age":31,"Sex":"male","Country of Origin":"USA","State or Province":"New York","Education Level":"Master","MBTI Personality":"ESTJ","Lifestyle":"law","Backstory":"Mark Mccann was born and raised in the bustling city of New York. His parents were hardworking blue-collar workers who instilled in him the value of education and determination. From a young age, Mark showed a keen interest in the law and justice system, often playing the role of a lawyer in make-believe court trials with his siblings.\n\nAs he grew older, Mark's passion for law only intensified. He excelled in his studies, graduating at the top of his class in high school. With the support of his family, he went on to pursue a Bachelor's degree in Political Science at a prestigious university in New York. During his undergraduate years, Mark was actively involved in various legal internships and organizations, honing his skills and gaining practical experience in the field.\n\nAfter completing his Bachelor's degree, Mark decided to further his education and enrolled in a Master's program in Law. He was determined to become a successful lawyer and make a positive impact in the world. His hard work and dedication paid off when he graduated with top honors from his Master's program.\n\nWith his degree in hand, Mark began his career as a lawyer in a renowned law firm in New York. His pragmatic and methodical approach to cases quickly caught the attention of his superiors, and he was soon promoted to a senior position. Mark's responsible and orderly nature made him a valuable asset to the firm, and he quickly gained a reputation for being a skilled and efficient lawyer.\n\nOutside of work, Mark's love for the law spills over into his personal life. His Instagram feed is filled with posts about legal news and his thoughts on current legal issues. He also uses his platform to educate and inform his followers about their legal rights.\n\nDespite his busy schedule, Mark makes time for his family and friends. He enjoys spending quality time with his loved ones, whether it's exploring the city or having a game night at home. Mark's slightly above average beauty and face have also caught the attention of many, but he remains focused on his career and making a positive impact in the world through his work.\n\nAs he continues to climb the ladder of success in his career, Mark remains humble and grateful for the opportunities that have come his way. He is determined to use his knowledge and skills to fight for justice and make a difference in the world, one case at a time."}
{"Name":"Yvonne Greene","Age":20,"Sex":"female","Country of Origin":"USA","State or Province":"Maryland","Education Level":"High School","MBTI Personality":"ENFJ","Lifestyle":"fashion","Backstory":"Yvonne Greene was born and raised in a small town in Maryland, USA. She grew up in a close-knit family, with her parents and two younger siblings. From a young age, Yvonne showed a strong interest in fashion and style, always dressing up in unique and creative outfits. Her parents, who were both working-class individuals, couldn't afford to buy her expensive clothes, but Yvonne didn't let that stop her from expressing herself through fashion.\n\nIn high school, Yvonne was known as the fashionista of her class. She would often mix and match thrift store finds with pieces from popular brands, creating her own unique style. Her classmates admired her sense of fashion and would often ask for her advice on how to put together outfits. Yvonne's confidence and eye for fashion made her stand out among her peers.\n\nDespite her love for fashion, Yvonne was also a dedicated student. She excelled in her academics and graduated from high school with top honors. Her dream was to pursue a degree in fashion design, but her family's financial situation made it difficult for her to attend a prestigious fashion school. Instead, Yvonne decided to attend a local community college and major in business.\n\nDuring her time at college, Yvonne continued to pursue her passion for fashion. She started a fashion blog and Instagram account where she shared her outfit ideas and fashion tips. Her unique style and positive messages quickly gained a following, and her social media presence grew.\n\nAfter graduating from college with a degree in business, Yvonne landed a job at a fashion magazine as a social media manager. She used her platform to promote diversity and inclusivity in the fashion industry, showcasing models of all shapes, sizes, and ethnicities. Yvonne's leadership and inspirational qualities shined through her work, and she became a role model for young women who looked up to her.\n\nNow, at the age of 20, Yvonne continues to work at the fashion magazine, but she also has her own fashion line. She uses her brand to promote body positivity and self-love, and her designs are loved by people of all ages. Yvonne's Instagram and lifestyle reflect her passion for fashion and her dedication to making a positive impact in the industry. She is a true inspiration to those around her and continues to use her platform to spread love, positivity, and inclusivity."}
{"Name":"Teresa Morrison","Age":19,"Sex":"female","Country of Origin":"USA","State or Province":"Florida","Education Level":"High School","MBTI Personality":"ISFP","Lifestyle":"food","Backstory":"Teresa Morrison grew up in the bustling city of Miami, Florida. From a young age, she was always surrounded by the vibrant culture and diverse cuisines that the city had to offer. Her parents, both successful chefs, instilled in her a love for food and cooking. As a result, Teresa developed a refined palate and a natural talent for creating delicious dishes.\n\nDespite her love for food, Teresa struggled academically in school. She found it difficult to focus on traditional subjects and often felt out of place in the rigid school system. However, her creativity and passion for food never wavered. In high school, she excelled in home economics and art classes, where she could express herself through cooking and painting.\n\nAfter graduating from high school with a degree, Teresa decided to take a gap year to travel and explore different cultures and cuisines. She documented her adventures on her Instagram page, which quickly gained a large following. Her photos of exotic dishes and breathtaking landscapes caught the attention of foodies and travel enthusiasts alike.\n\nDuring her travels, Teresa discovered her love for spontaneity and flexibility. She enjoyed immersing herself in new experiences and learning from different people and cultures. This carefree and adventurous nature was also reflected in her appearance, with her high cheekbones and striking features.\n\nAs she continued to travel, Teresa also found a passion for art. She would often spend hours sketching and painting the landscapes and people she encountered on her journeys. Her unique perspective and eye for detail caught the attention of local galleries, and she began to sell her artwork.\n\nNow, at 19 years old, Teresa has returned to Miami with a newfound appreciation for her hometown and its diverse food scene. She continues to share her love for food and art on her Instagram page, inspiring others to embrace their passions and live life to the fullest. With her flexible nature and artistic flair, Teresa is ready to take on any challenge that comes her way, whether it be in the kitchen or on a spontaneous adventure."}
{"Name":"Kathleen Fitzpatrick","Age":23,"Sex":"female","Country of Origin":"USA","State or Province":"Idaho","Education Level":"Bachelor","MBTI Personality":"INTJ","Lifestyle":"history","Backstory":"Kathleen Fitzpatrick was born and raised in the small town of Coeur d'Alene, Idaho. Growing up, she was always fascinated by the stories her grandfather would tell her about their family's history and the history of their town. Her parents, both teachers, instilled in her a love for learning and encouraged her curiosity about the past.\n\nAs Kathleen got older, her love for history only grew stronger. She devoured books on different time periods and cultures, and her thirst for knowledge led her to pursue a Bachelor's degree in History at the University of Idaho. Her professors were impressed by her intelligence and passion for the subject, and she quickly became known as one of the top students in her program.\n\nDuring her time at university, Kathleen also discovered a love for social media and the power it had to connect people from all over the world. She started an Instagram account where she would share interesting historical facts and stories, along with her own personal insights and opinions. Her unique blend of strategic thinking and intellectual depth caught the attention of many, and her following grew quickly.\n\nAfter graduating with honors, Kathleen decided to use her knowledge and passion for history to pursue a career as a social media strategist for museums and historical sites. She wanted to use her platform to bring attention to lesser-known stories and educate others about the importance of preserving our past.\n\nAt 23 years old, Kathleen has already made a name for herself in the world of history and social media. She continues to travel and explore new cultures, always seeking out new stories and experiences to share with her followers. With her slightly above average beauty and an equally above average mind, Kathleen is determined to make a difference in the world and leave a lasting impact on those around her."}
{"Name":"Amy White","Age":25,"Sex":"female","Country of Origin":"USA","State or Province":"Alabama","Education Level":"Bachelor","MBTI Personality":"ESTP","Lifestyle":"music","Backstory":"Amy White was born and raised in the heart of Alabama, USA. Growing up, she was always surrounded by the sounds of country music and the warm hospitality of the South. Her parents, both avid music lovers, instilled in her a deep appreciation for all genres of music and encouraged her to pursue her passion for it.\n\nFrom a young age, Amy showed a natural talent for singing and playing instruments. She would often spend hours in her room, strumming her guitar and belting out her favorite tunes. Her parents recognized her potential and enrolled her in music lessons, where she excelled and developed her skills even further.\n\nAs she approached her teenage years, Amy's love for music only grew stronger. She started writing her own songs and performing at local open mic nights. Her unique voice and stage presence caught the attention of many, and soon she was performing at larger events and gaining a following in her community.\n\nDespite her love for music, Amy's parents also emphasized the importance of education. She worked hard in school and graduated with top honors, earning a Bachelor's degree in Music Education. She then landed a job as a music teacher at a local high school, where she could share her passion with the next generation.\n\nOutside of her teaching job, Amy's life revolved around music. She started her own band, The White Roses, and they quickly gained popularity in the local music scene. Their energetic performances and catchy songs earned them a loyal fan base and opportunities to perform at music festivals and events across the state.\n\nAmy's Instagram feed is a reflection of her vibrant and adventurous lifestyle. She loves to travel and often posts pictures from her spontaneous road trips with her bandmates. Her followers also get a glimpse into her love for outdoor activities like hiking, camping, and kayaking.\n\nWith her above-average beauty and face, Amy has also caught the eye of many admirers. However, she remains focused on her music and has yet to find someone who shares her passion and zest for life.\n\nAt 25 years old, Amy's future is bright and full of possibilities. She dreams of one day touring the country with her band and sharing her love for music with the world. But for now, she is content with living in the moment, making memories, and spreading joy through her music."}
{"Name":"Vanessa Richards","Age":26,"Sex":"female","Country of Origin":"USA","State or Province":"Ohio","Education Level":"High School","MBTI Personality":"ISFP","Lifestyle":"gardening","Backstory":"Vanessa Richards was born and raised in a small town in Ohio, USA. Growing up, she was always surrounded by nature and developed a love for the outdoors at a young age. Her parents, both avid gardeners, instilled in her a deep appreciation for plants and the beauty of a well-maintained garden.\n\nDespite her love for nature, Vanessa struggled in school. She found it difficult to focus on traditional subjects and often felt like she didn't fit in with her peers. However, she discovered her passion for art and creativity in high school and poured all of her energy into honing her skills.\n\nAfter graduating with a high school degree, Vanessa wasn't sure what she wanted to do with her life. She briefly attended college, but it didn't feel like the right path for her. Instead, she took a leap of faith and decided to pursue her passion for gardening.\n\nVanessa started a small gardening business, offering her services to her local community. She quickly gained a reputation for her artistic eye and ability to transform even the most neglected gardens into beautiful, thriving spaces. Her clients were not only impressed by her gardening skills, but also by her warm and adaptable personality.\n\nAs her business grew, Vanessa began sharing her gardening journey on Instagram. She used the platform as a way to showcase her work and connect with other gardeners around the world. Her posts were a mix of stunning garden photos, DIY projects, and tips and tricks for fellow green thumbs.\n\nThrough her Instagram, Vanessa found a sense of community and belonging that she had never experienced before. She also discovered a love for photography and graphic design, using her artistic abilities to curate a visually appealing and cohesive feed.\n\nNow, at 26 years old, Vanessa's gardening business is thriving and her Instagram following continues to grow. She has become known as a go-to source for gardening inspiration and her posts reflect her passion for nature and her creative spirit. With her slightly above average beauty and face, Vanessa's Instagram and lifestyle have become a true reflection of her journey towards finding her true passion and embracing her unique talents."}
{"Name":"Susan Calderon","Age":18,"Sex":"female","Country of Origin":"USA","State or Province":"Georgia","Education Level":"High School","MBTI Personality":"ISTJ","Lifestyle":"food","Backstory":"Susan Calderon was born and raised in a small town in Georgia, USA. She was the youngest of three children and the only girl in the family. Growing up, Susan was always surrounded by the delicious aromas of her mother's home-cooked meals and her father's backyard barbecues. It was no surprise that she developed a love for food at a young age.\n\nAs she grew older, Susan's passion for food only grew stronger. She spent countless hours in the kitchen with her mother, learning family recipes and experimenting with new flavors and ingredients. Her friends and family were always amazed by her cooking skills and encouraged her to pursue a career in the culinary world.\n\nDespite her love for food, Susan was also a dedicated student. She excelled in her classes and graduated high school with top honors. Her parents, who had always instilled in her the importance of education, were proud of her achievements and encouraged her to continue her studies.\n\nSusan decided to attend a prestigious culinary school in New York City, where she could learn from some of the best chefs in the world. Her parents were hesitant at first, worried about their daughter moving to a big city on her own. But Susan was determined to follow her dreams and they eventually gave their blessing.\n\nDuring her time in New York, Susan's exceptional beauty and exceptional face caught the attention of many, and she was often approached by modeling agencies. However, she remained focused on her studies and refused to be distracted by the glitz and glamour of the fashion industry.\n\nAfter graduating with a degree in Culinary Arts, Susan returned to her hometown in Georgia. She opened her own restaurant, where she combined her love for traditional Southern cuisine with the skills she learned in New York. Her restaurant quickly became a local favorite, known for its delicious food and warm hospitality.\n\nSusan's success on social media also helped to put her restaurant on the map. Her Instagram page was filled with mouth-watering photos of her dishes, and her followers couldn't get enough. She also used her platform to promote traditional values and the importance of family, which resonated with many of her fans.\n\nDespite her busy schedule as a restaurant owner, Susan always made time for her family and friends. She continued to live by the values her parents had instilled in her - hard work, dedication, and a strong sense of community.\n\nAt 18 years old, Susan may seem young, but her unwavering commitment to her passion and her traditional values have made her wise beyond her years. She is a role model for many, and her future in the culinary world looks bright."}
{"Name":"Alicia Whitaker","Age":24,"Sex":"female","Country of Origin":"USA","State or Province":"Iowa","Education Level":"Bachelor","MBTI Personality":"INFJ","Lifestyle":"psychology","Backstory":"Alicia Whitaker was born and raised in a small town in Iowa, USA. From a young age, she was always fascinated by the inner workings of the human mind. She would spend hours observing people and trying to understand their thoughts and emotions. Her parents, both teachers, encouraged her curiosity and nurtured her love for learning.\n\nAs she grew older, Alicia's passion for psychology only intensified. She excelled in her studies and graduated at the top of her high school class. With a burning desire to further her knowledge, she enrolled in a prestigious university and pursued a Bachelor's degree in Psychology.\n\nDuring her time at university, Alicia immersed herself in her studies and was known for her intuitive nature and keen understanding of human behavior. She spent countless hours conducting research and participating in various internships, gaining valuable hands-on experience in the field.\n\nAfter graduating with honors, Alicia returned to her hometown in Iowa. With her degree in hand, she was determined to make a difference in the lives of others. She started her own practice, offering counseling services to those in need. Her clients were drawn to her empathetic nature and her ability to truly understand and connect with them.\n\nIn her free time, Alicia enjoys expressing her creativity through photography and sharing her thoughts and insights on her Instagram page. Her stunning appearance, described by many as having \"high beauty and an high face,\" often catches the attention of her followers, but it's her thought-provoking content that keeps them engaged.\n\nAlicia's passion for psychology has not only shaped her career but also her lifestyle. She is constantly seeking to understand the complexities of human emotions and uses her knowledge to help those around her. With her compassionate heart and unwavering determination, Alicia is on a mission to make the world a better place, one person at a time."}
{"Name":"Alexandra Turner","Age":21,"Sex":"female","Country of Origin":"USA","State or Province":"Virginia","Education Level":"High School","MBTI Personality":"ISFP","Lifestyle":"pets","Backstory":"Alexandra Turner was born and raised in the quaint town of Charlottesville, Virginia. Growing up, she was always surrounded by animals, as her parents were both veterinarians who ran their own clinic. From a young age, Alexandra had a natural affinity for animals and spent most of her childhood days playing with the dogs and cats that were brought into the clinic.\n\nAs she got older, Alexandra's love for animals only grew stronger. She would often volunteer at local animal shelters and spend her weekends fostering abandoned or injured animals. Her passion for helping animals led her to pursue a degree in veterinary medicine after high school. However, during her senior year of high school, Alexandra's life took an unexpected turn.\n\nWhile scrolling through social media, Alexandra stumbled upon a post about a stray dog that was in desperate need of a home. Without hesitation, she reached out to the person who had posted the picture and offered to take the dog in. This dog, named Max, would become Alexandra's best friend and loyal companion for the rest of her life.\n\nMax's arrival also sparked Alexandra's interest in photography. She would spend hours taking photos of Max and other animals she encountered, capturing their unique personalities and moments of pure joy. Her Instagram account quickly became a hit, as people were drawn to her stunning photos and heartwarming stories about her furry friends.\n\nAfter graduating high school, Alexandra decided to put her dreams of becoming a veterinarian on hold and instead pursued a career in photography. She moved to New York City to attend a prestigious art school and hone her skills. Her natural talent and eye for capturing the perfect shot quickly caught the attention of major brands and magazines, and she soon became a sought-after pet photographer.\n\nNow at 21 years old, Alexandra has made a name for herself in the world of pet photography. Her Instagram account has a large following, and her work has been featured in numerous publications. She continues to use her platform to raise awareness about animal welfare and hopes to one day open her own animal sanctuary. With her beauty, talent, and love for animals, Alexandra Turner is truly a force to be reckoned with."}
{"Name":"Beth Carrillo","Age":26,"Sex":"female","Country of Origin":"USA","State or Province":"Kentucky","Education Level":"Master","MBTI Personality":"ISFP","Lifestyle":"diy","Backstory":"Beth Carrillo was born and raised in the heart of Kentucky, USA. Growing up in a small town, she always had a love for DIY projects and creating things with her hands. Her parents, both artists themselves, encouraged her creativity and she spent most of her childhood tinkering with different crafts and learning new techniques.\n\nAs she got older, Beth's passion for art and DIY only grew stronger. She excelled in her art classes throughout high school and knew that she wanted to pursue a career in the creative field. After graduating, she decided to attend a prestigious art school in New York City to further her skills and knowledge.\n\nDuring her time in New York, Beth's love for DIY expanded beyond just art. She discovered a whole community of people who shared her passion for creating things from scratch and transforming ordinary objects into something beautiful and unique. She also found a love for photography and started sharing her creations on Instagram, quickly gaining a following of like-minded individuals.\n\nAfter completing her Master's degree in Fine Arts, Beth returned to her hometown in Kentucky. She began working at a local art studio, teaching classes and selling her own handmade pieces. Her Instagram page continued to grow, showcasing her diverse range of talents and projects.\n\nAt 26 years old, Beth is known in her community as the go-to person for all things DIY. Her above average beauty and face make her stand out, but it's her artistic abilities and adaptable personality that truly shine through. She is always willing to take on new challenges and experiment with different techniques, making her Instagram feed a source of inspiration for her followers.\n\nDespite her success, Beth remains humble and down to earth. She is grateful for her supportive family and friends who have always encouraged her to pursue her passions. With her creativity, determination, and love for DIY, there is no doubt that Beth Carrillo will continue to make a name for herself in the art world."}
{"Name":"Deborah James","Age":21,"Sex":"female","Country of Origin":"USA","State or Province":"Tennessee","Education Level":"High School","MBTI Personality":"ESFP","Lifestyle":"lifestyle","Backstory":"Deborah James was born and raised in a small town in Tennessee, USA. Growing up, she was always known for her bubbly personality and infectious energy. Her parents, both hardworking individuals, instilled in her the value of education and the importance of chasing one's dreams. Deborah took this advice to heart and excelled in school, graduating with top honors from her high school.\n\nDespite her academic success, Deborah always had a passion for living life to the fullest. She was never one to conform to societal norms and instead, embraced her individuality. Her free-spirited nature and love for adventure often led her to spontaneous trips and social gatherings with friends. She was always the life of the party, radiating her charismatic and playful personality wherever she went.\n\nAfter graduating from high school, Deborah decided to take a gap year to travel and explore different cultures. She documented her journey through her Instagram account, which quickly gained a large following due to her beautiful photos and adventurous spirit. Her posts often reflected her passion for lifestyle, showcasing her love for fashion, food, and travel.\n\nDuring her travels, Deborah discovered her love for photography and decided to pursue it as a career. She enrolled in a photography course and honed her skills, eventually starting her own lifestyle photography business. Her unique eye for capturing moments and her charming personality made her a sought-after photographer in her town.\n\nNow, at 21 years old, Deborah has achieved her dream of becoming a successful lifestyle photographer. She continues to travel and explore new places, always seeking new adventures to capture through her lens. Her Instagram and lifestyle still reflect her passion for living life to the fullest, inspiring others to do the same. With her high beauty and an even higher spirit, Deborah James is a force to be reckoned with, spreading joy and positivity wherever she goes."}
{"Name":"Susan Smith","Age":29,"Sex":"female","Country of Origin":"USA","State or Province":"California","Education Level":"High School","MBTI Personality":"ISFP","Lifestyle":"gardening","Backstory":"Susan Smith was born and raised in sunny California, USA. Growing up, she was always surrounded by the beauty of nature and developed a deep appreciation for it at a young age. Her parents were avid gardeners and passed down their love for plants and flowers to her.\n\nDespite her interest in gardening, Susan struggled in school and was often labeled as a daydreamer. She found it difficult to focus on traditional subjects and instead spent her time doodling and writing poetry. Despite her struggles, she managed to graduate high school with an average GPA.\n\nAfter graduation, Susan wasn't sure what she wanted to do with her life. She tried a few different jobs, but never felt fulfilled. It wasn't until she stumbled upon a community garden in her neighborhood that she found her true passion. She began volunteering there, learning everything she could about gardening and landscaping.\n\nAs she immersed herself in the world of gardening, Susan's creativity flourished. She started documenting her journey on Instagram, sharing photos of her colorful and vibrant garden. Her followers were drawn to her unique and artistic style, and her account quickly gained popularity.\n\nThrough her Instagram, Susan found a community of like-minded individuals who shared her love for gardening. She started hosting workshops and selling her own handmade planters and artwork. Her business began to thrive, and she was able to quit her job and focus on her passion full-time.\n\nNow, at 29 years old, Susan is living her dream. Her Instagram and lifestyle reflect her sensitive and spontaneous nature, as well as her love for all things colorful and artistic. She may not have a traditional career or a college degree, but she has found true happiness and fulfillment through her love for gardening. And she continues to inspire others to follow their passions and embrace their unique talents, no matter how unconventional they may seem."}
{"Name":"Debra Robinson","Age":19,"Sex":"female","Country of Origin":"Canada","State or Province":"Quebec","Education Level":"No High School","MBTI Personality":"ENFJ","Lifestyle":"parenting","Backstory":"Debra Robinson was born and raised in a small town in Quebec, Canada. She was the youngest of three siblings and the only girl in the family. Her parents were hardworking blue-collar workers who instilled in her the value of determination and perseverance.\n\nGrowing up, Debra was always a curious and ambitious child. She excelled in school, but her true passion was for parenting. From a young age, she would spend hours playing with her dolls and pretending to be a mother. As she got older, her love for children only grew stronger.\n\nHowever, when Debra was 13 years old, tragedy struck her family. Her father, the sole breadwinner, passed away suddenly, leaving her mother to raise three children on her own. With limited resources, Debra's mother struggled to make ends meet and was unable to afford to send her children to school.\n\nDetermined to help her family, Debra dropped out of high school at the age of 16 and started working odd jobs to contribute to the household income. Despite not having a formal education, she was a quick learner and excelled in every job she took on.\n\nAt the age of 19, Debra found out she was pregnant. While some may have seen this as a setback, Debra saw it as an opportunity to fulfill her lifelong dream of becoming a mother. She embraced motherhood with open arms and poured all her love and energy into raising her child.\n\nAs a young single mother, Debra faced many challenges, but she never let them discourage her. She used her social media platform to share her experiences and inspire other young mothers to never give up on their dreams. Her posts about parenting and self-love gained a lot of attention, and soon she became known as a leader and role model in her community.\n\nToday, Debra is a successful entrepreneur, running her own business selling handcrafted baby products. She also volunteers at a local non-profit organization, providing support and resources to young single mothers. Her exceptional beauty and exceptional face are a reflection of her inner strength and resilience. Debra's journey may have started with a difficult childhood and lack of education, but she has proven that with determination and passion, anything is possible."}
{"Name":"Mrs. Terry Young","Age":19,"Sex":"female","Country of Origin":"USA","State or Province":"Illinois","Education Level":"High School","MBTI Personality":"ESFP","Lifestyle":"diy","Backstory":"Mrs. Terry Young was born and raised in a small town in Illinois, USA. She was the youngest of three siblings and was always known for her exceptional beauty and infectious smile. Growing up, Terry was always a creative and independent spirit, constantly finding new ways to express herself. Her parents, both hardworking individuals, instilled in her the value of hard work and determination.\n\nDespite her natural talent and love for art, Terry's parents encouraged her to focus on her studies and pursue a more traditional career path. So, after graduating high school with top honors, Terry decided to attend college and study business. However, deep down, she knew that her true passion lay in creating and crafting.\n\nIn her free time, Terry would often spend hours on end watching DIY videos and tutorials, learning new techniques and skills. She found joy in transforming ordinary objects into something extraordinary and loved the feeling of accomplishment that came with it. Her friends and family were always amazed by her creativity and encouraged her to share her talents with the world.\n\nAfter graduating college with a degree in business, Terry landed a job at a prestigious marketing firm in the city. While she enjoyed her job, she felt like something was missing. She longed for a creative outlet and decided to start a DIY Instagram account to showcase her projects. To her surprise, her account gained a massive following in a short period of time, and she quickly became known as the go-to person for all things DIY.\n\nAs her following grew, Terry's love for DIY only intensified. She started hosting workshops and collaborating with other creatives, spreading her love for crafting and inspiring others to unleash their creativity. Her Instagram and lifestyle became a reflection of her vibrant personality and passion for DIY, capturing joy in every moment.\n\nNow, at 19 years old, Mrs. Terry Young has become a successful DIY influencer and entrepreneur, using her platform to spread positivity and inspire others to follow their passions. Her exceptional beauty and exceptional face may have caught people's attention, but it's her passion and determination that have made her a role model for many."}
{"Name":"Nicholas Espinoza","Age":32,"Sex":"male","Country of Origin":"USA","State or Province":"Texas","Education Level":"Master","MBTI Personality":"INTJ","Lifestyle":"science","Backstory":"Nicholas Espinoza was born and raised in a small town in Texas, USA. From a young age, he showed a natural curiosity and interest in the world around him. His parents, both engineers, encouraged his love for science and nurtured his inquisitive nature.\n\nAs he grew older, Nicholas excelled in his studies, particularly in the fields of math and science. He was always top of his class and his teachers often praised him for his exceptional problem-solving skills. It was clear that he had a natural talent for understanding complex concepts and theories.\n\nAfter graduating high school, Nicholas went on to study at a prestigious university, where he pursued a degree in physics. His passion for science only grew stronger as he delved deeper into the subject. He spent countless hours in the lab, conducting experiments and pushing the boundaries of what was thought to be possible.\n\nUpon completing his undergraduate degree, Nicholas decided to further his education and pursue a Master's degree in astrophysics. It was during this time that he made a breakthrough discovery in the field, earning him recognition and praise from his peers and professors.\n\nAfter graduating with top honors, Nicholas was offered a job at a renowned research institute in California. He quickly became known as one of the most brilliant minds in the field of astrophysics, and his work was highly sought after by top scientists and organizations around the world.\n\nDespite his success, Nicholas remained humble and down to earth. He used his platform to inspire and educate others about the wonders of science, often sharing his insights and theories on his popular Instagram page. His exceptional beauty and sharp mind made him a social media sensation, with many followers eager to learn from him.\n\nNow, at the age of 32, Nicholas continues to push the boundaries of science and make groundbreaking discoveries. He is a true testament to the power of passion, hard work, and determination. And his Instagram and lifestyle reflect just that \u2013 a man who is not only exceptional in his appearance but also in his mind."}
{"Name":"Melissa Duncan","Age":20,"Sex":"female","Country of Origin":"USA","State or Province":"Michigan","Education Level":"High School","MBTI Personality":"INFP","Lifestyle":"comedy","Backstory":"Melissa Duncan was born and raised in a small town in Michigan, USA. She was the youngest of three siblings and the only girl in the family. Growing up, Melissa was always known for her quick wit and sense of humor. She would often make her family and friends laugh with her jokes and impersonations.\n\nAs she got older, Melissa's love for comedy only grew stronger. She would spend hours watching stand-up specials and comedy shows, studying the delivery and timing of the jokes. In high school, she joined the drama club and quickly became the star of the school's comedy skits. Her classmates and teachers couldn't get enough of her performances.\n\nDespite her natural talent for comedy, Melissa's parents were hesitant about her pursuing a career in the entertainment industry. They wanted her to focus on getting a stable job and going to college. However, Melissa couldn't ignore her passion for making people laugh and decided to follow her dreams.\n\nAfter graduating high school with top grades, Melissa moved to Los Angeles to pursue a career in comedy. She enrolled in a local acting school and took improv classes to hone her skills. She also started posting comedy sketches on Instagram, which gained a lot of attention and followers.\n\nMelissa's exceptional beauty and unique sense of humor quickly caught the eye of talent scouts and she landed her first gig as a stand-up comedian at a local comedy club. Her performances were a hit, and soon she was performing at bigger venues and even opening for well-known comedians.\n\nDespite her success, Melissa remains humble and grounded. She uses her platform to spread positivity and share her deep compassion for the world. She often posts about social issues and encourages her followers to find and express beauty in everything.\n\nNow at 20 years old, Melissa has become a rising star in the comedy world. She continues to work hard, writing and performing new material, and hopes to one day have her own comedy special. With her exceptional beauty and exceptional talent, there's no doubt that Melissa Duncan is destined for great things in the world of comedy."}
{"Name":"Katie Martinez","Age":29,"Sex":"female","Country of Origin":"Canada","State or Province":"Prince Edward Island","Education Level":"Master","MBTI Personality":"ESFJ","Lifestyle":"parenting","Backstory":"Katie Martinez was born and raised in the picturesque province of Prince Edward Island, Canada. Growing up in a close-knit community, she was surrounded by love and support from her family and friends. From a young age, Katie was known for her kind and nurturing nature, always eager to help those in need.\n\nAs she grew older, Katie's passion for parenting began to develop. She was the oldest of four siblings and often took on the role of a second mother, helping her parents with the household responsibilities and caring for her younger siblings. Her natural maternal instincts and love for children made her dream of one day becoming a mother herself.\n\nAfter graduating high school, Katie pursued her education at the University of Prince Edward Island, where she earned a Master's degree in Child Development. During her studies, she also volunteered at local childcare centers, gaining valuable hands-on experience in working with children of all ages.\n\nUpon completing her studies, Katie landed a job at a prestigious preschool in Charlottetown, the capital city of Prince Edward Island. Her dedication and passion for her work quickly earned her the respect and admiration of her colleagues and the parents of the children she cared for.\n\nOutside of her career, Katie's social circle was filled with other young parents and families. She was known as the go-to person for parenting advice and support, always willing to lend an ear and offer a helping hand. Her harmonious and supportive personality made her a beloved member of her community.\n\nKatie's Instagram and lifestyle reflect her love for parenting. She often shares content that showcases her role as a mother and the joys and challenges of raising children. Her followers admire her for her honesty and relatability, describing her as having an \"average beauty and an average face,\" but radiating with warmth and love.\n\nAs she approaches her thirties, Katie looks forward to starting a family of her own with her loving husband. She dreams of creating a happy and nurturing home for her children, just like the one she had growing up on the beautiful island of Prince Edward Island."}
{"Name":"Linda Dixon","Age":24,"Sex":"female","Country of Origin":"Canada","State or Province":"Newfoundland and Labrador","Education Level":"Bachelor","MBTI Personality":"ESFP","Lifestyle":"fashion","Backstory":"Linda Dixon was born and raised in the beautiful province of Newfoundland and Labrador, Canada. Growing up, she was always fascinated by the vibrant colors and textures of the traditional clothing worn by the locals. This sparked her interest in fashion from a young age, and she would often spend hours playing dress-up with her grandmother's old clothes.\n\nAs she grew older, Linda's love for fashion only intensified. She would spend her free time sketching designs and browsing through fashion magazines, dreaming of one day becoming a designer herself. Her parents, who were both teachers, encouraged her to pursue her passion and even enrolled her in sewing classes.\n\nAfter graduating high school, Linda decided to further her education by attending a prestigious fashion school in Toronto. She excelled in her studies and graduated with a Bachelor's degree in Fashion Design. Armed with the knowledge and skills she acquired, Linda returned to her hometown to start her own fashion line.\n\nHer brand quickly gained recognition for its unique and bold designs, inspired by the traditional clothing of her home province. Linda's designs were a celebration of her heritage, and she was proud to showcase them to the world.\n\nIn addition to her thriving fashion career, Linda also had a love for social media. She saw it as a platform to express her creativity and share her passion for fashion with a wider audience. Her Instagram account became a visual diary of her life, filled with colorful and engaging posts that reflected her vivacious personality.\n\nAt just 24 years old, Linda has become a well-known figure in the fashion industry, with her designs being featured in magazines and worn by celebrities. But despite her success, she remains humble and grounded, always remembering her roots and the beauty of her home province that inspired her journey."}
{"Name":"Stacy Martinez","Age":25,"Sex":"female","Country of Origin":"USA","State or Province":"South Carolina","Education Level":"High School","MBTI Personality":"ENFJ","Lifestyle":"education","Backstory":"Stacy Martinez was born and raised in a small town in South Carolina, USA. She was the youngest of three children, with two older brothers who were both successful in their own right. Growing up, Stacy was always surrounded by books and encouraged to pursue her education. Her parents, both immigrants from Mexico, instilled in her the value of hard work and determination.\n\nDespite coming from a humble background, Stacy excelled in school and was a top student throughout her academic years. She had a natural curiosity and thirst for knowledge, which led her to excel in various subjects. Her teachers often praised her for her intelligence and dedication, and she was a role model for her peers.\n\nAfter graduating high school with top honors, Stacy faced a difficult decision. Her family couldn't afford to send her to a prestigious university, but she refused to let that stop her from pursuing her dreams. With the support of her family and scholarships, she was able to attend a local community college and earn her degree in Education.\n\nStacy's passion for education only grew stronger during her college years. She was determined to make a difference in the lives of young students and inspire them to reach their full potential. After graduating, she landed her dream job as a high school English teacher.\n\nAs a teacher, Stacy's empathetic and influential personality shone through in her interactions with her students. She was not only a teacher but also a mentor and friend to many of them. Her ability to understand and inspire people was evident in the way her students looked up to her and excelled in her classes.\n\nOutside of her teaching career, Stacy's Instagram and lifestyle reflected her passion for education. She often shared content that highlighted the importance of education and the impact it can have on one's life. Her posts also showcased her love for reading and writing, and she often recommended books to her followers.\n\nDespite being only 25 years old, Stacy had already made a significant impact in her community. She was a role model for young girls and a source of inspiration for many. With her slightly above average beauty and face, she used her platform to spread positivity and encourage others to pursue their dreams. Stacy's journey from a small town to becoming an influential educator was a testament to her determination and hard work, and she was determined to continue making a difference in the lives of others."}
{"Name":"Chelsey Howell","Age":22,"Sex":"female","Country of Origin":"USA","State or Province":"New York","Education Level":"High School","MBTI Personality":"INFP","Lifestyle":"psychology","Backstory":"Chelsey Howell was born and raised in the bustling city of New York. Growing up, she was always a curious and observant child, constantly questioning the world around her and trying to understand the complexities of human behavior. Her parents, both successful lawyers, instilled in her a strong work ethic and a love for learning.\n\nIn high school, Chelsey excelled in her studies, particularly in psychology. She was drawn to the subject, fascinated by the inner workings of the mind and how it shapes our thoughts and actions. Her classmates often sought her out for advice and she was known as the go-to person for any personal problems.\n\nAfter graduating with top honors, Chelsey decided to pursue her passion for psychology and enrolled in a prestigious university in New York City. She dove headfirst into her studies, immersing herself in various courses and research projects. Her professors were impressed by her intelligence and dedication, and she quickly became a star student.\n\nBut Chelsey's love for psychology went beyond the classroom. She also spent her free time reading books and articles on the subject, attending conferences and workshops, and engaging in discussions with her peers. Her Instagram account became a reflection of her interests, with posts about the latest psychological theories, self-care tips, and inspirational quotes.\n\nDespite her busy schedule, Chelsey made time for her friends and family. She was known for her kind and empathetic nature, always willing to lend an ear and offer support. Her friends often joked that she was like their personal therapist.\n\nNow, at the age of 22, Chelsey has graduated from university with a degree in psychology. She is determined to use her knowledge and skills to help others, whether it be through counseling, research, or advocacy work. Her ultimate goal is to make a positive impact on society and break the stigma surrounding mental health.\n\nWith her above-average beauty and an above-average face, Chelsey may seem like the typical Instagram influencer. But behind her picture-perfect lifestyle lies a passionate and driven young woman, ready to make a difference in the world through her love for psychology."}
{"Name":"Lindsay Weaver","Age":25,"Sex":"female","Country of Origin":"USA","State or Province":"Texas","Education Level":"High School","MBTI Personality":"INFJ","Lifestyle":"architecture","Backstory":"Lindsay Weaver was born and raised in a small town in Texas, USA. She grew up in a modest household, with her parents and two younger siblings. From a young age, Lindsay showed a keen interest in art and design, often spending hours drawing and creating intricate structures out of Legos.\n\nAs she got older, her passion for architecture grew stronger. She would spend hours exploring abandoned buildings in her town, imagining the possibilities of what they could become with a little bit of creativity and vision. Her high school years were filled with art and design classes, where she excelled and received numerous awards for her work.\n\nDespite her love for architecture, Lindsay's parents wanted her to pursue a more practical career. They believed that her passion for art and design was just a phase and that she needed to focus on getting a degree in a more stable field. Reluctantly, Lindsay followed their advice and enrolled in a business program at a local community college after graduating high school.\n\nHowever, it didn't take long for Lindsay to realize that business was not her calling. She found herself daydreaming about buildings and structures during lectures and spending her free time sketching out designs. After a year of struggling to find motivation in her studies, Lindsay made the bold decision to drop out of college and pursue her dream of becoming an architect.\n\nHer parents were initially disappointed and worried about her decision, but they could see the fire in her eyes and eventually supported her choice. Lindsay moved to a larger city in Texas and enrolled in a prestigious architecture program at a university.\n\nDuring her studies, Lindsay's talent and passion for architecture shone through. She received top grades and was often praised for her unique and innovative designs. Her professors and peers were impressed by her ability to think outside the box and bring her visions to life.\n\nOutside of her studies, Lindsay started an Instagram account to showcase her work and connect with other architects and designers. Her page quickly gained a following, and she became known for her visionary thoughts and empathetic outlook towards life. Her posts not only showcased her designs but also highlighted the impact that architecture can have on people's lives.\n\nNow, at 25 years old, Lindsay has graduated from university with a degree in architecture. She has already landed her dream job at a renowned architecture firm and continues to use her platform to inspire and educate others about the power of architecture. Despite her average appearance, Lindsay's passion and talent for architecture make her stand out in a crowd, and her Instagram remains a mirror to her soul, reflecting her love for all things design."}
{"Name":"Sydney Lane","Age":25,"Sex":"female","Country of Origin":"Canada","State or Province":"British Columbia","Education Level":"High School","MBTI Personality":"INTP","Lifestyle":"gardening","Backstory":"Sydney Lane was born and raised in the beautiful province of British Columbia, Canada. From a young age, she was always drawn to nature and spent most of her childhood exploring the lush forests and pristine lakes surrounding her home. Her parents, both avid gardeners, instilled in her a love for plants and the environment, which would shape her future in ways she never imagined.\n\nGrowing up, Sydney was always a curious and creative child. She excelled in school, particularly in the sciences, and had a natural talent for problem-solving. However, her true passion lay in the world of gardening and horticulture. She spent countless hours tending to her family's garden, experimenting with different plants and techniques, and learning everything she could about the art of gardening.\n\nAs she entered high school, Sydney's love for gardening only grew stronger. She joined the school's gardening club and quickly became a leader within the group. Her classmates were amazed by her knowledge and skills, and she often helped them with their own gardening projects. It was during this time that Sydney's Instagram account, dedicated to her gardening adventures, started to gain a following.\n\nAfter graduating from high school with top honors, Sydney decided to pursue her passion for gardening further. She enrolled in a horticulture program at a local college and excelled in her studies. Her professors were impressed by her dedication and natural talent, and she quickly became known as the \"garden guru\" among her peers.\n\nUpon completing her degree, Sydney landed a job at a prestigious botanical garden in Vancouver. She worked tirelessly, using her innovative ideas and techniques to transform the gardens into a stunning oasis. Her work caught the attention of the media, and she soon became a well-known figure in the gardening community.\n\nNow, at 25 years old, Sydney Lane is a successful horticulturist and influencer. Her Instagram account has grown into a platform for sharing her knowledge and inspiring others to connect with nature through gardening. Her unconventional approach and stunning content have gained her a loyal following, and her impact on the gardening world continues to grow.\n\nDespite her above-average beauty and face, Sydney remains humble and down-to-earth. She is constantly seeking new challenges and ways to push the boundaries of conventional gardening. Her ingenuity and inquisitive mind have led her to become a true pioneer in the industry, and she shows no signs of slowing down."}
{"Name":"Ashley Green","Age":37,"Sex":"female","Country of Origin":"USA","State or Province":"California","Education Level":"High School","MBTI Personality":"ENTJ","Lifestyle":"food","Backstory":"Ashley Green was born and raised in sunny California, USA. Growing up, she was always surrounded by fresh produce and delicious food, thanks to her parents who owned a small farm. From a young age, Ashley developed a love for cooking and experimenting with different flavors in the kitchen.\n\nDespite her love for food, Ashley's parents always emphasized the importance of education. They wanted her to have a stable career, so she focused on her studies and graduated high school with top grades. However, her passion for food never faded, and she often found herself spending her free time trying out new recipes and sharing them with her friends and family.\n\nAfter high school, Ashley pursued a degree in business management, hoping to one day open her own restaurant. She worked hard and graduated with honors, but instead of jumping into the corporate world, she decided to take a gap year and travel the world. During her travels, she immersed herself in different cultures and cuisines, learning new techniques and flavors along the way.\n\nWhen she returned to California, Ashley was determined to turn her passion for food into a career. She started a food blog and Instagram account, sharing her recipes and food adventures with the world. Her content caught the attention of many, and soon she had a loyal following of food enthusiasts and aspiring chefs.\n\nAshley's natural ability to lead and strategize became evident in her social media presence. She used her platform to not only showcase her love for food but also to promote local and sustainable ingredients. Her posts were not just about pretty pictures, but they also had a strong message about supporting small businesses and being conscious of our food choices.\n\nToday, at 37 years old, Ashley is a successful food blogger and influencer. She has partnered with various brands and restaurants, and her blog has become a go-to for foodies looking for new and exciting recipes. Her dream of owning a restaurant is still in the works, but for now, she is happy inspiring others to follow their passions and live a delicious life."}
{"Name":"Catherine Lane","Age":30,"Sex":"female","Country of Origin":"USA","State or Province":"Florida","Education Level":"Master","MBTI Personality":"INTJ","Lifestyle":"science","Backstory":"Catherine Lane was born and raised in the sunny state of Florida, USA. From a young age, she showed a natural curiosity and love for science, constantly asking questions and conducting her own experiments in her backyard. Her parents, both successful doctors, encouraged her interests and enrolled her in various science camps and programs throughout her childhood.\n\nAs she grew older, Catherine's passion for science only intensified. She excelled in her science classes in school and was always eager to learn more. Her hard work and dedication paid off when she was accepted into a prestigious university, where she pursued a degree in Biochemistry.\n\nDuring her time in university, Catherine's intelligence and drive caught the attention of her professors, who encouraged her to further her education and pursue a Master's degree. Catherine eagerly accepted the challenge and threw herself into her studies, immersing herself in research and constantly seeking out new and innovative ideas.\n\nAfter completing her Master's degree, Catherine landed a job at a top research facility in Florida. She quickly made a name for herself in the scientific community, publishing groundbreaking research and making significant contributions to her field. Her colleagues often described her as a strategic thinker with a sharp intellect and a passion for pushing the boundaries of science.\n\nOutside of her work, Catherine's Instagram feed reflects her love for science and her thirst for knowledge. She shares insights and ideas that challenge the status quo and inspire others to think outside the box. Her followers admire her for her intelligence, but also for her down-to-earth nature and approachable personality.\n\nAt 30 years old, Catherine Lane is a respected scientist, influencer, and role model. Her slightly above average beauty and face may catch people's attention, but it's her intelligence and passion for science that truly make her stand out. She continues to push the boundaries of what is possible and inspire others to do the same, leaving a lasting impact on the world of science."}
{"Name":"Amy Dean","Age":24,"Sex":"female","Country of Origin":"USA","State or Province":"Georgia","Education Level":"Bachelor","MBTI Personality":"ENFP","Lifestyle":"health","Backstory":"Amy Dean was born and raised in the heart of Georgia, USA. She was the youngest of three siblings and grew up in a close-knit family. From a young age, Amy showed a keen interest in health and wellness, always opting for the healthier options and participating in sports and outdoor activities.\n\nAs she grew older, Amy's passion for health only intensified. She was determined to learn everything she could about nutrition, fitness, and overall well-being. She excelled in her studies and graduated with a Bachelor's degree in Health Sciences from the University of Georgia.\n\nAfter graduation, Amy moved to the bustling city of Atlanta to pursue her career in the health and wellness industry. She landed a job at a prominent health and fitness company, where she worked as a nutritionist and personal trainer. Her dedication and enthusiasm for her work quickly gained her a reputation as one of the best in the field.\n\nOutside of her work, Amy's Instagram and lifestyle reflected her passion for health. She shared her daily routines, workouts, and healthy recipes, inspiring her followers to lead a healthier lifestyle. Her posts were always accompanied by stunning photos of her adventures, showcasing her above-average beauty and an above-average face.\n\nBut Amy's love for health and wellness didn't stop there. She was also a creative soul, always finding new and inventive ways to incorporate her passion into her everyday life. From painting to photography, she used her creativity to spread positivity and optimism to those around her.\n\nDespite her busy schedule, Amy always made time for herself. She believed in the importance of self-care and made sure to prioritize her mental and emotional well-being. Her positive outlook on life and her adventurous spirit made her a magnet for new experiences and opportunities.\n\nAs she continues to thrive in her career and personal life, Amy remains dedicated to her passion for health and wellness. She hopes to inspire others to live their best lives and embrace a healthy and positive lifestyle. With her optimistic and inventive nature, there's no doubt that Amy will continue to make a positive impact on those around her."}
{"Name":"Brandy Bailey","Age":22,"Sex":"female","Country of Origin":"USA","State or Province":"New York","Education Level":"No High School","MBTI Personality":"INFJ","Lifestyle":"psychology","Backstory":"Brandy Bailey was born and raised in the bustling city of New York. She grew up in a small apartment in the Bronx with her parents and two younger siblings. From a young age, Brandy was always curious about the human mind and how it works. She would often observe people and try to understand their behaviors and thought processes.\n\nHowever, Brandy's childhood was far from perfect. Her parents struggled with substance abuse and were often absent from her life. This caused Brandy to become independent at a young age and take care of her siblings. She had to work part-time jobs to help support her family, leaving little time for her studies.\n\nDespite her difficult home life, Brandy excelled in school and had a natural talent for psychology. She would spend hours reading books and articles on the subject, determined to understand the complexities of the human mind. However, when she was 16, her parents' addiction took a turn for the worse and they were unable to provide for the family. Brandy had to drop out of high school to work full-time and support her siblings.\n\nBut Brandy never gave up on her dream of becoming a psychologist. She continued to educate herself through online courses and attended seminars whenever she could. She also started a blog where she shared her thoughts and insights on psychology, gaining a small but dedicated following.\n\nAt the age of 22, Brandy's hard work paid off when she landed a job as a receptionist at a psychology clinic in New York City. Despite not having a high school degree, her knowledge and passion for the subject impressed the clinic's director, who gave her a chance. Brandy worked tirelessly, taking on extra responsibilities and learning everything she could from the therapists at the clinic.\n\nOutside of work, Brandy's Instagram became a platform for her to share her love for psychology with the world. Her posts were a mix of inspirational quotes, thought-provoking discussions, and personal reflections. Her followers admired her empathetic outlook towards life and her ability to see the beauty in every individual.\n\nBrandy's dream is to one day become a licensed psychologist and help others overcome their struggles. She knows that her journey may have been unconventional, but she believes that her life experiences have given her a unique perspective on the human mind. Brandy is determined to use her knowledge and passion to make a positive impact on the world."}
{"Name":"Cindy Burgess","Age":31,"Sex":"female","Country of Origin":"USA","State or Province":"Georgia","Education Level":"High School","MBTI Personality":"ISFP","Lifestyle":"gaming","Backstory":"Cindy Burgess was born and raised in a small town in Georgia, USA. Growing up, she was always a curious and creative child, constantly seeking out new adventures and ways to express herself. Her parents, both hard-working blue-collar workers, instilled in her a strong work ethic and the value of education.\n\nIn high school, Cindy was an average student. She didn't excel in any particular subject, but she had a love for art and technology. She spent most of her free time playing video games and creating digital art. Her classmates often teased her for being a \"nerd,\" but Cindy didn't care. She found solace and joy in the virtual worlds she explored and the characters she created.\n\nAfter graduating from high school, Cindy decided to take a break from formal education and focus on her passion for gaming. She started a gaming blog and YouTube channel, where she shared her thoughts and reviews on the latest video games. Her content quickly gained a following, and she became known as a knowledgeable and entertaining gaming influencer.\n\nAt the same time, Cindy also started taking on freelance graphic design projects. Her unique style and eye for detail made her stand out in the crowded market, and she soon had a steady stream of clients.\n\nNow, at 31 years old, Cindy has built a successful career for herself as a content creator and graphic designer. She has a flexible schedule, allowing her to travel and explore new places whenever she wants. Her Instagram feed is a mix of stunning landscapes, artistic creations, and snapshots of her gaming adventures.\n\nWhile Cindy may not fit society's traditional standards of beauty, she embraces her \"average\" appearance and uses it as a way to connect with her followers. She believes that true beauty comes from within and is not defined by societal norms.\n\nCindy's spontaneous and free-spirited nature has led her to some incredible experiences, from hiking through the mountains of Colorado to attending gaming conventions in Japan. She is always open to new challenges and loves to push herself out of her comfort zone.\n\nDespite her success, Cindy remains humble and grounded, never forgetting her roots and the values her parents instilled in her. She hopes to inspire others to follow their passions and embrace their unique selves, just as she has."}
{"Name":"Robert Mccall","Age":29,"Sex":"male","Country of Origin":"Canada","State or Province":"Ontario","Education Level":"Bachelor","MBTI Personality":"ENTP","Lifestyle":"politics","Backstory":"Robert Mccall was born and raised in Toronto, Ontario, Canada. He grew up in a middle-class family, with both of his parents working as teachers. From a young age, Robert showed a keen interest in politics and current affairs. He would often engage in debates with his parents and older siblings, challenging their opinions and seeking to understand different perspectives.\n\nAs he grew older, Robert's passion for politics only intensified. He excelled in his studies and received a Bachelor's degree in Political Science from the University of Toronto. During his time in university, he became heavily involved in various political organizations and campaigns, using his knowledge and skills to make a difference in his community.\n\nAfter graduating, Robert landed a job at a prestigious law firm in downtown Toronto. However, he quickly realized that the corporate world was not for him. He felt stifled and unfulfilled, and his true passion for politics was calling out to him. So, he made the bold decision to quit his job and pursue a career in politics.\n\nStarting from the bottom, Robert worked tirelessly to climb the political ladder. He volunteered for different campaigns, worked as a policy analyst for a local politician, and even ran for a seat in the city council. His hard work and dedication paid off when he was elected as a Member of Provincial Parliament (MPP) at the young age of 29.\n\nRobert's Instagram account reflects his love for politics and his desire to engage in intellectual debates. He uses social media as a platform to share his thoughts and ideas, hoping to inspire and educate others. His striking appearance, with his high cheekbones and sharp features, has also helped him gain a significant following on social media.\n\nDespite his busy schedule as an MPP, Robert always makes time for his family and friends. He values their support and guidance, and they keep him grounded amidst the chaos of politics. He also enjoys traveling and exploring new cultures, which he believes helps him gain a broader perspective on global issues.\n\nRobert Mccall is a young, ambitious, and passionate individual who is determined to make a positive impact on the world through his involvement in politics. He continues to inspire others with his innovative ideas and unwavering dedication to creating a better society for all."}
{"Name":"Andrea Smith","Age":36,"Sex":"female","Country of Origin":"USA","State or Province":"South Carolina","Education Level":"High School","MBTI Personality":"ISFJ","Lifestyle":"health","Backstory":"Andrea Smith was born and raised in a small town in South Carolina, USA. She grew up in a close-knit family, with her parents and older brother. Her parents instilled in her the values of hard work, kindness, and giving back to the community.\n\nGrowing up, Andrea was always a compassionate and empathetic child. She would often volunteer at local shelters and nursing homes, bringing joy to the residents with her bubbly personality and contagious smile. Her love for helping others only grew as she got older.\n\nAfter graduating from high school, Andrea decided to take a break from her studies and travel to different parts of the world. She volunteered at various organizations, helping underprivileged communities and learning about different cultures. This experience opened her eyes to the world's inequalities and strengthened her determination to make a positive impact.\n\nUpon returning home, Andrea enrolled in a community college to pursue a degree in nursing. She wanted to use her skills to help those in need and make a difference in people's lives. While studying, she also worked part-time at a local hospital as a nurse's aide, gaining valuable experience and knowledge.\n\nAfter earning her degree, Andrea started working as a registered nurse at the same hospital. She quickly gained a reputation for her exceptional patient care and her willingness to go above and beyond for her patients. Outside of work, she continued her volunteer work, organizing fundraisers and participating in community service projects.\n\nAt the age of 36, Andrea's passion for health and helping others led her to start her own health and wellness blog and Instagram page. She used these platforms to share her knowledge and promote a healthy lifestyle, inspiring others to take care of their physical and mental well-being. Her altruistic spirit and dedication to her community made her a beloved figure on social media, with many people looking up to her as a role model.\n\nAndrea may have average looks, but her kind heart and selfless nature make her stand out. She continues to spread love and positivity wherever she goes, making the world a better place, one act of kindness at a time."}
{"Name":"Amanda Russell","Age":30,"Sex":"female","Country of Origin":"USA","State or Province":"Florida","Education Level":"High School","MBTI Personality":"INFP","Lifestyle":"food","Backstory":"Amanda Russell was born and raised in the sunny state of Florida, USA. She grew up in a close-knit family, with her parents and younger brother. Her parents were both hardworking individuals, and instilled in her the value of education and following one's passions.\n\nGrowing up, Amanda was always intrigued by the art of cooking. She would spend hours in the kitchen with her mother, experimenting with different ingredients and creating delicious meals. Her love for food only grew stronger as she got older, and she knew that she wanted to make it a part of her life in some way.\n\nAfter graduating from high school, Amanda decided to pursue her passion for food by enrolling in a culinary arts program at a local community college. She excelled in her classes and discovered a natural talent for cooking and creating unique dishes. However, she also realized that her true passion lay in sharing her love for food with others.\n\nWith this in mind, Amanda started her own food blog and Instagram account. She would share her recipes, cooking tips, and food photography with her followers, and soon gained a loyal following. Her imaginative and introspective thoughts about food captured the attention of many, and her Instagram became a canvas for her rich inner world.\n\nDespite her average appearance, Amanda's passion for food and her vibrant personality shone through in every post. She would often use her platform to advocate for sustainable and ethical eating, and her followers admired her for her dedication to the cause.\n\nNow, at 30 years old, Amanda has turned her food blog and Instagram into a successful business. She has published her own cookbook and has even started hosting cooking workshops and events. Her love for food has not only brought her success, but it has also allowed her to connect with people from all over the world who share her passion.\n\nAmanda's journey may have started with a high school degree, but her determination, creativity, and love for food have taken her on a path she never could have imagined. She continues to inspire others to follow their passions and to see the beauty in the simple things, just like she does with her food."}
{"Name":"Michelle Carter","Age":25,"Sex":"female","Country of Origin":"USA","State or Province":"Virginia","Education Level":"High School","MBTI Personality":"ISFP","Lifestyle":"cooking","Backstory":"Michelle Carter was born and raised in the charming town of Richmond, Virginia. From a young age, she was always drawn to the kitchen, watching her mother cook up delicious meals for the family. Her mother, a chef at a local restaurant, instilled in Michelle a love for cooking and an appreciation for fresh, seasonal ingredients.\n\nAs she grew older, Michelle's passion for cooking only intensified. She spent countless hours experimenting in the kitchen, creating unique and flavorful dishes that impressed her family and friends. Her high school years were filled with culinary classes and extracurricular activities, solidifying her dream of becoming a chef.\n\nAfter graduating high school with top honors, Michelle decided to pursue her culinary dreams by attending a prestigious culinary school in New York City. It was there that she honed her skills and developed her own unique style of cooking. Her dishes were not only delicious, but they were also visually stunning, earning her the nickname \"The Artistic Chef\" among her classmates.\n\nUpon completing her degree, Michelle returned to her hometown of Richmond to start her career. She landed a job as a sous chef at a popular restaurant and quickly made a name for herself in the culinary world. Her dishes were a hit among the customers, and her creative flair and passion for cooking were evident in every dish she served.\n\nOutside of the kitchen, Michelle's love for art and creativity continued to flourish. She started an Instagram account to showcase her culinary creations, using her platform to not only share her love for cooking but also to promote the use of fresh and locally sourced ingredients.\n\nAt 25 years old, Michelle has become a rising star in the culinary world. Her Instagram account has gained a large following, with people from all over the world admiring her colorful and artistic dishes. She continues to push the boundaries of traditional cooking, always looking for new ways to incorporate her love for art into her dishes.\n\nWith her passion, talent, and determination, Michelle Carter is on her way to becoming one of the most renowned chefs in the country. And as she continues to share her love for cooking and creativity with the world, there's no doubt that she will leave a lasting impression on the culinary industry."}
{"Name":"Tammy Smith","Age":35,"Sex":"female","Country of Origin":"USA","State or Province":"Indiana","Education Level":"Master","MBTI Personality":"INTP","Lifestyle":"astrology","Backstory":"Tammy Smith was born and raised in a small town in Indiana, USA. She was always a curious child, constantly questioning the world around her and seeking answers to life's mysteries. This curiosity led her to develop a deep interest in astrology from a young age.\n\nGrowing up, Tammy was always seen as a bit of an outsider. While her peers were focused on the latest trends and popular culture, Tammy was more interested in the stars and the patterns they created in the night sky. She spent countless nights studying constellations and reading about the zodiac signs, trying to understand the deeper meanings behind them.\n\nAs she got older, Tammy's passion for astrology only grew stronger. She pursued a Bachelor's degree in Astronomy, determined to learn everything she could about the universe and its cosmic energies. After completing her undergraduate studies, she went on to earn a Master's degree in Astrology, specializing in the study of planetary alignments and their impact on human behavior.\n\nWith her extensive knowledge and understanding of astrology, Tammy started to gain a following on social media. She used her Instagram as a platform to share her insights and interpretations of astrological events, gaining a loyal following of like-minded individuals who were drawn to her unique perspective and deep understanding of the subject.\n\nDespite her academic achievements and growing online presence, Tammy still maintained a low profile in her personal life. She was content with her small circle of friends and preferred to spend her free time stargazing and reflecting on the mysteries of the universe.\n\nMany described Tammy as having average beauty and an average face, but her inner beauty and intelligence shone through in everything she did. She was a free spirit, unafraid to explore complex theories and abstract concepts, often challenging societal norms and encouraging others to think outside the box.\n\nToday, at 35 years old, Tammy continues to share her passion for astrology with the world through her social media presence. She hopes to inspire others to embrace their unique interests and perspectives, and to never stop questioning the world around them."}
{"Name":"Luke Hodges","Age":26,"Sex":"male","Country of Origin":"USA","State or Province":"North Carolina","Education Level":"High School","MBTI Personality":"ENTJ","Lifestyle":"politics","Backstory":"Luke Hodges was born and raised in a small town in North Carolina, USA. From a young age, he was always interested in politics and the power dynamics within society. Growing up in a working-class family, Luke witnessed firsthand the struggles and challenges faced by his community. This sparked a fire within him to make a difference and create a better future for those around him.\n\nIn high school, Luke was known for his sharp mind and natural leadership skills. He excelled in his studies, particularly in history and government classes, where he would often engage in lively debates with his classmates. Luke's classmates admired his ability to articulate his thoughts and opinions with such passion and conviction.\n\nAfter graduating from high school, Luke decided to pursue a degree in political science at a local university. During his time there, he became heavily involved in campus politics, organizing rallies and advocating for various causes. His dedication and strategic thinking caught the attention of the university's faculty and his fellow students, earning him a reputation as a rising star in the political world.\n\nUpon graduating with his Bachelor's degree, Luke landed a job as a campaign manager for a local politician. He quickly proved himself to be a valuable asset, leading his candidate to victory in the upcoming election. Luke's success caught the eye of other politicians, and he was soon offered a position as a political strategist for a major political party.\n\nAt the young age of 26, Luke has already made a name for himself in the world of politics. His Instagram account, filled with posts about leadership and long-term planning, has gained a significant following, with many young people looking up to him as a role model. Luke's striking appearance, with his high cheekbones and commanding presence, only adds to his allure and charisma.\n\nThough he may be young, Luke's passion and drive for creating positive change in the world are unmatched. He continues to use his platform and skills to fight for the issues he believes in and inspire others to do the same. With his sharp mind and strategic mindset, there's no doubt that Luke Hodges is destined for great things in the world of politics."}
{"Name":"Susan Gonzales","Age":26,"Sex":"female","Country of Origin":"Canada","State or Province":"Ontario","Education Level":"Bachelor","MBTI Personality":"INTP","Lifestyle":"engineering","Backstory":"Susan Gonzales was born and raised in a small town in Ontario, Canada. From a young age, she showed a natural curiosity and aptitude for understanding how things worked. She would often spend hours tinkering with toys and gadgets, trying to figure out how they were put together and how they functioned.\n\nAs she got older, Susan's love for engineering only grew stronger. She excelled in math and science classes, and her teachers encouraged her to pursue a career in the field. With their support and her determination, Susan went on to study engineering at a prestigious university, earning her Bachelor's degree at the young age of 22.\n\nDuring her time at university, Susan's passion for engineering only intensified. She spent countless hours in the lab, conducting experiments and working on projects that challenged her to think outside the box. Her professors were impressed by her innovative ideas and her ability to grasp complex theories.\n\nAfter graduating, Susan landed a job at a top engineering firm in Toronto. She quickly made a name for herself with her exceptional problem-solving skills and her ability to come up with creative solutions to complex problems. Her colleagues were in awe of her intelligence and her passion for her work.\n\nOutside of her career, Susan's Instagram and lifestyle reflect her love for engineering. Her feed is a mix of stunning photos of her travels and adventures, along with snapshots of her latest engineering projects. She uses her platform to share her knowledge and ideas, often exploring abstract concepts and theories that fascinate her.\n\nMany have described Susan as having above-average beauty, but she never let that distract her from her true passion. She is a strong, independent woman who is not afraid to challenge societal norms and stereotypes. She believes that everyone, regardless of their appearance, has the potential to achieve greatness.\n\nAt 26 years old, Susan is just getting started in her engineering career. She dreams of one day starting her own engineering firm and using her skills to make a positive impact on the world. With her determination, intelligence, and passion, there's no doubt that she will achieve all of her goals and more."}
{"Name":"Crystal Mckinney","Age":34,"Sex":"female","Country of Origin":"USA","State or Province":"Indiana","Education Level":"PhD","MBTI Personality":"INFJ","Lifestyle":"psychology","Backstory":"Crystal Mckinney was born and raised in a small town in Indiana, USA. From a young age, she was always fascinated by the complexities of the human mind and behavior. Her parents were both teachers, and they instilled in her a love for learning and a strong work ethic.\n\nGrowing up, Crystal was an average student, but she excelled in her psychology classes. She was always eager to understand why people think and act the way they do. Her passion for psychology only grew stronger as she got older, and she knew from a young age that she wanted to pursue a career in this field.\n\nAfter graduating from high school, Crystal attended a prestigious university, where she earned her Bachelor's degree in Psychology with top honors. She then went on to pursue her Master's degree in Clinical Psychology, where she specialized in trauma and mental health disorders. Her dedication and hard work paid off when she graduated at the top of her class and was awarded a full scholarship to continue her education.\n\nCrystal then went on to earn her PhD in Psychology, focusing her research on the effects of trauma on the brain and the development of effective treatment methods. She was determined to use her knowledge and expertise to help those who were struggling with mental health issues.\n\nAfter completing her studies, Crystal returned to her hometown and opened her own private practice. She quickly gained a reputation as a compassionate and skilled therapist, helping her clients overcome their traumas and live happier, healthier lives.\n\nIn her free time, Crystal enjoys using her knowledge and platform to educate others about mental health and promote a more empathetic and understanding society. Her Instagram page is a reflection of her passion for psychology, as she shares inspirational and thought-provoking posts that aim to spread awareness and promote self-care.\n\nDespite her academic achievements, Crystal remains humble and down-to-earth. She describes herself as having average beauty and an average face, but her inner beauty and intelligence shine through in everything she does.\n\nCrystal's ultimate goal is to create a world where mental health is taken seriously and those struggling with mental health issues are met with empathy and understanding. Through her work and her online presence, she hopes to inspire others to pursue their passions and make a positive impact on the world."}
{"Name":"Alexander Berg","Age":21,"Sex":"male","Country of Origin":"USA","State or Province":"Virginia","Education Level":"No High School","MBTI Personality":"ISTP","Lifestyle":"gardening","Backstory":"Alexander Berg was born and raised in a small town in Virginia, USA. He was the youngest of three siblings and from a young age, he was always drawn to the outdoors and nature. His parents were both avid gardeners and they instilled in him a love for plants and gardening.\n\nGrowing up, Alexander struggled with traditional schooling and found it difficult to focus in a classroom setting. He often felt like he didn't fit in and was labeled as a troublemaker by his teachers. Despite this, he always had a curious mind and loved to learn through hands-on experiences.\n\nAt the age of 16, Alexander dropped out of high school. His parents were disappointed, but they understood that he needed a different approach to learning. With their support, Alexander began to explore different hobbies and interests. It was during this time that he discovered his passion for gardening.\n\nAlexander spent hours in his family's garden, experimenting with different plants and techniques. He also started documenting his journey on social media, sharing his love for gardening with the world. His practical challenges and hands-on projects caught the attention of many, and soon his Instagram account gained a large following.\n\nDespite not having a high school degree, Alexander's natural talent and passion for gardening led him to start his own landscaping business. He used his problem-solving skills to create beautiful and functional outdoor spaces for his clients, and his business quickly grew.\n\nNow, at the age of 21, Alexander is a successful entrepreneur and influencer in the gardening community. He is known for his above average beauty and face, which often catches people off guard as they expect a rugged and dirty gardener. But Alexander is proud to break stereotypes and show that anyone can have a green thumb.\n\nThrough his social media presence, Alexander continues to inspire others to follow their passions and think outside the box. He may not have a traditional education, but his love for gardening has taught him valuable lessons and opened up endless opportunities. Alexander's journey is a reminder that sometimes the path less traveled can lead to the most beautiful destinations."}
{"Name":"Jennifer Robertson","Age":25,"Sex":"female","Country of Origin":"USA","State or Province":"Wisconsin","Education Level":"Bachelor","MBTI Personality":"ISTP","Lifestyle":"diy","Backstory":"Jennifer Robertson was born and raised in a small town in Wisconsin, USA. Growing up, she was always fascinated by the process of creating things with her own two hands. Her parents, both artists, encouraged her creativity and she spent most of her childhood tinkering with various crafts and projects.\n\nAs she got older, Jennifer's love for DIY only grew stronger. She was always the go-to person among her friends and family for any home improvement or crafting needs. She would spend hours on end in her garage, turning old furniture into beautiful pieces and creating unique home decor items.\n\nDespite her passion for DIY, Jennifer's parents always emphasized the importance of education. She excelled in school and went on to pursue a Bachelor's degree in Fine Arts, with a focus on sculpture and woodworking.\n\nAfter graduating, Jennifer moved to the city to pursue her dream of becoming a professional artist. She landed a job at a local art gallery, where she was able to showcase her talents and learn from other artists.\n\nHowever, Jennifer's true love for DIY never faded. In her free time, she would document her projects and share them on her Instagram account, which quickly gained a large following. Her unique and skillful approach to DIY caught the attention of many, and she soon became known as the go-to person for all things DIY.\n\nAt the age of 25, Jennifer has established herself as a successful DIY influencer and has even started her own business, offering DIY workshops and selling her handmade creations. Her Instagram and lifestyle reflect her passion for DIY, with her feed filled with beautiful and inspiring projects.\n\nDespite her above average beauty and face, Jennifer remains humble and down to earth. She believes that anyone can learn to create and that the satisfaction of making something with your own hands is unmatched.\n\nIn the future, Jennifer hopes to continue inspiring others to embrace their creativity and pursue their passions, just like she did. She believes that DIY is not just about creating tangible items, but also about building confidence and a sense of accomplishment."}
{"Name":"David Carter","Age":19,"Sex":"male","Country of Origin":"USA","State or Province":"North Carolina","Education Level":"High School","MBTI Personality":"INFJ","Lifestyle":"lifestyle","Backstory":"David Carter was born and raised in a small town in North Carolina, USA. Growing up, he was always a bright and curious child, constantly questioning the world around him and seeking to understand the deeper meaning behind everything. His parents, both teachers, encouraged his curiosity and nurtured his love for learning.\n\nIn high school, David excelled academically and was involved in various extracurricular activities, including the school newspaper and debate team. However, it was his passion for photography that truly set him apart. David had a natural eye for capturing beautiful moments and his Instagram account quickly gained a large following as he shared his stunning photos with the world.\n\nDespite his academic success, David struggled with feelings of purposelessness and a lack of direction. He often found himself questioning the traditional path of going to college and getting a job, feeling that there must be more to life than just following the expected path.\n\nIt wasn't until his senior year of high school that David had a defining moment that would shape the rest of his life. He stumbled upon a documentary about sustainable living and the impact of human actions on the environment. This sparked a deep passion within him to make a positive difference in the world.\n\nAfter graduating high school with top honors, David decided to take a gap year before college to travel and volunteer with various environmental organizations. During this time, he witnessed firsthand the devastating effects of climate change and the importance of taking action to protect our planet.\n\nThrough his travels and experiences, David's perspective on life shifted. He realized that true happiness and fulfillment came from living a purpose-driven life, rather than just pursuing material success. This realization inspired him to use his photography and social media platform to spread awareness and inspire others to make positive changes in their own lives and the world.\n\nNow, at 19 years old, David has become a prominent figure in the sustainability and lifestyle community. His Instagram account is filled with inspiring posts and deep insights, showcasing his passion for living a conscious and mindful life. He continues to travel and volunteer, using his platform to educate and empower others to join him in creating a better world for future generations. With his high beauty and an high face, David is not only a role model for his peers, but also a beacon of hope for a brighter future."}
{"Name":"Carrie Farmer","Age":22,"Sex":"female","Country of Origin":"USA","State or Province":"Missouri","Education Level":"High School","MBTI Personality":"ENFP","Lifestyle":"vlogging","Backstory":"Carrie Farmer was born and raised in a small town in Missouri, USA. She was the youngest of three siblings and was always the center of attention with her bubbly personality and infectious energy. Growing up, Carrie was always interested in trying new things and expressing herself creatively. She was involved in various school activities, from drama club to dance team, and was known for her outgoing nature and ability to make anyone laugh.\n\nDespite being popular among her peers, Carrie struggled with her self-confidence. She was constantly comparing herself to others and felt like she didn't fit in with the traditional beauty standards of her small town. However, she found solace in creating videos and sharing her thoughts and experiences online. She started a YouTube channel in high school where she would vlog about her daily life, fashion, and beauty tips.\n\nAfter graduating from high school, Carrie decided to pursue her passion for vlogging full-time. She moved to Los Angeles, determined to make a name for herself in the digital world. With her natural charisma and eye-catching appearance, she quickly gained a following on social media. Her Instagram account became a platform for her to showcase her unique style and adventurous lifestyle.\n\nCarrie's content was a mix of fashion, travel, and self-love. She used her platform to spread positivity and inspire others to embrace their individuality. Her followers were drawn to her authenticity and relatability, and she became a role model for young girls who struggled with self-esteem issues.\n\nDespite her success, Carrie remained humble and grounded. She never forgot her small-town roots and often visited her family in Missouri. She also used her platform to raise awareness for important social issues and collaborated with various charities to give back to her community.\n\nAt the age of 22, Carrie had already achieved more than she ever imagined. She had a high school degree, but her passion for vlogging and her determination to make a positive impact in the world had taken her far. She was grateful for the opportunities she had been given and looked forward to what the future held for her. With her vibrant personality and above average beauty, Carrie was ready to take on the world and continue inspiring others with her content."}
{"Name":"Janet Clark","Age":29,"Sex":"female","Country of Origin":"USA","State or Province":"New Jersey","Education Level":"High School","MBTI Personality":"ESTP","Lifestyle":"outdoors","Backstory":"Janet Clark was born and raised in a small town in New Jersey, USA. Growing up, she was always surrounded by nature and spent most of her childhood exploring the woods and nearby lakes. Her parents, both avid hikers and nature enthusiasts, instilled in her a love for the outdoors from a young age.\n\nDespite her love for nature, Janet was always a bit of a rebel in high school. She was never interested in the typical teenage activities like parties and gossip. Instead, she spent her free time hiking, camping, and rock climbing with a small group of friends who shared her passion for adventure.\n\nAfter graduating from high school, Janet wasn't sure what she wanted to do with her life. She briefly attended community college but dropped out after a year, feeling unfulfilled and wanting something more. She took odd jobs here and there, never staying in one place for too long.\n\nIt wasn't until she turned 25 that Janet discovered her true calling. She stumbled upon a group of outdoor enthusiasts on social media and was immediately drawn to their lifestyle. She began following their adventures and was inspired to start her own outdoor journey. She saved up enough money to buy a van and converted it into a tiny home, allowing her to travel and explore different parts of the country.\n\nJanet's Instagram quickly gained a following as she shared her experiences and breathtaking photos of her travels. Her posts were a mix of adrenaline-fueled activities like bungee jumping and skydiving, as well as peaceful moments spent camping under the stars or hiking through serene landscapes.\n\nNow, at 29 years old, Janet has made a name for herself in the outdoor community. She's become known for her fearlessness and zest for life, inspiring others to step out of their comfort zones and embrace the beauty of nature. Despite her average appearance, Janet's energy and passion for life make her stand out in a crowd.\n\nWhile some may see her as a free spirit, Janet knows that her love for the outdoors is more than just a hobby. It's a way of life that has brought her peace, happiness, and a sense of purpose. And she plans to continue living life on her own terms, one adventure at a time."}
{"Name":"Angel Williams","Age":27,"Sex":"female","Country of Origin":"Canada","State or Province":"Quebec","Education Level":"Bachelor","MBTI Personality":"INFJ","Lifestyle":"psychology","Backstory":"Angel Williams was born and raised in the beautiful city of Quebec, Canada. She was the only child of a loving and supportive family. From a young age, Angel showed a keen interest in understanding the human mind and behavior. She was always fascinated by the complexities of the human psyche and was determined to pursue a career in psychology.\n\nAfter completing her high school education, Angel went on to pursue a Bachelor's degree in Psychology from the prestigious McGill University in Montreal. Her time at university was transformative, as she delved deeper into the subject and honed her skills in understanding and analyzing human behavior. She graduated with top honors, and her professors were impressed by her insightful ideas and empathetic approach towards her studies.\n\nFollowing her graduation, Angel landed a job at a renowned mental health institute in Quebec. She worked tirelessly, helping patients with various mental health issues, and her dedication and passion for her work soon earned her a reputation as a skilled and compassionate therapist. Her clients found solace in her calming presence and her ability to listen and understand their struggles.\n\nOutside of work, Angel's Instagram account was a reflection of her true self. She used the platform to share her thoughts on psychology and mental health, in hopes of spreading awareness and breaking the stigma surrounding these topics. Her posts were thought-provoking and often went viral, attracting a large following of like-minded individuals who resonated with her ideas.\n\nWith her slightly above average beauty and face, Angel's Instagram also showcased her love for fashion and travel. She believed that self-care and exploration were essential for maintaining good mental health, and she made sure to prioritize these in her own life.\n\nAt 27 years old, Angel had found her true calling in life. Her passion for psychology and her desire to make a positive impact on the world drove her to constantly learn and grow. She was a kind and compassionate soul, with a vision to create a world where mental health was given the importance and attention it deserved."}
{"Name":"Angela Robbins","Age":31,"Sex":"female","Country of Origin":"USA","State or Province":"Arizona","Education Level":"Bachelor","MBTI Personality":"ESFJ","Lifestyle":"parenting","Backstory":"Angela Robbins was born and raised in the desert state of Arizona, USA. She was the youngest of three siblings and grew up in a close-knit family. From a young age, Angela showed a strong interest in nurturing and caring for others, particularly children. She would often spend hours playing and looking after her younger cousins and neighbors, earning her the nickname \"the little mama\" among her family and friends.\n\nAs she got older, Angela's passion for parenting only grew stronger. She excelled in school and graduated with a Bachelor's degree in Child Development. Her dream was to become a teacher and make a positive impact on the lives of children. However, life had other plans for her.\n\nAt the age of 23, Angela unexpectedly became pregnant with her first child. While it was not part of her plan, she embraced the role of motherhood with open arms and poured all her love and attention into raising her child. Her natural maternal instincts and nurturing personality made her a natural at parenting, and she quickly became known as the go-to mom among her friends and family.\n\nAs her children grew, Angela's circle of friends expanded to include other parents and families. She became a pillar of support and guidance for her peers, offering advice and lending a helping hand whenever needed. Her calm and harmonious nature made her the glue that held her social circle together.\n\nAngela's Instagram and lifestyle reflect her passion for parenting. She uses her platform to share her experiences as a mother and offer tips and tricks to other parents. Her followers admire her for her relatable content and appreciate her positive and supportive approach to parenting.\n\nDespite facing challenges and setbacks along the way, Angela remains grateful for her journey and the family she has built. She continues to inspire others through her love for parenting and her unwavering dedication to her children and those around her. At 31 years old, Angela Robbins may have an average appearance, but her extraordinary love for her family and her role in her social circle make her anything but average."}
{"Name":"Michelle Cowan","Age":21,"Sex":"female","Country of Origin":"USA","State or Province":"Texas","Education Level":"No High School","MBTI Personality":"ESTP","Lifestyle":"fitness","Backstory":"Michelle Cowan grew up in a small town in Texas, raised by her single mother who worked long hours to make ends meet. Michelle's father had left when she was just a baby, leaving her mother to juggle multiple jobs to support them. Despite the financial struggles, Michelle's mother always made sure to instill in her daughter the importance of hard work and determination.\n\nMichelle was always a bright and active child, excelling in sports and always pushing herself to be the best. However, as she entered her teenage years, her focus shifted from athletics to hanging out with friends and partying. She started skipping school and getting into trouble, causing her grades to suffer. Eventually, she dropped out of high school in her junior year.\n\nFeeling lost and directionless, Michelle turned to drugs and alcohol to cope with her feelings of inadequacy. Her relationship with her mother became strained, and she began to distance herself from her family and friends. It wasn't until she hit rock bottom that Michelle realized she needed to make a change.\n\nWith the support of her mother, Michelle checked herself into rehab and started to turn her life around. She found solace and strength in fitness, using it as a way to channel her energy and emotions in a positive way. She also discovered a love for photography and started sharing her fitness journey on Instagram.\n\nAs she continued to work on herself and her physical and mental health, Michelle's Instagram following grew. People were drawn to her infectious energy and positive outlook on life. She started to receive messages from followers who were inspired by her story and her transformation.\n\nNow, at 21 years old, Michelle has become a successful fitness influencer, traveling the world and collaborating with various fitness brands. She has also obtained her personal training certification and is working towards opening her own gym one day. Michelle's journey has not been easy, but she has learned to embrace her past and use it as motivation to continue pushing herself to be the best version of herself."}
{"Name":"Martha Lewis","Age":22,"Sex":"female","Country of Origin":"USA","State or Province":"New Jersey","Education Level":"High School","MBTI Personality":"ESFJ","Lifestyle":"dancing","Backstory":"Martha Lewis was born and raised in a small town in New Jersey, USA. Growing up, she was always a free spirit, with a passion for music and dance. Her parents were both strict and traditional, and they constantly pushed her to focus on her studies and pursue a more conventional career path. However, Martha's heart was set on dancing, and she would often sneak out of the house to attend dance classes and competitions.\n\nDespite her parents' disapproval, Martha's talent and dedication to dancing could not be ignored. She excelled in every class and performance, and her love for the art only grew stronger with each passing day. She knew that dancing was her true calling, and she was determined to make a career out of it.\n\nAfter graduating from high school, Martha faced a tough decision. Her parents wanted her to attend a prestigious university and pursue a degree in business, but Martha knew that her heart belonged to dancing. She made the brave decision to follow her dreams and enrolled in a dance academy in New York City. It was a challenging journey, but Martha's hard work and determination paid off when she graduated with top honors.\n\nWith her high school degree and dance training, Martha was ready to take on the world. She moved back to her hometown in New Jersey and started teaching dance classes to children and teenagers. Her classes were a huge hit, and she quickly gained a reputation as a talented and passionate teacher. Martha's students not only learned how to dance but also gained confidence and a sense of community through her classes.\n\nIn her free time, Martha would often post videos of her dancing on Instagram. Her followers were blown away by her grace and talent, and her posts quickly gained popularity. Soon, Martha's Instagram became a platform for her to share her love for dance and inspire others to pursue their passions.\n\nToday, at 22 years old, Martha is a successful dance teacher and influencer. Her Instagram and lifestyle reflect her passion for dance and her commitment to building a supportive community. She is known for her high beauty and high energy, and her students and followers look up to her as a role model. Martha's journey to follow her dreams was not easy, but she believes that it was worth it to be able to do what she loves every day."}
{"Name":"Paul Padilla","Age":23,"Sex":"male","Country of Origin":"USA","State or Province":"California","Education Level":"Bachelor","MBTI Personality":"ESTJ","Lifestyle":"law","Backstory":"Paul Padilla was born and raised in the sunny state of California, USA. He grew up in a tight-knit family, with both of his parents being successful lawyers. From a young age, Paul was exposed to the world of law and justice, and it quickly became his passion. He was always intrigued by the complexities of the legal system and the power it had to bring about change and justice.\n\nAs he grew older, Paul's interest in law only intensified. He excelled in his studies, always striving for perfection and never settling for anything less than his best. He graduated from high school with top honors and went on to attend the prestigious University of California, Berkeley. There, he pursued a Bachelor's degree in Political Science, with a focus on Constitutional Law.\n\nDuring his time at Berkeley, Paul's love for law only grew stronger. He was known among his peers as a dedicated and hardworking student, always willing to help others understand complex legal concepts. His professors were impressed by his intellect and passion for the subject, and they often encouraged him to pursue a career in law.\n\nAfter graduating with flying colors, Paul decided to take a gap year to travel and gain some real-world experience before applying to law school. During this time, he explored different cultures and immersed himself in new experiences, but his passion for law never wavered. He used this time to intern at a law firm, where he gained valuable insights into the practical side of the legal profession.\n\nWith his gap year coming to an end, Paul returned to California and applied to law school. He was accepted into his dream school, Yale Law School, and he couldn't be more thrilled. He threw himself into his studies, determined to become the best lawyer he could be.\n\nNow, at 23 years old, Paul is on the cusp of graduating from law school with top honors. His social media presence reflects his passion for law, with posts about legal news and updates, as well as showcasing his responsible and orderly nature. With his sharp mind, pragmatic approach, and methodical thinking, Paul is ready to take on the world of law and make a difference in the lives of others. He may have a very high beauty and face, but it is his intelligence and determination that truly sets him apart."}
{"Name":"Jonathan Carlson","Age":32,"Sex":"male","Country of Origin":"USA","State or Province":"Kentucky","Education Level":"High School","MBTI Personality":"ISTP","Lifestyle":"photography","Backstory":"Jonathan Carlson was born and raised in the small town of Lexington, Kentucky. He was the youngest of three siblings and always had a love for capturing moments through photography. His parents were both hardworking individuals, his father a mechanic and his mother a nurse. They instilled in Jonathan the importance of hard work and determination.\n\nGrowing up, Jonathan was always the one behind the camera, capturing every family event and vacation. He had a natural eye for photography and his photos always stood out from the rest. In high school, he took a photography class and fell even more in love with the art. His teacher recognized his talent and encouraged him to pursue it further.\n\nAfter graduating high school, Jonathan decided to take a gap year to travel and explore different cultures. He took his camera with him everywhere he went, capturing the beauty of each place he visited. It was during this time that he realized his true passion for travel photography.\n\nAt the age of 20, Jonathan enrolled in a community college to study photography. He worked hard and excelled in his classes, eventually earning his High School degree. After college, he decided to open his own photography business, specializing in travel and landscape photography.\n\nHis business quickly took off, and he gained a following on social media for his stunning photos from all around the world. Jonathan's Instagram feed became a visual diary of his adventures, with followers admiring his skillful handling of tangible tasks and immediate challenges in capturing the perfect shot.\n\nNow, at the age of 32, Jonathan has traveled to over 50 countries, capturing breathtaking images that have been featured in magazines and galleries. He continues to inspire others with his passion for photography and his love for exploring new places.\n\nDespite his success, Jonathan remains humble and grounded, always reminding himself of his parents' hard work and determination that helped him get to where he is today. He hopes to continue traveling and capturing the beauty of the world through his lens, sharing it with others and inspiring them to follow their dreams."}
